city,article_title,article_date,article_source,city_source,paragraph_text,keywords_matched
kalamazoo,STATE-BY-STATE,2018-02-14T00:00:00Z,Dayton Daily News (Ohio),Kalamazoo Gazette,"GEORGIA Atlanta Prolonged cold weather and the closing of a downtown shelter have produced a spike in homeless people spending nights at Hartsfield-Jackson airport, The Atlanta Journal-Constitution reports.",homeless
kalamazoo,STATE-BY-STATE,2018-02-14T00:00:00Z,Dayton Daily News (Ohio),Kalamazoo Gazette,HAWAII Honolulu Officials are getting complaints that Puuhonua O Waianae homeless camp residents dump human waste into Pokai Bay.,homeless
kalamazoo,GLOBAL - BANKING - UPDATED 5 DECEMBER 2019,2019-12-05T00:00:00Z,Industry SnapShot,WKZO,TD Group US Holdings LLC - TD Bank Provides 15.6 Million Loan for Construction of Affordable Housing for Homeless  25112019,"homeless, affordable housing"
kalamazoo,GLOBAL - BANKING - UPDATED 5 DECEMBER 2019,2019-12-05T00:00:00Z,Industry SnapShot,WKZO,"70-unit development will provide supportive and affordable housing options in Jamaica, Queens",affordable housing
kalamazoo,GLOBAL - BANKING - UPDATED 5 DECEMBER 2019,2019-12-05T00:00:00Z,Industry SnapShot,WKZO,"New York City residents facing homelessness with behavioral health concerns and the elderly, will now have a new place to call home in Jamaica, Queens",homelessness
kalamazoo,Trump makes 90 false claims during final two weeks of 2019,2020-01-04T00:00:00Z,CNN Wire,WKZO,"Alleging environmental violations related to San Franciscos population of homeless people and people who inject drugs, Trump said, And we fined San Francisco -- and Los Angeles and San Francisco. But weve just sent them a tremendous dollar fine for what theyre doing. -- December 18 campaign rally in Battle Creek, Michigan",homeless
kalamazoo,Trump makes 90 false claims during final two weeks of 2019,2020-01-01T00:00:00Z,CNN.com,WKZO,"Alleging environmental violations related to San Franciscos population of homeless people and people who inject drugs, Trump said, And we fined San Francisco -- and Los Angeles and San Francisco. But weve just sent them a tremendous dollar fine for what theyre doing. -- December 18 campaign rally in Battle Creek, Michigan",homeless
kalamazoo,Let's Pause To Appreciate The Highlight Reel Of Buffoonery By Whitmer's Would-Be Kidnappers,2020-10-19T00:00:00Z,Talking Points Memo,WWMT,"One picture released by the U.S. Attorneys Office for the Western District of Michigan shows an alleged plotter using binoculars to peer across a lake at Whitmers vacation home. Authorities say the men discussed escaping with Whitmer by boat and even mulled leaving her in the middle of Lake Michigan8.U.S. Attorneys Office for the Western District of Michigan Drive-By PhotographyThe men also allegedly documented themselves driving right by the governors house on two separate occasions, taking photos as they went. As an FBI agents affidavit9 notes, the group allegedly performed the first of two drive-by stake outs of Whitmers vacation home on Aug. 29  when they allegedly took photographs and slow-motion video from their vehicle as they drove by it, and discussed conducting additional surveillance from the water at a later date. Those photos and videos ended up in the groups encrypted messaging channel10  which are usually pretty secure, unless theyve been infiltrated by a federal informant.U.S. Attorneys Office for the Western District of Michigan U.S. Attorneys Office for the Western District of Michigan Emojis And GIFs Still CountProsecutors allege that the men relied at times on coded language  such as referring to explosives as cupcakes  but text message conversations released by prosecutors show a new level of buffoonery. In one instance, in a group chat11 that involved an FBI source, the alleged conspirators used emojis and .gifs from Borat and Inglorious Basterds to illustrate their excitement at stalking the governor and, potentially, blowing up a bridge in order to slow police response.U.S. Attorneys Office for the Western District of Michigan U.S. Attorneys Office for the Western District of Michigan U.S. Attorneys Office for the Western District of Michigan Cartographic Paper TrailDefendant Adam Fox, prosecutors allege, even hand-drew a map of Whitmers vacation home that included estimated police response times. The FBIs source allegedly captured a picture of what the government says is Fox drawing that map, as well as the map itself.U.S. Attorneys Office for the Western District of MichiganVacuum Shop ShenanigansFox, the alleged ringleader of the kidnapping plot, lived for much of the past year in the basement of a vacuum cleaner repair shop, sharing the space with his two dogs and plenty of spare vacuum parts. The stores owner, Briant Titus, told TPM Wednesday12 that Fox kept the alleged plot hidden from him  because he knew hed be homeless otherwise. But Fox appears to have filmed footage of himself training in that same shop basement. embedded content Training Videos From A PT CruiserPlenty of armed groups take part in training exercises, often involving target practice, medic training and the like.But the jabronis accused of plotting the governors kidnapping managed to make even this look ridiculous, given their alleged choice of vehicle A gosh darn PT Cruiser13.BREAKING Today FOX1714 obtained new FBI docs in an alleged plot to kidnap Michigan GovWhitmer15 - the docs lay out tactical training, surveillance, and violent threats against lawmakers and police officers.. pic.twitter .comkYNkf0F5pK16  Doug Reardon ReardonReports October 16, 202017  1 .comnews202010released-photos-and-videos-offer-look-at-training-weaponry-in-alleged-gov-whitmer-kidnapping-plot.html  2  3  4  5  6  7  8  9  10 from_embed  11  12  13  14  15  16  17",homeless
