city,article_title,article_date,article_source,city_source,paragraph_text,keywords_matched
southbend,"Indiana woman makes blankets, care packages for the homeless",2022-02-12T00:00:00Z,Associated Press State & Local,South Bend Tribune,"I remember when I was around 8, we would go through our clothes for the winter time and see what we had, she said. Extra hats, gloves, whatever we can donate, and we would all go down to the homeless shelter and give that to them.",homeless
southbend,"Indiana woman makes blankets, care packages for the homeless",2022-02-12T00:00:00Z,Associated Press State & Local,South Bend Tribune,Shes enlisted the help of her parents and her boyfriend to make homemade blankets and care baskets for the homeless in South Bend. She even set up a GoFundMe page to help raise money to purchase the supplies.,homeless
southbend,"Indiana woman makes blankets, care packages for the homeless",2022-02-12T00:00:00Z,Associated Press State & Local,South Bend Tribune,That is when Alexis decided to make the blankets and give them to the homeless.,homeless
southbend,EXCHANGE: Developers move forward with hotel to lofts rehab,2015-12-11T00:00:00Z,Associated Press State & Local,South Bend Tribune,"While anyone who qualifies for affordable housing can apply for residency at the hotel, preference is given to artists.",affordable housing
southbend,'Tiny' shelters aim to help northern Indiana city's homeless,2021-04-29T00:00:00Z,Associated Press State & Local,South Bend Tribune,"The Faith Mission of Michiana and the Crossing School of Business amp Entrepreneurship broke ground last week on a 300,000 effort to provide short-term housing for homeless people in and around Elkhart.",homeless
southbend,"Gloves, scarves offered for free to those in need",2016-01-28T00:00:00Z,Associated Press State & Local,South Bend Tribune,A homeless man came up to her while she was hanging more.,homeless
southbend,"Gloves, scarves offered for free to those in need",2016-01-28T00:00:00Z,Associated Press State & Local,South Bend Tribune,"Anyone familiar with harsh Midwestern winter conditions can appreciate how difficult it is for people living on the streets, especially overnight, to stay warm, said Emily Sims, director of events for South Bends Center for the Homeless. Efforts such as Edwards that provide help that doesnt have to be searched out, Sims said, is just such a kindness.",homeless
southbend,"Gloves, scarves offered for free to those in need",2016-01-28T00:00:00Z,Associated Press State & Local,South Bend Tribune,"The Warming Tree Project has hung more than 100 bags in trees around the downtown area and Howard Park, each containing different winter items that are free for the homeless or people in need to take. Edwards, a senior loan officer for Ruoff Home Mortgage, has placed bags twice so far and will continue to do it until the weather warms up.",homeless
southbend,Pet refuge helping Harvey storm victims reunite with pets,2017-09-07T00:00:00Z,Associated Press State & Local,South Bend Tribune,"These dogs were homeless before Hurricane Harvey flooded the Houston area, where pet shelters are scrambling to make room for pets who have been separated from their people by the floods.",homeless
southbend,Medical school in South Bend focusing on community health,2018-10-31T00:00:00Z,Associated Press State & Local,South Bend Tribune,"The program allows students from the medical school and Notre Dame to learn about the factors that impact community health and well-being while serving at local nonprofits. The students are working on solutions for solving problems, such as youth homelessness, lack of access to mental healthcare, and unhealthy eating habits.",homelessness
southbend,Editorial Roundup: Indiana,2021-02-02T00:00:00Z,Associated Press State & Local,South Bend Tribune,Some of those folks get addicted to drugs or alcohol. Others wind up homeless. Some face both predicaments.,homeless
southbend,Editorial Roundup: Indiana,2021-02-02T00:00:00Z,Associated Press State & Local,South Bend Tribune,"Two efforts revved up this week to connect the homeless and addicted to services in the Wabash Valley. Though separate, the projects target a widening sea of people in need in Terre Haute and the surrounding region. Both could use a boost of support from a community that already has given so much since COVID-19 began sweeping through America last March.",homeless
southbend,Editorial Roundup: Indiana,2021-02-02T00:00:00Z,Associated Press State & Local,South Bend Tribune,"A day earlier, advocates for the homeless ventured through Vigo County to conduct a pandemic-modified Point-in-Time Count. The annual winter process strives to enumerate people living outdoors, or in non-habitable shelters like abandoned houses, vehicles and RVs parked in vacant lots. The co-chairs of the Homeless Council of the Wabash Valley  Bethany House Director Danielle Elkins and Vigo County Commissioner Brendan Kearns  led other volunteers to find people in those situations. That survey process continues through today.",homeless
southbend,Editorial Roundup: Indiana,2021-02-02T00:00:00Z,Associated Press State & Local,South Bend Tribune,The ranks of the homeless and addicted have grown in 2020 and 2021. That growth puts stress on assistance facilities and programs.,homeless
southbend,Editorial Roundup: Indiana,2021-02-02T00:00:00Z,Associated Press State & Local,South Bend Tribune,"The Point in Time Count of the homeless is a survey required by the U.S. Department of Housing and Urban Development to determine federal funding to communities for housing assistance and shelters. Because of COVID-19 precautions, the counters could not set up hubs in city parks, where homeless people could pick up food, clothing and supplies. So, volunteers visited common areas, where the homeless often live in cars or wooded places like the Wabash River front.",homeless
southbend,Editorial Roundup: Indiana,2021-02-02T00:00:00Z,Associated Press State & Local,South Bend Tribune,"The survey opens up funding that will help establish a day center for the homeless at Reach Services on South 15th Street. There, people will be able warm up or cool down in adverse weather, rest on cots, collect mail and access computers, showers and a laundry.",homeless
southbend,Pardoned man discusses his story with Notre Dame students,2017-04-18T00:00:00Z,Associated Press State & Local,South Bend Tribune,"With his family living in a homeless shelter, Cooper chose the latter, figuring, he said, Im going to take this so I can get home and immediately assist my family.",homeless
southbend,"Biden Calls Ukraine Call ""Blatant Abuse of Power""",2019-09-26T00:00:00Z,The Hotline,South Bend Tribune,CASTRO. Former HUD Secretary Julián Castro D toured a homeless camp in Oakland on Wednesday and said more affordable housing is needed to ease the crisis of people living on the streets. He proposed a plan in June that calls for 40 billion in annual funding for the national Housing Trust Fund. The money would go toward creating 3 million affordable apartments over 10 years in an effort to end homelessness.  San Francisco Chronicle,"homeless, homelessness, affordable housing"
southbend,Editorial Roundup:,2020-01-07T00:00:00Z,Associated Press State & Local,South Bend Tribune,"The first student - Jolie - was selected from a family who was staying at the Center for the Homeless in South Bend. In 2008, Jolie began attending Good Shepherd Montessori School in South Bend and today shes a freshman at LaLumiere School in LaPorte. Her younger sister, Marilynn, is also a Jaxson Scholar and an eighth-grader at Good Shepherd.",homeless
