city,article_date,article_source,city_source,keywords_matched,original_count,processed_count,was_shortened,used_sentence_method,segment_count,segment_index,Deidentified_article_title,Deidentified_paragraph_text
southbend,2019-04-22T00:00:00Z,Naked Capitalism,South Bend Tribune,homeless,245,7,True,True,1,0,[ORGANIZATION],"Crowd seems very large, very impressive but also very white-an obstacle he will have to overcome. PERSON0 [PERSON] considers legal options with homeless under FAC0 GPE0 Tribune8. DATE1 after removing wooden pallets that the homeless were using for beds under the FAC0 viaduct, the city was still letting people camp there DATE2. Shortly after the city destroyed the pallets [TIME], people returned and set up new encampments with cardboard boxes, bedding and assorted possessions. Mayor [PERSON] doesnt want that happening either, and he said his administrations attorneys were researching whether [ORGANIZATION] public nuisance law authorizes the city to prohibit the encampments altogether.. PERSON3, founder of the nonprofit [ORGANIZATION], which secured the pallets from an [ORGANIZATION] food pantry and brought them to the viaduct, has called their confiscation and destruction by the city shameful. [ORGANIZATION] said the city didnt think it was taking anyones possessions, as [ORGANIZATION] has said."
southbend,2019-04-03T00:00:00Z,Naked Capitalism,South Bend Tribune,homeless,287,3,True,True,1,0,[ORGANIZATION],My first thought was to be reminded of the problem unrealized unrealizable? opportunity the homeless posed for [ORGANIZATION]. My second thought was to reread the piece and note that the head of the clique was previously expelled from ORG1 for internal subversion.
southbend,2020-10-13T00:00:00Z,CQ Transcriptions,South Bend Tribune,homeless,4,4,False,True,1,0,"[ORGANIZATION] on the Nomination of PERSON0 to be an Associate Justice on [ORGANIZATION] , [ORGANIZATION]","The case of [ORGANIZATION] v. PERSON1, a case I litigated, dealt with the 10 [ORGANIZATION] monument that stands on the state FAC0 grounds. Its been there since [ORGANIZATION] in [ORGANIZATION], an individual plaintiff, an atheist, a homeless man filed a lawsuit seeking to tear down the [ADDRESS] to [ORGANIZATION]. It was decided 5-4, four justices were willing to say enough fact send in the bulldozers and tear down that monument because you cant gaze on the image of the 10 [ORGANIZATION] on public land."
southbend,2020-10-19T00:00:00Z,Talking Points Memo,WSBT,homeless,15,3,True,True,1,0,Let's Pause To Appreciate The Highlight Reel Of Buffoonery By [PERSON]'s [ORGANIZATION],"[ORGANIZATION] for [LOCATION] of ORG0 Shenanigans[PERSON], the alleged ringleader of the kidnapping plot, lived for much of [ORGANIZATION] in the basement of a vacuum cleaner repair shop, sharing the space with his two dogs and plenty of spare vacuum parts. The stores owner, [ORGANIZATION], told [PERSON] that [PERSON] kept the alleged plot hidden from him  because he knew hed be homeless otherwise. But [PERSON] appears to have filmed footage of himself training in that same shop basement."
southbend,2019-07-23T00:00:00Z,Florida Politics,WSBT,affordable housing,313,6,True,True,1,0,[TIME] read of what's hot in [ORGANIZATION] politics   7.23.19,"[ORGANIZATION] currently provides subsidized coverage to 193,000 children and non-subsidized, or full-pay, coverage to 15,500 children. When it comes to affordable housing, [ORGANIZATION] needs to step it up, ORG3 say14 via PERSON0 of ORG1 In a new survey of the [ORGANIZATION] ORG3, a group of 50 prominent political and policy figures from across the state, nearly three quarters 73 percent said the state should dedicate 100 percent of the money in [LOCATION] to affordable housing instead of sweeping it for other uses. Many recommended subsidies for workforce housing, incentives for developers to build more affordable housing or using public land to sell or lease to developers who commit to building it. Others took a bolder approach like [ORGANIZATION], the executive director of advocacy group [ORGANIZATION]. PERSON2 insists the Governor veto any bill that spends [PERSON] dollars on anything other than affordable housing. Financial services sector bolsters [ORGANIZATION]s economic growth in [ORGANIZATION] via PERSON3 of ORG6 [ORGANIZATION]s economy remained strong in [LOCATION], and the financial service sector is partly to thank."
southbend,2019-09-15T00:00:00Z,Gates of Vienna,WSBT,homeless,214,3,True,True,1,0,Gates of [ORGANIZATION],"I think they do not.78 [ORGANIZATION] Says [PERSON] is at All-Time High79 [ORGANIZATION] ambassador-at-large for international religious freedom, [ORGANIZATION], said [ORGANIZATION] that hostility toward Christians in the world has reached an all-time high. There is more persecution of Christians now, arguably than any time in the history of the world, and the Christian faith is the most persecuted faith in the world, by far, [PERSON] said in his keynote address at the sixth annual [ORGANIZATION] hosted by [ORGANIZATION] in [ORGANIZATION], DC.80 [ORGANIZATION] Member Proposes New Plan for Homeless Problem  Bus Homeless People Out of the City81 [ORGANIZATION] has a massive homeless problem, perhaps only second to [PERSON], [PERSON]. The city has already spent a fortune trying various things to solve the problem but nothing has been effective."
southbend,2019-09-16T00:00:00Z,Gates of Vienna,WSBT,homelessness,225,3,True,True,1,0,Gates of [ORGANIZATION],Drug addiction. Homelessness. Poverty.
southbend,2021-11-11T00:00:00Z,Fox News,WSBT,homelessness,5,5,False,True,1,0,PERSON0 Lawyers Push Self-Defense Strategy; President [PERSON] Heroes; Marine Protests [PERSON]; Rising Price Of Goods Impact On [PERSON]; [ORGANIZATION] And Law Enforcement Chases; Family Units Among Those Detained At Border; Border Crossing Activity Picking Up; [ORGANIZATION]; Some Democrats Seek To Change Party Image After Special Election Losses; Analyst Debate If Build Back Better Bill Will Ease Or Exacerbate Inflation In [ORGANIZATION] ; [ORGANIZATION]; Analysts Speculate On Possible Jury Verdict In PERSON0 Trial,"PERSON0 We really owe a lot to our veterans, really everything. [ORGANIZATION] is a premium sponsor of [ORGANIZATION] campaign by [ORGANIZATION] vets. Its dedicated to ending veteran homelessness in the [ORGANIZATION] It features a variety of camouflage products including t-shirts, sweatshirts, a tote bag with the Honor [ORGANIZATION] Vets hashtag, designed to create awareness for the [ORGANIZATION] vets mission. You can see what is all available at the ORG1, and we hope you do."
southbend,2019-08-29T00:00:00Z,Newstex Blogs,WSBT,homeless,8,3,True,True,1,0,"In Mayor [PERSON]'s [ORGANIZATION] , [PERSON] , '[PERSON] Is at an All-Time Low' Among Police Officers","Delivered by [ORGANIZATION] By [ORGANIZATION]  [ORGANIZATION] ORG1 contributor [PERSON] went on the [STREET] for The [PERSON] Angle1 on [TIME]  and shared some horrifying insights about [ORGANIZATION], [PERSON]. Viewers of the new [PERSON] on the [STREET] segment were treated to scenes of boarded-up homes and filthy encampments populated by homeless people. Advertisement FREE"
southbend,2019-07-26T00:00:00Z,Newstex Blogs,ABC57,homeless,13,4,True,True,1,0,Rise Shine: A look back at how [ORGANIZATION] [STREET] case on busing shaped school segregation,"The stubborn persistence of racial segregation in [ORGANIZATION] schools can be traced back to [ORGANIZATION] v. PERSON1, a pivotal [ORGANIZATION] case decided DATE0 DATE1. ORG1 HOMELESS CHILDREN A sobering new report says there could be more than 15,000 homeless children DATE2 or younger in [PERSON], with more than one in 10 in several rural counties lacking stable housing. ORG2 [ORGANIZATION] ASK Gov. [PERSON] is reviewing a proposal from the [ORGANIZATION] that asks for [PERSON] to improve the district high school."
southbend,2023-05-26T00:00:00Z,ACCESSWIRE,WNDU,affordable housing,2,2,False,True,1,0,"[ORGANIZATION] ORG1 $175,000 to [ORGANIZATION] in [ORGANIZATION]","Since [ORGANIZATION], [ORGANIZATION] has made community investments supporting low to moderate income individuals and neighborhoods totaling more than 93 million in [ORGANIZATION]. This involves lending for affordable housing, small businesses, mortgage and home improvements as well as transformative philanthropy."
southbend,2020-05-28T00:00:00Z,Business Wire,WNDU,homeless,2,2,False,True,1,0,[ORGANIZATION] America Awards Finalists Celebration of Service to America Awards program accessible online and available for local broadcast stations to air in [LOCATION],"Service to [ORGANIZATION] MarketORG1 [PERSON], [ORGANIZATION] ORG1 ORG2 [ORGANIZATION], [ORGANIZATION], [PERSON] the Forgotten"
southbend,2019-02-27T00:00:00Z,Newstex Blogs,WNDU,affordable housing,49,3,True,True,2,0,Opportunity Zones will help those who help themselves,"For another illustration, see [ORGANIZATION], [PERSON], where a new downtown is being built for a suburban city with no existing walkable downtownon 105-acre former [INSTITUTION] site see rendering at top of article. Downtown [ORGANIZATION]s plan comprises 2,300 residential units, including substantial affordable housing, and 1.7 million square feet of commercial uses, such as a grocery store, shops, restaurants, a movie theater, and office space. There will be 18 publicly accessible parks and civic spaces."
southbend,2019-02-27T00:00:00Z,Newstex Blogs,WNDU,affordable housing,49,3,True,True,2,1,Opportunity Zones will help those who help themselves,"When all of the phases are built out, the city has plans to make the downtown even larger by extending the [STREET] grid to adjacent sites. Notes one city official [LOCATION] land control allows us to better negotiate getting affordable housing. We highly value equity and inclusivity and think it should be part of our vision."
