Submission Score,Submission Timestamp,Comment Score,Comment Timestamp,Deidentified_Submission Title,Deidentified_Comment,keywords_matched
32,2021-09-23 11:23:32 UTC,1,2021-09-23 20:18:37 UTC,[ORGANIZATION] council considers lowering speed limit for residential streets,"FWIW, I do know a private group is building and addressing the homelessness problem in our town. We clearly lack adequate facilities for this demo and it’s been that [STREET] for [ORGANIZATION], but I personally know someone is working to change this.","homeless, homelessness"
32,2021-09-23 11:23:32 UTC,1,2021-09-26 17:06:08 UTC,[ORGANIZATION] council considers lowering speed limit for residential streets,I used to work with homeless population in town but have been out of that for [ORGANIZATION]. Who is this private group you speak of? I’m out of the loop.,homeless
32,2021-09-23 11:23:32 UTC,1,2021-09-26 21:31:37 UTC,[ORGANIZATION] council considers lowering speed limit for residential streets,"[ORGANIZATION] continues to do good work, while a new group, [ORGANIZATION], a new non-prof, has been in the works with homeless residences, currently 20 cabins I believe with heating, air, water, electric. From what I know, they’re also trying to secure long term housing help and other basic resources for the demo.",homeless
0,2023-11-11 01:29:32 UTC,7,2023-11-11 03:49:36 UTC,PERSON0 sentiment and affordable housing,"Are they rent controlled or income restricted or accepting vouchers?? There is a big difference. ""Affordable housing"" is often not actually affordable and they're definitely getting a huge tax break for it",affordable housing
0,2023-11-11 01:29:32 UTC,-4,2023-11-11 17:31:40 UTC,PERSON0 sentiment and affordable housing,"Noted.  The responses are the types of things I would have said when I was that age.

I'm not a person who believes the [ORGANIZATION] are 100% good, but they do work at addressing problems like affordable housing in tangible ways that many other organizations don't have the ability or finances to do.

The smart [STREET] to view the [ORGANIZATION] is a resource that can be directed towards what the city needs.  Engage with them about potential development that will help address housing affordability, for example.  [ORGANIZATION] is kicking our butt in that regard right now.  

The prevailing sentiment in [PERSON] seems to be to not want the [ORGANIZATION] involved in anything at all, because they are ""evil"" in some [STREET].

It comes off as hillbilly suspicion and clannish-ness more than any righteous cause.  ""We dont need no rich folk here messin up the order of thangs here in our poor little holler!""",affordable housing
0,2023-11-11 01:29:32 UTC,5,2023-11-11 05:36:05 UTC,PERSON0 sentiment and affordable housing,"Also a lot of affordable housing doesn't offer people upward mobility. As soon as you make more money, the rent goes up or the other benefits are cut or you get kicked out because you make too much.",affordable housing
19,2024-06-12 13:16:10 UTC,1,2024-06-13 00:49:01 UTC,"Tell me about [ORGANIZATION], from a fellow [ORGANIZATION]","[ORGANIZATION] has that perfect mix of small-town charm and lively cultural vibes, making it a great [STREET] to settle down. You'll love the affordable housing, great schools, and gorgeous natural scenery, offering a nice change of pace. If you want high tempo, this is not it",affordable housing
19,2024-06-12 13:16:10 UTC,1,2024-06-13 13:10:51 UTC,"Tell me about [ORGANIZATION], from a fellow [ORGANIZATION]","Affordable housing? what is this, [ORGANIZATION]?",affordable housing
10,2024-05-12 18:44:14 UTC,20,2024-05-12 19:20:35 UTC,Older student housing,"I would consider anywhere in [ORGANIZATION] safe to live. Even in south [ORGANIZATION] where you’ll run into the occasional homeless person, they are pretty harmless if you leave them be.",homeless
54,2022-04-01 13:37:31 UTC,8,2022-04-02 01:43:23 UTC,"[ORGANIZATION] ranked as one of most affordable [ORGANIZATION] cities of [ORGANIZATION], analysis finds",Won’t be too long before people who have been living here get priced out by the lack of affordable housing,affordable housing
0,2023-03-07 12:56:32 UTC,33,2023-03-07 13:33:49 UTC,[ORGANIZATION] - Strategic ideas to create good growth,"Every time someone comments this just proves they really haven’t looked at the actual [[ORGANIZATION]/Item/2497). 

The reality is, [ORGANIZATION] and residents DO NOT WANT massive chain retail or restaurants. We thrive  in spite of FAC0 being the hot spot for those. 

Affordable housing, yes. This is much needed and I know several city council members have been advocating for this for a while, and because of that there are plans of more affordable condos around the [ORGANIZATION] area.

[ORGANIZATION] will be hesitant on 15-20 story buildings. You have to remember we are a big town, not a city, and people want it to remain that [STREET]. I would love a more affordable, walkable town, but I also love my yard, dogs, and patio with a tv and smoker I get to use [ORGANIZATION].",affordable housing
0,2023-03-07 12:56:32 UTC,12,2023-03-07 13:58:34 UTC,[ORGANIZATION] - Strategic ideas to create good growth,"These posts crack me up, as if the first step to affordable housing is paving 1000 acres to put in an outdoor [INSTITUTION].",affordable housing
0,2023-03-07 12:56:32 UTC,0,2023-03-11 16:14:15 UTC,[ORGANIZATION] - Strategic ideas to create good growth,">I never said to ADD any establishments.  [ORGANIZATION] already has a mall and chain restaurants.  We need to keep foot traffic at good levels in our current establishments.  I am focused upon affordable housing in the [ORGANIZATION], [PERSON] and [PERSON] corridor so those citizens are more likely to shop and eat in [ORGANIZATION].  
>  
>[ORGANIZATION] land prices are too expensive for 2 story condos so the prices have to be high.  We need 5-10 story condos along the greenway south of GPE2.   We also  need affordable housing in the [ORGANIZATION], [PERSON] and [PERSON] corridor to reduce the strain on expensive land in high priced [ORGANIZATION].    
>  
>*""[ORGANIZATION] will be hesitant on 15-20 story buildings.""*   Read my post-I did NOT say 15-20 story residential buildings in [ORGANIZATION].  What I said was the [ORGANIZATION] campus needs to build 15-20 story [ORGANIZATION] with parking decks in the base to create dorm rooms with appropriate parking.  THe campus doesn't have enough land for surface parking lots.   We need dense student dorms on campus which could create great pedestrian traffic close to GPE2.",affordable housing
0,2023-03-07 12:56:32 UTC,0,2023-03-11 16:22:04 UTC,[ORGANIZATION] - Strategic ideas to create good growth,"The land is too expensive in [ORGANIZATION] for even the tall zero lot line homes to be affordable.   Affordable housing in [ORGANIZATION] is just going to look for the cheapest land which is not a desirable area but it will provide marginal housing.  [PERSON], [ORGANIZATION] to [PERSON] could be feeder communities for [ORGANIZATION] services but also young families that start in [PERSON] will want to move to [ORGANIZATION] when they make more money.",affordable housing
0,2023-03-07 12:56:32 UTC,0,2023-03-11 16:23:21 UTC,[ORGANIZATION] - Strategic ideas to create good growth,">[ORGANIZATION] land prices are too expensive for 2 story condos so the prices have to be high.  We need 5-10 story condos along the greenway south of [PERSON].   We also  need affordable housing in the [ORGANIZATION], [PERSON] and LOC2 corridor to reduce the strain on expensive land in high priced [ORGANIZATION].  
>  
>""[ORGANIZATION] will be hesitant on 15-20 story buildings.""   Read my post-I did NOT say 15-20 story residential buildings in [ORGANIZATION].  What I said was the [ORGANIZATION] campus needs to build 15-20 story [ORGANIZATION] with parking decks in the base to create dorm rooms with appropriate parking.  THe campus doesn't have enough land for surface parking lots.   We need dense student dorms on campus which could create great pedestrian traffic close to [PERSON].",affordable housing
3,2023-02-25 05:09:31 UTC,17,2023-02-25 05:58:59 UTC,Best small city to live in near [ORGANIZATION].,"As a [ORGANIZATION] resident, not what I would consider affordable housing. Maybe west of downtown towards FAC0, but in my neighborhood houses are priced at around $220 a foot which are [PERSON] prices. Not to mention my RE taxes went up 11% DATE0.

Not trying to being a jerk or anything by my response or anything. I just probably probably wouldn’t look at [ORGANIZATION] for “affordable” depending on where [ORGANIZATION] is coming from.",affordable housing
10,2024-01-07 05:01:57 UTC,4,2024-01-07 21:50:35 UTC,FAC0,They should turn their old house into affordable housing,affordable housing
