Submission Score,Submission Timestamp,Comment Score,Comment Timestamp,Deidentified_Submission Title,Deidentified_Comment,keywords_matched
28,2024-12-26 19:55:13 UTC,0,2024-12-27 01:03:54 UTC,FAC0,"Eh honestly, I wouldn’t do it. I lived in south [ORGANIZATION], like [TIME] from FAC0, and I sold my house because:
1. High homeless population (I lived in between [ORGANIZATION] and FAC1)
2. FAC0 traffic is a bitch. The only reprieve we’d get was during [ORGANIZATION] or [LOCATION] break when school was out.",homeless
28,2024-12-26 19:55:13 UTC,0,2024-12-26 22:17:03 UTC,FAC0,"I lived on FAC0 for [ORGANIZATION]. Traffic was horrendous. Got broken into once in [ORGANIZATION], homeless folks make noise but I never had any trouble. I miss being so close to downtown [ORGANIZATION] but I don’t miss the constant noise from traffic.",homeless
28,2024-12-26 19:55:13 UTC,12,2024-12-26 22:35:44 UTC,FAC0,"this, I have a [TIME] commute home interrupted by waiting [TIME] to cross FAC0, god forbid some chucklehead blocks the light trying to pull into [ORGANIZATION] and now add in the endless pedestrian traffic also trying to cross without a protected light, easily the most f'd up intersection in [ORGANIZATION]. However most of the homeless/crime will be east of that along school and [PERSON], you can basically draw a [STREET] around 7 hills and ORG1 and that is where the crime/homeless will be. FAC0's biggest danger is killing one while they try to crazy cross [STREET] at sunset in an random spot.",homeless
23,2024-04-09 11:37:38 UTC,-10,2024-04-10 07:41:21 UTC,good [STREET] to sit and work?,"Be careful with the library, it’s kind of a homeless hot spot",homeless
26,2024-08-21 21:43:41 UTC,2,2024-08-22 08:43:50 UTC,Does anyone know what these two towers will be (off of FAC0),It will have a breath taking view of the homeless camps.,homeless
4,2024-08-31 00:59:13 UTC,4,2024-08-31 01:35:06 UTC,[ORGANIZATION],"Not including FAC0 (there's no [STREET] they're getting in there for showers) , there is only one other [LOCATION] park that I know of in S [ORGANIZATION] and I never see the homeless going there.",homeless
4,2023-04-04 15:19:29 UTC,-2,2023-04-05 01:39:58 UTC,Considering a move to the area. Curious about neighborhoods.,That area has the most homeless people in all of [ORGANIZATION],homeless
29,2023-05-26 14:36:12 UTC,4,2023-05-26 23:29:44 UTC,City seeking input for FAC0 master plan,How will these plans affect the homelessness situation in [ORGANIZATION] and vice versa?,"homeless, homelessness"
29,2023-05-26 14:36:12 UTC,3,2023-05-27 17:07:22 UTC,City seeking input for FAC0 master plan,What homeless? /s,homeless
5,2023-12-17 04:58:28 UTC,1,2023-12-17 13:54:53 UTC,Volunteering/Helping on DATE0,"[ORGANIZATION] and [ORGANIZATION], I believe, both do [ORGANIZATION] soup kitchens.  No personal experience with either but fairly certain they will needs hands for helping.","homeless, soup kitchen"
55,2022-09-12 01:22:47 UTC,2,2022-09-12 13:44:40 UTC,Found dog near FAC0,"I think I saw that dog down at [ORGANIZATION], might belong to a homeless person. You might try posting a flyer down on the south side of town even at [ORGANIZATION].",homeless
45,2022-12-22 05:01:05 UTC,5,2022-12-22 13:52:39 UTC,These temperatures are deadly for folks without access to housing or shelter. Here is some info about Emergency Winter Weather [ORGANIZATION]. Please share with anyone who may need it.,"Thanks for sharing! I hope these were also passed out in Spanish, things like this need to be bilingual to reach 100% of our homeless/in need population",homeless
10,2019-03-21 06:26:48 UTC,3,2019-03-22 16:19:17 UTC,Can we have a conversation about gentrification and a local income tax?,"I think changing up zoning codes and allowing more (as well as denser) housing construction and more walkable elements in neighborhoods would help alleviate housing prices. With more affordable housing built as well you [STREET] down homelessness.

Not to say that taxation is[LOCATION] an appropriate method in many cases, but the issue is[LOCATION] that the county does[LOCATION] have enough to operate. 

The problem is that the correct remedy for bringing down housing costs has[LOCATION] been implemented.

[For how to do that, see this book.]([URL] ","homeless, homelessness, affordable housing"
10,2019-03-21 06:26:48 UTC,4,2019-03-21 15:35:42 UTC,Can we have a conversation about gentrification and a local income tax?,"What exactly would you expect to be done with these “extra public funds”? Government work projects? Maybe infrastructure projects? Are those things not just gentrification by a different mean? Gentrification is not a bad thing, but for many it sure has become a buzzword with negative connotations.

How exactly does raising taxes help homeless people? There are plenty of resources already available for them. Most homeless people I see are at the FAC0 exit directly across from the FAC1 employment building. They should turn around and walk in.

I would bet that whatever you deem a good use of “public funds” is the last thing the government would spend it on, and if they actually did they would get much less out of the dollar than any locals who set their mind to solving the same issues.",homeless
10,2019-03-21 06:26:48 UTC,1,2019-03-22 22:28:13 UTC,Can we have a conversation about gentrification and a local income tax?,"I suppose where I diverge from many of you is the idea that 'economic prosperity' is a good thing. Surely, denser housing is a solution to homelessness. But to support all those people, you need to build all kinds of schooling, transportation, water/wastewater, electric, etc. infrastructure. 

""With all the money we generate we will buy more solar panels and make it 'sustainable' "". And so you go through a development cycle and after a while [ORGANIZATION] turns into [PERSON], GPE2.

The reason why I don't like gentrification is because it catalyzes development. It's great in a financial sense, but I care more about preserving the [ORGANIZATION] I have seen [ORGANIZATION] than the one I am seeing it become. ","homeless, homelessness"
10,2019-03-21 06:26:48 UTC,2,2019-03-21 15:39:30 UTC,Can we have a conversation about gentrification and a local income tax?,"Another thing is I never see many homeless people in [ORGANIZATION], and [PERSON] specifically. Maybe it has to do with a homelessness : total population ratio, idk for sure and it’s hard to pinpoint, but maybe higher taxes (like GPE2) doesn’t = less homeless?","homeless, homelessness"
10,2019-03-21 06:26:48 UTC,4,2019-03-21 13:54:56 UTC,Can we have a conversation about gentrification and a local income tax?,Homeless people,homeless
10,2019-03-21 06:26:48 UTC,3,2019-03-21 19:59:09 UTC,Can we have a conversation about gentrification and a local income tax?,"I live off [ORGANIZATION], the travelers and homeless are always harassing people ",homeless
10,2019-03-21 06:26:48 UTC,2,2019-03-21 15:17:01 UTC,Can we have a conversation about gentrification and a local income tax?,"Hey look at that. I’m wrong often. I would reiterate though another posters position that depending on the price, people may move. 

[URL]

Also still yet to see a city throw money at homelessness and be successful. Many have tried. Just wondering if money will really fix anything. ","homeless, homelessness"
15,2021-10-04 19:36:47 UTC,3,2021-10-05 07:07:55 UTC,Lost Key Fob at FAC0,"There are a lot of homeless people who reside at FAC0. They hang around the benches near the playground sets and sleep in the pavilions and dugouts of the baseball fields. Next time you’re in the area, you might try asking one of them if they found a key fob.",homeless
15,2019-07-13 14:16:53 UTC,12,2019-07-13 14:27:58 UTC,Hi fellow northwest Arkansans,"You might already be aware of it, but it’s worth mentioning: check out [ORGANIZATION] homeless center in [ORGANIZATION]. There might be some programs available for you both that could make sense. It’s a good organization and if they can’t directly help you, they might point you in the right direction. Hope that helps.",homeless
11,2019-10-24 19:05:26 UTC,12,2019-10-24 19:53:10 UTC,Looking for film subjects,There’s a homeless person on almost every highway exit at all times of [DATE]. Ask one of them. Or ride the university bus during the winter [TIME].,homeless
11,2019-10-24 19:05:26 UTC,2,2019-10-25 06:25:39 UTC,Looking for film subjects,"I was walking with a friend at FAC0 (I think it’s FAC1, it’s the one with the skate park) and we ran into a homeless couple with 3 chihuahuas. They said they lived in the woods nearby.",homeless
11,2019-10-24 19:05:26 UTC,3,2019-10-25 15:06:16 UTC,Looking for film subjects,"The bearded guy who sells water bottles with the sign claiming he's looking for work is 100% fake and he's neither homeless nor looking for employment. My fiancee has offered him a job interview before and never heard from him. After mentioning he bailed on her invitation for an interview [ORGANIZATION], one of her employees who apparently knows water bottle guy told her he just uses that sign to guilt people into buying drinks from him and that he has a [STREET] to live and no interest in a real job because pity turns a big pack of cheap water from [ORGANIZATION] into $50+ in [TIME].

The guy with middle length sandy blond hair and a limp is also fake. He claims to be homeless and disabled, but I've repeatedly seen him be dropped off near the strip mall on FAC0 by someone in a nice car with a backpack full of supplies. They show up before the early morning traffic, blond dude pulls the dirty clothes he wears from a basket in the back of the car, changes into then, puts his clean clothes in the car, and them crosses the bushes to go panhandle while his friend leaves. If you catch him away from his post, you can hear him bragging about making $80+ in [TIME].

The heavyset couple with two dogs that also begs around FAC0 claim to be disabled as well, but aren't. They're just super overweight and don't want to work. She claims to be pregnant, but I can't say how true that is since she'll be out [LOCATION] in intense heat. They're super nice people, but they're definitely not what they're presenting themselves to be.",homeless
2,2020-01-19 04:26:08 UTC,8,2020-01-19 05:02:50 UTC,South GPE0,"South [ORGANIZATION] is more of the low income area. [ORGANIZATION] is located on that side of town. There has been some renovations, but natives know it's the rougher part with homeless folk and all. With the ORG1 there rent is considerably higher than the northern parts of town. I'm currently renting a town home in the northern part for $875/mo. I do recommend this side as it is cleaner, but unfortunately during [ORGANIZATION] there are homeless with signs on [STREET] corners. (Although, south [ORGANIZATION] actually has housing for them etc. It's also where the county jail is.) Anyways, north [PERSON] has been referenced as ""[ORGANIZATION]"" so new development plays it to their advantage for marketing. This side of town does have ORG2 and other stores. I recommend ORG3 or FAC0 in GPE2 for shopping. Hope that help. Good luck!",homeless
21,2016-06-17 19:11:28 UTC,1,2016-06-18 00:56:49 UTC,[ORGANIZATION] one of six [ORGANIZATION] cities selected for ‘tactical urbanism’ project,Less parking and cut off streets calms traffic how exactly? It just condenses it. I wouldn't be so opposed to this if I could actually ride the public bus without having to sit on top of homeless people.,homeless
21,2016-06-17 19:11:28 UTC,2,2016-06-18 13:15:35 UTC,[ORGANIZATION] one of six [ORGANIZATION] cities selected for ‘tactical urbanism’ project,"That situation is especially bad when you are a college student paying [ORGANIZATION] for [ORGANIZATION]"" for these busses that everyone else gets to ride on for free. That [TIME] tan route [PERSON] always had a homeless guy sleeping in the backseat that you could smell from the front seats.",homeless
6,2019-05-01 19:58:02 UTC,9,2019-05-01 20:15:08 UTC,Unusual tourist attractions?,You could hang out with the homeless at tables and ale or take it back to [ORGANIZATION] and smoke a cigarette while eating a burger in FAC0. If you are up for the [STREET] [ORGANIZATION] is a cute little hippie town with a haunted hotel.,homeless
5,2017-02-19 04:18:07 UTC,4,2017-02-19 13:54:12 UTC,Good areas to live with kids?,"I used to live on FAC0 it's not dangerous, especially not famous for being dangerous. Literally any [STREET] in [ORGANIZATION] is worse 

SE [PERSON] isn't dangerous either. The [INSTITUTION] is nearby though so homeless people safe more prevalent there",homeless
47,2024-03-13 21:08:19 UTC,4,2024-03-14 02:21:49 UTC,[ORGANIZATION] Will,"Thank you OP for bringing this to my attention. I agree that [ORGANIZATION] has a housing crisis. However, it is unclear to me where one can sign a petition in support. Also, I learned in law school that one should make it as easy as possible for a person to take an action you desire. As cumbersome as it may be, a list of council members and their contact information would be helpful rather than asking people to contact their council member. Thanks again.",housing crisis
47,2024-03-13 21:08:19 UTC,2,2024-04-07 06:01:11 UTC,[ORGANIZATION] Will,I like your approach of calling out some bad actors and just generally approaching this issue with some metaphorical balls. The other resolution also addresses low incomes that continue to be outpaced by the cost of living as being another side of this problem which I think is an important point that the housing crisis one fails to mention.,housing crisis
47,2024-03-13 21:08:19 UTC,0,2024-04-07 06:11:54 UTC,[ORGANIZATION] Will,"I just want to comment on the “greedy landlord” things you may be hearing from an alternative perspective. Many people in [ORGANIZATION] are fighting tooth and nail to be able to pay rent, and have basic necessities and have next to no leftover income to deal with financial emergencies. People are quite literally one or two unforeseen circumstances away from food insecurity or being forced to incur late fees or running out of gas, etc. They do not have the luxury of holding rental properties and could not even dream of putting two kids through college as you say. While you may not feel particularly greedy, from the perspective of those much less fortunate than you, it is difficult to see it any other [STREET].

[PERSON]: From what little I do know about the national housing crisis, this whole “the few own the properties of the many” aka rental/ leasing housing economy we’ve built is a BIG part of the problem. The writing on the walls is that fewer and fewer people will ever be able to own the spaces that they live in. I don’t mean to call you out specifically. I can only take you at your word that you’re trying to be a good landlord, but the truth is that the only real long term solution to the housing crises, as I see it, is to move to give residencies back to the people. As long as housing remains such a large scale profit engine, it only serves to [STREET] the wedge further and further between the rich and the poor.",housing crisis
47,2024-03-13 21:08:19 UTC,8,2024-03-13 22:19:39 UTC,[ORGANIZATION] Will,Any idea where [ORGANIZATION] is on this? He campaigned on taking actions to address housing insecurity.,housing insecurity
47,2024-03-13 21:08:19 UTC,1,2024-04-07 05:56:33 UTC,[ORGANIZATION] Will,"I am a bit scared of this resolution. I am not even educated on the subject but I had similar thoughts. Calling an official housing crisis sounds like a step in the right direction, but I would REALLY like more information on exactly how they plan on actually tackling the problem. Calling together a committee does sound like a weak start, but a start nonetheless?

I’m personally affected by the housing crisis. I am moving to [ORGANIZATION] to live with my mother, but I would love to be able to return to [PERSON] [DATE] if they ever get this sorted. I don’t want the solution to be building a bunch of cheap, uncomfortable apartments and calling it affordable housing. I was excited to see a housing crisis being declared, but after reading the resolutions and some of the takes in this thread I’m certainly less confident that a genuine solution will be uncovered.","housing crisis, affordable housing"
47,2024-03-13 21:08:19 UTC,1,2024-06-04 19:35:04 UTC,[ORGANIZATION] Will,They can’t tackle the problem when they have real estate developers sitting on abandoned houses for [ORGANIZATION]. Only city I’ve ever seen do that was [PERSON] ; it’s a real bad [STREET] one nice house 2 abandoned houses. I could take you thru the city and show you houses where nobody is living sometimes for [LOCATION]. ??? Why is that you ask? They don’t some even have for sale signs on them because the homeless break into them and live.  So until the real estate developers stop hoarding houses that sit waiting for no land to be available we will be In a housing crisis. These real estate developers have no reason to tear down abandoned houses and make new housing there is no profit when the interest rates are high. DATE2 someone contacts me trying to buy my house. It’s a nightmare!,"homeless, housing crisis"
48,2024-07-20 01:42:49 UTC,12,2024-07-20 14:24:35 UTC,Meet members of [ORGANIZATION]’s housing crisis task force,"So, this list is full of people that have engineered the current housing crisis.",housing crisis
48,2024-07-20 01:42:49 UTC,5,2024-07-21 01:20:08 UTC,Meet members of [ORGANIZATION]’s housing crisis task force,"I know [ORGANIZATION] and [PERSON] and both believe in the need to fix our outdated zoning laws to allow density throughout our city or risk further suburban sprawl. 

We are involved in a local advocacy group called [ORGANIZATION]. We're a non-partisan group aligned with the principles of [ORGANIZATION] and advocate for safe [STREET] design, affordable housing, public transit, and walkability/bikability. 

The lack of even a single renter is not a good look for the mayor and city council. I know that [ORGANIZATION] would support renters and renters advocates on the task force.",affordable housing
48,2024-07-20 01:42:49 UTC,5,2024-07-20 17:46:21 UTC,Meet members of [ORGANIZATION]’s housing crisis task force,"Hey now, [ORGANIZATION] might win one of [ORGANIZATION]!

Thanks for the reply! I appreciate your perspective.

We need proactive leadership to address these issues effectively, and it’s my opinion that these things have only been given lip service. The community practically had to strong-arm them into even declaring a housing crisis and forming a committee that they probably won’t even fund.",housing crisis
70,2023-09-18 15:06:59 UTC,8,2023-09-19 03:59:02 UTC,Action Needed to Address the Housing Crisis in [ORGANIZATION],"The more dense, inner core of the city generates a lot more tax revenue than the more expensive houses on the periphery. More overall density=more affordable housing (along with less car traffic, lower commute times, less noise and exhaust pollution, and happier citizens), which this proposal will likely work to *address for the broader benefit.

-

Your frustration is understandable, but I think it's misplaced on this.",affordable housing
99,2024-03-20 20:17:11 UTC,15,2024-03-21 15:28:16 UTC,High Rent and FOIA'd [ORGANIZATION] from [ORGANIZATION],"There were **two competing housing resolutions** that were introduced to [ORGANIZATION] [TIME].

1. One was crafted by citizens through grass-roots groups like ORG1, ORG2, others) and asked for a Housing Crisis be declared, a committee/task force formed, and a city staff member hired to focus on solutions.
2. The other was sponsored by five [ORGANIZATION] members and proposed no action, but made a declaration of efforts they've taken to address housing. PERSON0 led this one and the FOIA'd e-mails made him seem offended that other's hard work was going unnoticed.

Read more here: [[URL]

What I think was strange about [PERSON]'s version was that it over-emphasized the [ORGANIZATION]'s efforts on housing insecurity and homelessness. Those are important things that align with my personal values, but that's not what we're talking about. We need to increase housing supply and expedite its production so that people just have options of places to live. I believe we're making steady progress doing this like removing commercial parking requirements, creating pre-approved design plans for infill developments downtown, FAC0 improvement plan...but there are some critical approaches we have not addressed. They are local actions that impact housing supply and local prices:

* **Hire another planner or two** to work with landowners to rezone more properties to allow housing in more places (e.g. FAC0 improvement project that's underway or our [ORGANIZATION] in our [ORGANIZATION] Plan 2040 our city refuses to act on). 
* You know those brownstones in [ORGANIZATION]? Triple-deckers in [PERSON]? They are illegal to build in most of our city due to zoning. **Reform our development code.** I believe it's a problem that it's easier to build sprawling subdivisions, and harder to build compact and traditional living. We need to change the code from [ORGANIZATION] zoning to form-based zoning. [PERSON] and [PERSON] are addressing this with a world-renowned consultant right now. If [PERSON] chooses to fall behind those two cities in urban planning, it will be laughable. 
* **Reduce/reform parking minimums** for residential (maybe using overlay districts) and simultaneously invest in transit. [PERSON] is offering cities in [PERSON] a match for transit investment (design of bus stops) and the [ORGANIZATION] has not taken them up on it. 
* [ORGANIZATION] councilmembers: **Stop holding rezone requests hostage.** 

Personally, I'm mostly annoyed that it seems several councilmembers don't recognize that [PERSON] **has made great progress** ***and*** **can do more.** There IS work to be done ...do they see that? I'm concerned that they know, they just don't want it. 

Really curious what's going to come out of this. Also, it's interesting that [PERSON] will be up for re-election DATE1.","homeless, homelessness, housing crisis, housing insecurity"
99,2024-03-20 20:17:11 UTC,5,2024-03-21 16:39:02 UTC,High Rent and FOIA'd [ORGANIZATION] from [ORGANIZATION],"Thank you for your summary of why the two resolutions' differing origins matters so much, this is what I am hoping to raise awareness of the most. [ORGANIZATION] motivation for his own resolution seem to be focused on his own insecurities and pride more than that of the people's voices (that personal letter, wow), and I find that unacceptable as a representative of us citizens.

[PERSON]'s thoughts on the people's resolution:

>“It resonated as a stand alone, attention seeking, self aggrandizement, document in my eyes, which actually ignored our current efforts, did not build upon or improve our existing efforts, was condescending toward staff’s actual hard work in this arena, and was disappointing…. an opportunity for a rather small group of individuals to sufficiently stack the deck to speak, with their preferred track force members in order to gain more influence than they currently possess.”  
  
– [ORGANIZATION] Member [PERSON] PERSON3, on Page 1 of the Note, speaking about [ORGANIZATION] written by voters

So his response was to propose his own, one key difference being that his does not declare a housing crisis, but it does give himself pats on the back.

>[ORGANIZATION] Member PERSON3’s counter-resolution does not declare a Housing Crisis and does not call on the city to try new things. The [ORGANIZATION] documents show PERSON4 purposely leaving some council members out of the process of seeking co-sponsors. They also show him purposely asking the City Attorney’s office to **hold off sending out his resolution to non-sponsors until the last possible moment** before the agenda session, **leaving them in the dark** until [TIME] before the meeting on purpose. That’s his right, but neither of these things seems very inclusive or consensus-building. PERSON5",housing crisis
99,2024-03-20 20:17:11 UTC,2,2024-03-22 03:13:40 UTC,High Rent and FOIA'd [ORGANIZATION] from [ORGANIZATION],You absolutely nailed it. I have to believe the mayor office knows these things will help address the housing crisis. The question is why they didn't want to do them.,housing crisis
99,2024-03-20 20:17:11 UTC,5,2024-03-22 18:29:44 UTC,High Rent and FOIA'd [ORGANIZATION] from [ORGANIZATION],"Everybody wants more affordable housing and to live within walking distance to things, but nobody seems willing to abandon the idea of their own home on a lot with a two-car garage, backyard and white-picket fence.",affordable housing
5,2024-04-08 00:11:13 UTC,2,2024-04-09 07:06:14 UTC,"How does [ORGANIZATION], [PERSON] compare to GPE2, [PERSON]? ",Both are in the midst of a housing crisis.,housing crisis
32,2021-09-23 11:23:32 UTC,3,2021-09-23 15:35:14 UTC,[ORGANIZATION] council considers lowering speed limit for residential streets,"What about the growing homeless population and property crime rate more than double the national average? ""[PERSON] at our new library""

What about the growing homeless population and property crime rate more than double the national average? ""check out this new [ORGANIZATION] restaurant chain opening up""

What about the growing homeless population and property crime rate more than double the national average? ""speed limits!!!!""

&#x200B;

Appears to be a working strategy.",homeless
