Submission Score,Submission Timestamp,Comment Score,Comment Timestamp,Deidentified_Submission Title,Deidentified_Comment,keywords_matched
49,2023-01-30 02:30:55 UTC,32,2023-01-30 12:47:17 UTC,Efforts underway to examine number of homeless people in [ORGANIZATION],"I interact with the homeless quite a bit for work. Met a couple from [ORGANIZATION] that chose the ""lifestyle "". They walked and hitch hiked here, because they heard it is ""a good [STREET] to be homeless "". I am an advocate for helping those in need and the homeless, but I don't think this issue will be successfully addressed without acknowledging that a subset of these folks will not change even when given the opportunity. The life that seems unlivable to the average person is normal to them and for some a willful choice. Some of the kids and the newly displaced seem the most accepting of assistance and want to escape homelessness. Addressing homelessness needs to start with understanding there are two homeless populations. The truly displaced and those that chose to be where they are.","homeless, homelessness"
49,2023-01-30 02:30:55 UTC,12,2023-01-30 06:12:33 UTC,Efforts underway to examine number of homeless people in [ORGANIZATION],"Copying my comment from r/fayettevillear 

It has gotten out of hand. They are taking over walker park. I’ve seen many tents in the woods in the disk golf course. A little further south down the greenway, there are tons of tents in the woods and often times when riding my bike on the trails I would run into some pretty scary figures. I haven’t been back since I’ve been scared of being robbed of my bike..

Riding in [DATE] I probably saw at least 20 tents along the greenway in a 3 mile ride from FAC0 to FAC1. It was like they were everywhere.

Also a huge homeless encampment on the north side of the greenway here:

36.[ZIP]° N, 94.[ZIP]° W

I have been there before and it looked like an entire city of homeless, yet that was [ORGANIZATION] and may be cleared up. I am glad this is getting attention. If I think of more examples I will add to this post",homeless
49,2023-01-30 02:30:55 UTC,5,2023-01-30 15:25:23 UTC,Efforts underway to examine number of homeless people in [ORGANIZATION],"Considering how half of homeless people have employment -- or live at a shelter with a list of crazy rules (can't enter after [TIME], for example), then it's not effective).

Alternatively, peg minimum wage to rent rates in the region.

> About 53 percent of the sheltered homeless had formal labor market earnings in [DATE] they were observed as homeless, and the authors’ find that 40.4 percent of the unsheltered population had at least some formal employment in [DATE] they were observed as homeless. This finding contrasts with stereotypes of people experiencing homelessness as too lazy to work or incapable of doing so.","homeless, homelessness, affordable housing"
49,2023-01-30 02:30:55 UTC,6,2023-01-30 15:42:15 UTC,Efforts underway to examine number of homeless people in [ORGANIZATION],"This makes it sound like something new, but the homeless census has been happening here for [ORGANIZATION]. I've helped with it several times in the past. 

There's always a ton of anecdotes about how many people somebody knows that are ""choosing"" to be homeless and how common it is, but the numbers don't lie... The *vast* majority of homeless people are not willingly homeless. And most of the unwilling share a similar story: mental health issues, medical debt, or a lost job. Couple any one of those with a lack of decent safety net programs in this country, and bam, homeless.

If you really want to help individuals but are worried how they would spend cash, buy $10 gift cards to restaurants or [ORGANIZATION] and keep them in your glove box for when you see someone. Otherwise, donate to folks like ORG1 or ORG2.. the money will go a lot farther.",homeless
49,2023-01-30 02:30:55 UTC,7,2023-01-30 14:35:13 UTC,Efforts underway to examine number of homeless people in [ORGANIZATION],"This.

I have also seen that according to some homeless forums online, [ORGANIZATION] is a “good [STREET] to be homeless”, and even going so far as to advise putting “God bless” on their signs for better success.

I’ve lived here for [ORGANIZATION] and while we’ve always had homeless, it’s really kicked up in [LOCATION] or so. People in general are still relatively sympathetic but nowadays I can’t even go [TIME] across town to ORG1 without seeing at least two cardboard signs out. Even [PERSON] generosity has its limits, and if word got out that any of them were choosing to be beggars, what sympathy is left will quickly dissipate.

And it puts us in a rough position because either we enact sensible homeless laws and programs designed to actually help them get back on their feet, or we become like bigger cities and start putting spikes under bridges and shit. I’ll let you guess which outcome is more likely in a deep red state.","homeless, beggar"
49,2023-01-30 02:30:55 UTC,2,2023-02-01 12:02:12 UTC,Efforts underway to examine number of homeless people in [ORGANIZATION],"You’re right. When the subject of our larger than normal homeless come up in normal conversation I’d say most people do not understand the population as a whole. Who they are, their make up, the multiple reasons, where they camp and live, or maybe they’re just invisible to their eyes. 

I find myself getting irritated by those who I suspect of doing as a choice. I think if the “nomad” life is the life you want to live you need to do it within the legal boundaries of society and don’t take from the resources meant for those truly in need, and I mean all the [STREET] down to even collecting resources at a [STREET] corner. [ORGANIZATION] has more homeless children than any other county in [ORGANIZATION]. There are a lot of people truly in need that are not getting what they need to get out of said situation because the resources get snatched up by those who really aren’t in a desperate situation. 

The city of [ORGANIZATION] does a good job providing some assistance but they can only do so much with the funds they have. We need so much more and it’s going to take quality studies to get the data on the record to secure funding, because it’s not just a [ORGANIZATION] problem, it’s a ORG1 problem. Municipal infrastructure to help those who need a hand up is much like all infrastructure in that the government doesn’t get the funds until first it gets the population.

I don’t have answers, but I wish people had a better understanding of the situation.",homeless
49,2023-01-30 02:30:55 UTC,2,2023-01-30 14:05:26 UTC,Efforts underway to examine number of homeless people in [ORGANIZATION],So whats the solution? Stop providing aid? Build homeless camps to keep them contained? Arrest them? Build more tiny home towns/trailer parks?,homeless
49,2023-01-30 02:30:55 UTC,-4,2023-01-30 18:03:16 UTC,Efforts underway to examine number of homeless people in [ORGANIZATION],"Our city council was the ones to vote pandling in as legal in [ORGANIZATION].  Notice it was not an issue before that?  However I am not sure if they could have done much, if it was a [ORGANIZATION] ruling :/

Get this : the [ORGANIZATION] protects panhandling as ""Free Speech"" lmao.

The city attorney explained that [ORGANIZATION] removed most regulations on panhandling in [ORGANIZATION] after the [ORGANIZATION] decision. Not long after, other cities were sued for regulations they kept in [STREET] for panhandling.

[URL]",panhandler
49,2023-01-30 02:30:55 UTC,3,2023-01-30 15:48:21 UTC,Efforts underway to examine number of homeless people in [ORGANIZATION],"Right, when [half of the homeless are employed]([URL] and their employment can't even provide them gainful housing... what's the point in working or trying to better yourself? If you're barely scraping out an existence, working or not, might as get used to your new reality. The situation of people falling into homelessness and extreme poverty is a feature of our economic system, not a bug.","homeless, homelessness"
49,2023-01-30 02:30:55 UTC,3,2023-01-30 17:58:46 UTC,Efforts underway to examine number of homeless people in [ORGANIZATION],"I dont think its about that really.  I used to rent for [ORGANIZATION].  Say someone, a good samaritain wanted to help someone out, someone homeless.  They pick them up off the [STREET] and bring them in, want to pay [ORGANIZATION] of their apartment rent AND put the deposit down, great right.  [LOCATION].  


Under state and federal law that person (the homeless person) has to provide me a [STREET] of employment with phone #, current address and a method in which they are going to pay the rent aka you have to have a job.  Personally I dont care if you have a job, but no rental application is going to approve someone with no working phone, no job, no current address etc etc.  Everything is ran through a credit background and sexual background check and most people in situation are not going to pass just due to things like no bank account, no working phone, or no trasportation or previous address, no employment.  


You may be a really nice person and just say ""yea after me and the wife split, I made some bad decisions and I live in the woods just off the trail over there"" and expect to be able to move foward.  


There is no real ez fix at all.",homeless
49,2023-01-30 02:30:55 UTC,4,2023-01-30 14:27:14 UTC,Efforts underway to examine number of homeless people in [ORGANIZATION],"Whatever solution there may be it is undoubtedly complex and difficult.  Identifying the two underlying causes of homelessness, choice and displacement, and creating programs to target each would be a good starting point. For [ORGANIZATION] specifically, I do feel there needs to be a designated area for homeless where they can live unbothered provided they are not harming anyone or damaging property. In tandem with programs to target those that want to change their situation.","homeless, homelessness"
49,2023-01-30 02:30:55 UTC,1,2023-01-31 18:53:15 UTC,Efforts underway to examine number of homeless people in [ORGANIZATION],"Pqndhandling did exist and many thought it was a problem before. You are conflating homelessness and pqndhandling though. While connected, most homeless people don't panhandle and not all panhandlers are homeless.","homeless, homelessness, panhandler"
49,2023-01-30 02:30:55 UTC,2,2023-01-31 01:53:01 UTC,Efforts underway to examine number of homeless people in [ORGANIZATION],"Thats not the exact coordinates, its general location, and the police are already aware. 

Am i putting lives at risk by saying that the homeless have infested [DATE] of the greenway? Oh no! Now everyone knows where the dangerous criminals are.",homeless
49,2023-01-30 02:30:55 UTC,4,2023-01-31 04:54:51 UTC,Efforts underway to examine number of homeless people in [ORGANIZATION],"[ORGANIZATION], [PERSON] got tired of its homeless problem, realizing it cost the city more to police and hospitalize them than house them, so they housed them. And with a permanent location, they were able to get them social services, addiction treatment, etc. which simply isn't possible when they're on the [STREET].",homeless
49,2023-01-30 02:30:55 UTC,0,2023-01-31 22:34:23 UTC,Efforts underway to examine number of homeless people in [ORGANIZATION],">Under state and federal law that person (the homeless person) has to provide me a [STREET] of employment with phone #, current address and a method in which they are going to pay the rent aka you have to have a job.

There is no state or federal law that requires a tenant to provide employment documentation in order to pay rent, that's bullshit.",homeless
49,2023-01-30 02:30:55 UTC,0,2023-01-30 18:18:57 UTC,Efforts underway to examine number of homeless people in [ORGANIZATION],"Well that starts you down a slippery path and opens you up to larger problems.

Say you make them a 10 acre [STREET] to be undisturbed, what do you do when that [STREET] is full?  ""Sorry no more people?""  No, you either expand it or make a second location.  What do you do when the 2nd [STREET] is full?:  


Rinse and repeat and before you know it you have a [STREET] like the [ORGANIZATION] boardwalk and its so big the only [STREET] to clean it up is just to bulldoze it and start over.  I get where your kindheartedness is but giving up and just telling them its ok to move here and congregate is not the answer.  


As it becomes more and more of a problem businesses will leave, money and tax dollars with it.  I mean who wants to start their business in a location with visible homeless and tent/tarp farms within eyeshot yanno?",homeless
49,2023-01-30 02:30:55 UTC,0,2023-01-30 19:40:20 UTC,Efforts underway to examine number of homeless people in [ORGANIZATION],"You absolutely can fix it and many cities do.  You simply have to make the city an undesirable [STREET] for the homeless to be, period.  Now where it gets difficult is if the citizens can't stomach what it means to make it undesirable, that's where the problems start and tend to never end.

Until the citizens start making decisions that deter homelessness, nothing will ever change.","homeless, homelessness"
49,2023-01-30 02:30:55 UTC,1,2025-01-03 22:40:43 UTC,Efforts underway to examine number of homeless people in [ORGANIZATION],"I’m reply to all the comments about homeless people I am DATE0 I was homeless for [LOCATION], when we first moved here and became homeless I was always terrified me and my husband are good people we try to move on when we first moved here we cleaned up walker park over by the horse shoe pit nobody asked us to but we did just because we were homeless we were judged b but excuse me but last I knew that we were all gods children and all bleed red in that matter ",homeless
49,2023-01-30 02:30:55 UTC,2,2023-01-31 04:42:04 UTC,Efforts underway to examine number of homeless people in [ORGANIZATION],"They are primarily coming here because the community accomodates them.   I can [STREET] up the [STREET] to [ORGANIZATION], where there are nearly zero ""homeless services"" and you rarely see any homeless people.  

&#x200B;

Imagine trying to have those beautiful mountain bike parks they have up there, but in [ORGANIZATION].  They'd be full of drug paraphernalia and trash because of homeless camps.",homeless
49,2023-01-30 02:30:55 UTC,1,2023-01-30 20:56:15 UTC,Efforts underway to examine number of homeless people in [ORGANIZATION],"To be clear, when I say citizens start making decisions I mean they need to vote people in who are willing to make difficult decisions like shut the [INSTITUTION] down, remove the tent cities from private property, make it illegal to beg for money.  You do these things and they will go find somewhere else plop down or decide that getting a job is a better idea.

I do not advocate people taking matters into their own hands and promote violence against them.",homeless
49,2023-01-30 02:30:55 UTC,1,2023-01-30 21:17:13 UTC,Efforts underway to examine number of homeless people in [ORGANIZATION],"Oh me either, I dont mean it as it read, I just agree with you, it has to be done at the local level was all.

It feels like our hands are tied currently, I thought it was just a matter of new leadership removing a ban on it in [ORGANIZATION], but I came to find out [ORGANIZATION] voted it legal its apparently ""Freedom of Speec"" and protected now, nothing that the city or county level can really do to stop them.

yes we would need to close down the resources so our area is no longer posted online as a ""good [STREET] for homless / good [STREET] to be homeless / easy to be homeless"" on some online forums.  


If we keep providing them resources its just going to get worse, as cruel as that sounds, to get rid of any problem, you need to root it out from the core.  But like......what is the situation yanno, are we going to have groups of police walking the woods with like tools and axes and trash bags to break apart and remove tents tarps and the like, and what about if someone is inside it, what do you do just lock them up?  

Really sucks for all involved",homeless
27,2021-10-28 18:06:31 UTC,15,2021-10-29 01:58:15 UTC,[ORGANIZATION] property owners allow homeless group to camp outside; neighbor expresses concern,"Hundreds of houses and apartments sit empty in the city.

Each incident involving fire or police regarding the homeless costs tens of thousands of dollars in city services.

Yearly rent is less than one 911 call. 

We could house them and give them staff and save the city tax money.

Why is it so important for [ORGANIZATION] and other real estate investors to cost the city so much money so they can increase their obscene wealth?",homeless
27,2021-10-28 18:06:31 UTC,17,2021-10-28 19:32:34 UTC,[ORGANIZATION] property owners allow homeless group to camp outside; neighbor expresses concern,"I’ve driven by a few times over [ORGANIZATION]. Seems fine. Sounds like the neighbor is the issue. 
I have a neighbor up by the library that brags about going into the woods and destroying homeless camps, pisses me off! One of the many reasons I don’t associate with him anymore. How can you think it’s ok to take a knife to a homeless persons tent? Also, they are in the woods not hurting a thing. He will even take a trash bag and bag up their belongings and take it away.",homeless
88,2020-07-14 13:12:54 UTC,25,2020-07-14 14:55:35 UTC,Life in a homeless encampment in the shadow of FAC0,Bless these people. Man.. what a difficult life. I encourage anyone reading this to donate to the non profits that help our homeless brothers and sisters. I’ve personally chosen to donate to [ORGANIZATION]: https://[ORGANIZATION][URL],homeless
88,2020-07-14 13:12:54 UTC,18,2020-07-14 13:58:34 UTC,Life in a homeless encampment in the shadow of FAC0,"I wonder how much awareness there is of certain homeless help centers and programs? Just as an example, one of the interviewed men mentions having trouble just getting a shower - there is a well-known program/center called [ORGANIZATION] that has a day center offering food, showers, clothes, bus passes, storage, internet, and many more resources and services.",homeless
88,2020-07-14 13:12:54 UTC,3,2020-07-15 01:50:54 UTC,Life in a homeless encampment in the shadow of FAC0,"Upvoted.  But we also need to get this message out:.donating to homeless centers, jobs programs, etc., is never going to fix the root of homelessness.

Those solutions can only be found systemically, so [ORGANIZATION].","homeless, homelessness"
88,2020-07-14 13:12:54 UTC,9,2020-07-14 15:37:23 UTC,Life in a homeless encampment in the shadow of FAC0,Time they could have used people need to understand being homeless is a survival situation you always have to move cant stay still,homeless
33,2024-09-06 04:26:58 UTC,8,2024-09-06 21:17:33 UTC,Here's the recording of the candidate forum for Mayor. What did you guys think?,"""She also lives in a million dollar house in the historic district and tries to say she understands the [ORGANIZATION] housing crisis. They should have had the thrown up a comparison of the candidates homes during the debate.""

I am a neighbor. That's an outright lie. She does not live in that area, and unless there is gold hidden in the bricks, it's not a million dollar house.",housing crisis
33,2024-09-06 04:26:58 UTC,31,2024-09-06 12:16:17 UTC,Here's the recording of the candidate forum for Mayor. What did you guys think?,"The part where [ORGANIZATION] said something along the lines of ""people aren't moving here because of panhandlers"" gave me a bit of whiplash. What a bizarre statement to make on a question about how we can help the homeless population.","homeless, panhandler"
33,2024-09-06 04:26:58 UTC,13,2024-09-06 12:59:06 UTC,Here's the recording of the candidate forum for Mayor. What did you guys think?,"> people aren't moving here because of panhandlers

On top of being a wild thing to say, we know for a fact that people *are* moving here. He's straight up just wrong.",panhandler
33,2024-09-06 04:26:58 UTC,0,2024-09-06 13:15:10 UTC,Here's the recording of the candidate forum for Mayor. What did you guys think?,"They should stop being cagey and just point out how profitable it would be to illegalize homelessness, think of the free labor!","homeless, homelessness"
33,2024-09-06 04:26:58 UTC,7,2024-09-07 11:23:31 UTC,Here's the recording of the candidate forum for Mayor. What did you guys think?,"Edit: She rented [ORGANIZATION] before and after getting married.  Including in [ORGANIZATION]. When her mother passed, she was able to use the proceeds from the sale of her mother's home toward an older home in an older neighborhood. This is a local race. There is no reason to make such assumptions. Just ask them. 

She has children that are, or will soon be trying to rent in this housing crisis. She has employees navigating this rental market. I own my home now, but my kids being able to live here as adults if they want, is my #1 election issue. The renter advocates I know are supporting [ORGANIZATION].  

If a candidate currently being a renter is important to you, then [PERSON] may be your guy. PERSON2 and [ORGANIZATION] are the only candidates that said renters should have been appointed renters to the [ORGANIZATION] taskforce. We have choices, and you're free to make that choice.",housing crisis
33,2024-09-06 04:26:58 UTC,2,2024-09-07 00:14:21 UTC,Here's the recording of the candidate forum for Mayor. What did you guys think?,"Thinking about it, you're right. I think I've talked myself into thinking it was just slow, but it really is just obstruction. I guess if a voter wants to keep a [ORGANIZATION] from [ORGANIZATION], exacerbate the housing crisis and bankrupt a future [ORGANIZATION] with the cost of maintaining a sprawled infrastructure, re-elect [ORGANIZATION].",housing crisis
33,2024-09-06 04:26:58 UTC,6,2024-09-07 17:30:16 UTC,Here's the recording of the candidate forum for Mayor. What did you guys think?,"Yeah, that was misleading: To be clear, nobody's advocating skyscapers so much as it's a bunch of hand-wringing regarding how tall to go with a general spread of 5-7ish stories- as is currently allowed and you see on FAC0 and the square right now. 

For the general audience: **When taller buildings are allowed, housing is much cheaper per unit** (and therefore less pressure for sprawl). Lest we cave to NIMBYism, this is one of the most powerful tools the city government has to take on the housing crisis and make infrastructure [STREET], [STREET] cheaper to maintain.

-

[ORGANIZATION], this really just means that sometimes developers will have the option of building up, it's not like they have to choose to do it.",housing crisis
28,2024-12-26 19:55:13 UTC,64,2024-12-26 20:18:59 UTC,FAC0,The shelter is off FAC0 [STREET] so most of the homeless population congregate in south [ORGANIZATION] around FAC1. There isn’t an unsafe part of [ORGANIZATION] if you use your common sense. Most of the danger comes from [ORGANIZATION]. The traffic is fine. People who complain about it haven’t lived in a metro area. I used to live between FAC2 and campus. Never had any issues with safety or getting around town. I would walk to [PERSON] or downtown often.,homeless
28,2024-12-26 19:55:13 UTC,21,2024-12-26 20:21:09 UTC,FAC0,"I’ve lived off FAC0 for DATE0. Traffic flow can be bad during [ORGANIZATION] events, rush hour and holidays but I’m not really aware of any crime concerns. I’ve heard it’s been increasing in [ORGANIZATION] but that’s not really saying much. It’s pretty safe in general around here.

[PERSON] ([INSTITUTION]) used to be in [PERSON]’s location right next to a car wash where they would commonly beg for change. Homeless people were pretty rampant then. However, [PERSON] has moved away to FAC1 closer to [ORGANIZATION] and hasn’t been an issue since.",homeless
28,2024-12-26 19:55:13 UTC,8,2024-12-26 20:04:41 UTC,FAC0,"Used to live on FAC0, it was [ORGANIZATION] so may have changed with the new developments but I’d say it’s a pretty good spot. Traffic can certainly get bad (especially on DATE1) but I personally think it’s better than driving through downtown [ORGANIZATION] or FAC1. It’s got great access to campus, FAC2 and the square, and you’ve got a ton of restaurants right across the [STREET]. Crime and homelessness have definitely been getting worse over DATE2 but it’s not too bad, certainly worse areas (leveret). 

Long story short, traffic will beat [ORGANIZATION], quick access to everything in [ORGANIZATION], and crime and homeless is the same if not better than a lot of the city","homeless, homelessness"
28,2024-12-26 19:55:13 UTC,2,2024-12-27 14:48:04 UTC,FAC0,I wouldn't worry about thieves and homeless people (just lock your doors)  so much as the traffic. It's ridiculous and even worse on [ORGANIZATION]. I used to live in [ORGANIZATION] and trying to get into [PERSON] that [STREET] could be such a nightmare due to [ORGANIZATION].,homeless
28,2024-12-26 19:55:13 UTC,2,2024-12-27 07:40:06 UTC,FAC0,I have lived in [ORGANIZATION] since [ORGANIZATION] mainly [ORGANIZATION] I had the I moved to [PERSON] in [LOCATION] and I lived there until DATE2 and it was not a very pleasant experience the rent was cheaper but the homeless stole from numerous of times it changed my opinion of people living on the streets not everyone is like that but a lot of people the homeless people in [PERSON] GPE2 seem but overall I wouldn't say it it was unsafe,homeless
28,2024-12-26 19:55:13 UTC,1,2024-12-27 01:49:21 UTC,FAC0,I live off of FAC0 now. The homeless that I have run into are friendly and stay out of your [STREET].,homeless
