filename,date,paragraph,matched_words
04_18_2023_fayetteville_meeting_minutes_compressed.mp3.c6ae5c36-dcfd-416e-a2e2-ccd679536e45.Transcript.txt,04_18_2023,"hi i'm jennifer cole i live at one north school avenue in public housing and um  I just want to say, according to the description, I guess I was three months away from chronic homelessness at one time. And I didn't realize I was that close. And I'm very lucky to have the support systems I have.",homelessness
04_18_2023_fayetteville_meeting_minutes_compressed.mp3.c6ae5c36-dcfd-416e-a2e2-ccd679536e45.Transcript.txt,04_18_2023,"But even if you can't imagine that, try to imagine living on $900 a month and knowing that affordable rent in Fayetteville is $1,500. So if we got this beautiful gift of two months start to get into affordable housing, I don't know where you'd go after that two months. It's not affordable for anybody that doesn't have it.",affordable housing
04_18_2023_fayetteville_meeting_minutes_compressed.mp3.c6ae5c36-dcfd-416e-a2e2-ccd679536e45.Transcript.txt,04_18_2023,real affordable housing which is saying you're going to pay 30% and Fayetteville Housing Authority has closed its doors to anybody they can't do it anymore They don't have those support systems and after talking to their ED. They're not doing anything extra and  Anything including a social worker is extra right now.,affordable housing
04_18_2023_fayetteville_meeting_minutes_compressed.mp3.c6ae5c36-dcfd-416e-a2e2-ccd679536e45.Transcript.txt,04_18_2023,I don't want to see us looking at jails as our solution for homelessness. It's not a solution. There's no place for you to go from jail.,homelessness
04_18_2023_fayetteville_meeting_minutes_compressed.mp3.c6ae5c36-dcfd-416e-a2e2-ccd679536e45.Transcript.txt,04_18_2023,"I live at 3205 East Charing Cross here in Fayetteville. So I'm especially thankful for the back and forth that DeAndre and Solomon had, because I think it's the most clarifying point for why this proposal has unique value. What you have in this proposal is addressing chronic homelessness  we all know that there's a wide variety of reasons why people are housing insecure.",homelessness
04_18_2023_fayetteville_meeting_minutes_compressed.mp3.c6ae5c36-dcfd-416e-a2e2-ccd679536e45.Transcript.txt,04_18_2023,"And as Solomon kind of mapped out on that first slide, there's a spectrum of ways that you address all the different reasons why people are housing insecure. So I think for that reason alone, this is a really, really good proposal to support because not only is it,  addressing that especially chronic situation in terms of homelessness. But it's also actually, although the cost is high upfront, is very cost effective.",homelessness
04_18_2023_fayetteville_meeting_minutes_compressed.mp3.c6ae5c36-dcfd-416e-a2e2-ccd679536e45.Transcript.txt,04_18_2023,"It will do nothing for the city long-term in terms of city costs. But if you put a million dollars into housing people who are in chronic poverty  situations of homelessness. You will ameliorate all kinds of costs, medical costs, police costs, city services.",homelessness
04_18_2023_fayetteville_meeting_minutes_compressed.mp3.c6ae5c36-dcfd-416e-a2e2-ccd679536e45.Transcript.txt,04_18_2023,"And there are lots of ways to do that, but there's not a single entity in city government doing that. And I'd like to suggest that we seriously consider an office about affordable housing and homelessness.  that could begin to really kind of coordinate this. And if it was up to me, I would hire Solomon, but I'm sure there are other good people that would be available too.",homelessness; affordable housing
04_18_2023_fayetteville_meeting_minutes_compressed.mp3.c6ae5c36-dcfd-416e-a2e2-ccd679536e45.Transcript.txt,04_18_2023,"And for so many reasons that I should probably just say, yeah, what they said and then go sit down, but you know me better than that. When we talk about folks who are homeless, a lot of folks think about broken people. But I want to be clear that this is, when we have folks living on our trails, in the woods, in people's yards, that's about a broken housing market.",homeless
04_18_2023_fayetteville_meeting_minutes_compressed.mp3.c6ae5c36-dcfd-416e-a2e2-ccd679536e45.Transcript.txt,04_18_2023,"If we expand our capacity, we make more affordable housing. That's what we need. This is a good way to do it.",affordable housing
04_18_2023_fayetteville_meeting_minutes_compressed.mp3.c6ae5c36-dcfd-416e-a2e2-ccd679536e45.Transcript.txt,04_18_2023,"uh i support solomon's uh proposal i'm not very good at talking to mikes but uh it's okay as far as um the homeless community and whatnot as far as the new beginnings uh my friends that have been there they've i've seen their lives change right around just by being there the short time they have they went from having nothing and now they're like they're starting to become become in bloom i guess you'd say uh  As far as the trash and all that stuff that you guys have problems with, I'm in the trenches and I stay in the trenches. I don't live at New Beginnings, but I'm in the program and going to be.",homeless
04_18_2023_fayetteville_meeting_minutes_compressed.mp3.c6ae5c36-dcfd-416e-a2e2-ccd679536e45.Transcript.txt,04_18_2023,"I've been homeless for five years in northwest Arkansas, and I've lived here my whole life. Anyways, I'm from here. So I love the rivers and the bike trail.",homeless
04_18_2023_fayetteville_meeting_minutes_compressed.mp3.c6ae5c36-dcfd-416e-a2e2-ccd679536e45.Transcript.txt,04_18_2023,My name is Anita Crosby. I live at 3512 West Buckeye Street here in Fayetteville. Some friends and I are very concerned about.  affordable housing and homelessness.,homelessness; affordable housing
04_18_2023_fayetteville_meeting_minutes_compressed.mp3.c6ae5c36-dcfd-416e-a2e2-ccd679536e45.Transcript.txt,04_18_2023,"We are very disappointed with the city's decision to clean up the trash on the trails, meaning the homeless. If they don't have anywhere to live, giving them 48 hours to move somewhere else is not going to do anything. I have been wondering about that property on West End.",homeless
04_18_2023_fayetteville_meeting_minutes_compressed.mp3.c6ae5c36-dcfd-416e-a2e2-ccd679536e45.Transcript.txt,04_18_2023,"Could we do some sort of taxing on rentals that  on the Airbnb rentals that don't have anyone living there? Most of the time they rent them for three, four, five nights a month and make enough to make a profit on them. Can we tax those high enough to make them, one, less profitable, and two, to raise money to help address this homeless issue?",homeless
04_18_2023_fayetteville_meeting_minutes_compressed.mp3.c6ae5c36-dcfd-416e-a2e2-ccd679536e45.Transcript.txt,04_18_2023,"and I trust you read my letter, so I'll try not to repeat much of what I said. But I've been thinking about the people I know, people who have been in my life, who have been homeless at one time or another. For a long time, when my father was little, my grandparents didn't have anywhere to live.",homeless
04_18_2023_fayetteville_meeting_minutes_compressed.mp3.c6ae5c36-dcfd-416e-a2e2-ccd679536e45.Transcript.txt,04_18_2023,"And my grandfather worked full-time, as many homeless people do. And they camped wherever they could, wherever someone would give them permission to camp. Not campgrounds.",homeless
04_18_2023_fayetteville_meeting_minutes_compressed.mp3.c6ae5c36-dcfd-416e-a2e2-ccd679536e45.Transcript.txt,04_18_2023,"Schizophrenia often doesn't become apparent until someone is a young adult. He has since experienced homelessness, arrests and hospital stays, but he has a safety net, a family who does the best they can to keep him housed. But many people don't have that safety net.",homelessness
04_18_2023_fayetteville_meeting_minutes_compressed.mp3.c6ae5c36-dcfd-416e-a2e2-ccd679536e45.Transcript.txt,04_18_2023,Please support the New Beginnings Plan for some affordable housing. The ARPA funds give us a great opportunity to make some progress in this area. And then let's get to work and figure out what to do next.,affordable housing
04_18_2023_fayetteville_meeting_minutes_compressed.mp3.c6ae5c36-dcfd-416e-a2e2-ccd679536e45.Transcript.txt,04_18_2023,"So I spend a lot of time in community and in conversation with my unhoused neighbors. many of them who are chronically unhoused, as Solomon gave us such an amazing definition of. And I'm speaking in vigorous support of spending ARPA money this way because of a language thing.",unhoused
04_18_2023_fayetteville_meeting_minutes_compressed.mp3.c6ae5c36-dcfd-416e-a2e2-ccd679536e45.Transcript.txt,04_18_2023,"And this is...  someone brought up the importance of being intentional with language today and I just want to say that there's a difference in using the words homeless and unhoused because homeless is almost like a neutral thing like oh we don't know how they came to not be with a home whereas unhoused means it's a it's a conscious choice by people with resource and agency to be able to fix the problem choosing not to and  As I said, I'm in community and conversation with these people all the time, just walking down the street, saying hello, asking people what they need, sometimes just sitting and listening to people. And almost every single one of these people that I know personally, I can think of like five that I see daily in my life whose lives would be transformed and turned around by a program like this.",homeless; unhoused
04_18_2023_fayetteville_meeting_minutes_compressed.mp3.c6ae5c36-dcfd-416e-a2e2-ccd679536e45.Transcript.txt,04_18_2023,Please protect the unhoused. Thank you. Thank you.,unhoused
04_18_2023_fayetteville_meeting_minutes_compressed.mp3.c6ae5c36-dcfd-416e-a2e2-ccd679536e45.Transcript.txt,04_18_2023,"The first thing that I want to say is that we all realize that homelessness is not a Fayetteville issue. Homelessness is a regional issue. But I commend Fayetteville for all of the work  that you continue to do on behalf of those who are struggling finding housing, securing housing, and staying in housing.",homelessness
04_18_2023_fayetteville_meeting_minutes_compressed.mp3.c6ae5c36-dcfd-416e-a2e2-ccd679536e45.Transcript.txt,04_18_2023,"One of those things is collaboration. The continuum of care, our job, my job is to create a community response to end homelessness. My job is to look over our four counties, Benton, Washington, Carroll, and Madison, and bring agencies and cities and stakeholders and concerned citizens together and say, how do we end homelessness in Northwest Arkansas?",homelessness
04_18_2023_fayetteville_meeting_minutes_compressed.mp3.c6ae5c36-dcfd-416e-a2e2-ccd679536e45.Transcript.txt,04_18_2023,"My job is that one-stop shop where we get individuals, we assess them, we get their names, we get their information, we figure out what their vulnerability is. Since we started doing these assessments in 2018, we have done over 3,000 assessments. So over 3,000 individuals have at one point in time considered themselves literally homeless, not in emergency shelter, on the streets, somewhere.",homeless
04_18_2023_fayetteville_meeting_minutes_compressed.mp3.c6ae5c36-dcfd-416e-a2e2-ccd679536e45.Transcript.txt,04_18_2023,"These are individuals that are literally homeless at the time of the assessment. When their assessment score is super high, they qualify for what we call permanent supportive housing. That is that housing that we are talking about.",homeless
04_18_2023_fayetteville_meeting_minutes_compressed.mp3.c6ae5c36-dcfd-416e-a2e2-ccd679536e45.Transcript.txt,04_18_2023,"That is that housing for the chronically homeless individuals that we have in our area. Are the majority of our chronically homeless within the city of Fayetteville? Yes, absolutely.",homeless
04_18_2023_fayetteville_meeting_minutes_compressed.mp3.c6ae5c36-dcfd-416e-a2e2-ccd679536e45.Transcript.txt,04_18_2023,"So they sit holding the vouchers, holding HUD money, essentially, that we cannot spend and become at risk of giving back to the government because we don't have the affordable housing with low barriers. Am I saying that, you know, six apartments, 60 apartments, 600 apartments is going to fix this? No, I'm not saying that.",affordable housing
04_18_2023_fayetteville_meeting_minutes_compressed.mp3.c6ae5c36-dcfd-416e-a2e2-ccd679536e45.Transcript.txt,04_18_2023,"But I am saying that we need to try. to at least put a dent in this brick wall that we have created, because on our by name list, we have over 320 individuals currently within the last 90 days, who have identified themselves as literally homeless,  I have no place to send them. I can refer all day to Seven Hills.",homeless
04_18_2023_fayetteville_meeting_minutes_compressed.mp3.c6ae5c36-dcfd-416e-a2e2-ccd679536e45.Transcript.txt,04_18_2023,"and I think we need assistance with case management and all that for people at risk of losing their housing. Absolutely. Absolutely.  for these individuals who are chronically homeless, they don't even have a house.",homeless
04_18_2023_fayetteville_meeting_minutes_compressed.mp3.c6ae5c36-dcfd-416e-a2e2-ccd679536e45.Transcript.txt,04_18_2023,I was just speaking with my therapist today about how I'm three cataclysmic life steps away from becoming unhoused or experiencing houselessness or being housing insecure. A lot of that statistically has to do with the fact that I am disabled. But I say three for this reason.,unhoused
04_18_2023_fayetteville_meeting_minutes_compressed.mp3.c6ae5c36-dcfd-416e-a2e2-ccd679536e45.Transcript.txt,04_18_2023,"and then that ended, they would be back out on the street homeless. Solomon's plan deals with long-term care of these people. I think it's really important to fund.",homeless
04_18_2023_fayetteville_meeting_minutes_compressed.mp3.c6ae5c36-dcfd-416e-a2e2-ccd679536e45.Transcript.txt,04_18_2023,"And so that is really important to not think of Solomon's plan as the end, but it's the beginning of finding a way for long term planning to deal with homelessness here in Fayetteville. Thanks. Thank you.",homelessness
04_18_2023_fayetteville_meeting_minutes_compressed.mp3.c6ae5c36-dcfd-416e-a2e2-ccd679536e45.Transcript.txt,04_18_2023,"I worked for a long time in clinical settings with populations of folks who were unhoused. I'm still learning the vernacular. I don't look like it, but I'm a lot older than you think.",unhoused
04_18_2023_fayetteville_meeting_minutes_compressed.mp3.c6ae5c36-dcfd-416e-a2e2-ccd679536e45.Transcript.txt,04_18_2023,"And what I discovered is that in all my training and all of the work that I've done, I developed this clinical language that kept the experience that homeless people actually had at a distance. I could use clinical categories to discuss things about them. I could use theological concepts like sin and fallenness and so on and so forth about them.",homeless
04_18_2023_fayetteville_meeting_minutes_compressed.mp3.c6ae5c36-dcfd-416e-a2e2-ccd679536e45.Transcript.txt,04_18_2023,And then one day I had a breakthrough. It changed my ministry and my approach to it. And that was I sat down with a homeless person,homeless
04_18_2023_fayetteville_meeting_minutes_compressed.mp3.c6ae5c36-dcfd-416e-a2e2-ccd679536e45.Transcript.txt,04_18_2023,"This was when I was the executive director of the Samaritan Counseling Center, and we focused on clients who could not afford psychotherapy. And we had a social worker who helped unhoused people find resources to deal with the situation they were in. But this is the first time I'd actually sat down with someone and said, what's it like to be you?",unhoused
04_18_2023_fayetteville_meeting_minutes_compressed.mp3.c6ae5c36-dcfd-416e-a2e2-ccd679536e45.Transcript.txt,04_18_2023,"And when I've gone to bigger and richer cities that have more unhoused populations and less care for them, it has disgusted me to my core. Silas, I believe is your name, brought up the thing that brought me here today and Jude repeated on it. I believe Erin did as well.",unhoused
04_18_2023_fayetteville_meeting_minutes_compressed.mp3.c6ae5c36-dcfd-416e-a2e2-ccd679536e45.Transcript.txt,04_18_2023,"We see parking garages and hideous student housing and very little aid going to our homeless population. And to a person, everyone I've spoken to about this is disgusted and infuriated by the direction that this town is going in these aspects. We have an opportunity to do better, to be better.",homeless
04_18_2023_fayetteville_meeting_minutes_compressed.mp3.c6ae5c36-dcfd-416e-a2e2-ccd679536e45.Transcript.txt,04_18_2023,"I've seen advertisements in Texas calling Northwest Arkansas the next Austin. But if that means in 10 or five years I see hundreds of homeless people shivering one block over from thousands of partying bar goers, I will be disgusted to call this place home. You do not make your home beautiful by decorating it with the corpses of the less fortunate, and I do not want to live somewhere that pretties itself by pricing up the poor and throwing them in prison.",homeless
04_18_2023_fayetteville_meeting_minutes_compressed.mp3.c6ae5c36-dcfd-416e-a2e2-ccd679536e45.Transcript.txt,04_18_2023,"Thinking back to what Alderman Moore said earlier about how the ARPA funds are for those who were disproportionately impacted by the pandemic and those who have been historically vulnerable. Working in the housing sector for several years, I have seen that with the specific subset of chronic homeless folks. As Solomon described it earlier, you know, with the eviction moratorium that happened, we've seen fewer and fewer landlords that have been able to work with different housing programs and vouchers because they've had interest to recoup as well.",homeless
04_18_2023_fayetteville_meeting_minutes_compressed.mp3.c6ae5c36-dcfd-416e-a2e2-ccd679536e45.Transcript.txt,04_18_2023,"If someone comes and asks for rental assistance, I can at least  share some agencies that can assist with that. I know that there are yearly grants, things like emergency solution grants that can offer what we call rapid rehousing, which is to help folks for a couple of years before they can maintain on their own. Also homeless prevention programs, many agencies apply and receive those every year and do a great job administering those.",homeless
04_18_2023_fayetteville_meeting_minutes_compressed.mp3.c6ae5c36-dcfd-416e-a2e2-ccd679536e45.Transcript.txt,04_18_2023,"And of course we could always use more. But this is really a unicorn of an opportunity because it's not something that we have seen to help folks who are chronically homeless with permanent supportive housing. And while there are wonderful transitional housing programs in our community, what we find is that they do try to target the most vulnerable in our community.",homeless
04_18_2023_fayetteville_meeting_minutes_compressed.mp3.c6ae5c36-dcfd-416e-a2e2-ccd679536e45.Transcript.txt,04_18_2023,"So when folks do, if they've been lucky enough to have a voucher because they were on the list before it closed, try to find affordable housing. But that doesn't. you're really for a one bedroom allowed about seven hundred dollars",affordable housing
04_18_2023_fayetteville_meeting_minutes_compressed.mp3.c6ae5c36-dcfd-416e-a2e2-ccd679536e45.Transcript.txt,04_18_2023,"so if you look on zillow right now there are two apartments in fayetteville that are seven hundred dollars or less um and whether or not they will accept a voucher um and accept folks who might have barriers to housing like something on their criminal background um etc you're filtering even more folks how  So all that to just say that I just want to reiterate, this really is such a unique opportunity and I am pro all housing interventions. But I would just plead with the council to consider approving this proposal because I can't recall in several years something similar to this. My guess is that a lot of complaints you get from community members about folks who are homeless fall into the subset of chronic homelessness because there just aren't any housing opportunities for those folks or places for people to move on to, even when they're doing everything in their ability.",homeless; homelessness
04_18_2023_fayetteville_meeting_minutes_compressed.mp3.c6ae5c36-dcfd-416e-a2e2-ccd679536e45.Transcript.txt,04_18_2023,"And I wanted to just not repeat some of the many great points that people have already given, but also to just give you some of the maybe some of the county perspective as well. Because we know that folks who are chronically homeless, we've seen that the longer that folks are homeless, the more likely they are to be criminally justice involved. Okay.",homeless
04_18_2023_fayetteville_meeting_minutes_compressed.mp3.c6ae5c36-dcfd-416e-a2e2-ccd679536e45.Transcript.txt,04_18_2023,"So there's over 200 people in the jail sleeping on the floor. What we also know is that there are about, at any given time, there's about 100 people in the jail who are unhoused, who are homeless, who don't have a permanent residence. We also know that it costs about $30,000 per year, per individual, to house a person in the jail.",homeless; unhoused
04_18_2023_fayetteville_meeting_minutes_compressed.mp3.c6ae5c36-dcfd-416e-a2e2-ccd679536e45.Transcript.txt,04_18_2023,"For example, we've given $1.9 million to the Returning Home Program, which provides short-term transitional housing for people that are getting out of jail. It fills a needed gap. We just sent $1.7 million from emergency rental funding to the Accelerate Foundation to help construct affordable housing.",affordable housing
04_18_2023_fayetteville_meeting_minutes_compressed.mp3.c6ae5c36-dcfd-416e-a2e2-ccd679536e45.Transcript.txt,04_18_2023,"Now, we know construction of affordable housing isn't necessarily the cheapest way to go about housing people, but it's going to fill a needed gap. Right. So, you know, those are some of the things I just wanted to kind of give the council, you know, some information from our end of things, you know, because not everybody watches, you know, every quorum court meeting.",affordable housing
04_18_2023_fayetteville_meeting_minutes_compressed.mp3.c6ae5c36-dcfd-416e-a2e2-ccd679536e45.Transcript.txt,04_18_2023,I got a question for you. I'd like you to answer. You said that you all spent $1.7 million for affordable housing.,affordable housing
04_18_2023_fayetteville_meeting_minutes_compressed.mp3.c6ae5c36-dcfd-416e-a2e2-ccd679536e45.Transcript.txt,04_18_2023,"Well, we said, if I'm looking at my numbers right, in February, we sent $1.7 million to  of our ERA funds to the Accelerate Foundation for affordable housing construction. But we got 5.7 million in all through the ERA. So like the first round of that, I think the first 4 million, we sent to the Fayetteville Housing Authority and the Springdale Housing Authority to use for housing stability during the pandemic.",affordable housing
04_18_2023_fayetteville_meeting_minutes_compressed.mp3.c6ae5c36-dcfd-416e-a2e2-ccd679536e45.Transcript.txt,04_18_2023,and I want to express that I think the City of Fayetteville is very compassionate and that we've demonstrated that over the years. And I think that everybody in the City Council and the administration really wants to house the unhoused and do it with integrity and compassion and all of those things that make a person whole and human and successful. Right.,unhoused
04_18_2023_fayetteville_meeting_minutes_compressed.mp3.c6ae5c36-dcfd-416e-a2e2-ccd679536e45.Transcript.txt,04_18_2023,"I had multiple people talk about the city should have a heart. You know, I think the city of Fayetteville has the biggest heart in northwest Arkansas because we are the only community that spends the amount of money we spend for the homeless community with the different organizations that are in our community, the church organization, Seven Hills, New Beginnings. No other community has that.",homeless
04_18_2023_fayetteville_meeting_minutes_compressed.mp3.c6ae5c36-dcfd-416e-a2e2-ccd679536e45.Transcript.txt,04_18_2023,"It's not well. We need housing right I mean, let's get real here I'm looking I mean, you know, I don't want to sit around talk about a crisis on housing and then not talk I mean  we can't just say we got a housing crisis and then we turn down developments i mean",housing crisis
04_18_2023_fayetteville_meeting_minutes_compressed.mp3.c6ae5c36-dcfd-416e-a2e2-ccd679536e45.Transcript.txt,04_18_2023,i mean i'm a i'm a little frustrated with some of it because we go oh we've got a housing crisis and then when we bring a development then everybody says well we don't want that development,housing crisis
04_18_2023_fayetteville_meeting_minutes_compressed.mp3.c6ae5c36-dcfd-416e-a2e2-ccd679536e45.Transcript.txt,04_18_2023,"But we can build infrastructure with our own money. So in order to have ARPA money go farther in a tiny home sort of situation, then the road up to it or the sewer line or whatever like that,  is within the city council's power to use general fund money for. You can't do it for affordable housing, but you can do the infrastructure that is needed for affordable housing.",affordable housing
04_18_2023_fayetteville_meeting_minutes_compressed.mp3.c6ae5c36-dcfd-416e-a2e2-ccd679536e45.Transcript.txt,04_18_2023,"And so I would encourage that you don't make a decision tonight. You've heard what the city council is saying. And I think, unless I'm gauging everything wrong, I think they're thinking more about a tiny home situation as opposed to  Going on to the economy and buying where it should be actually also reducing the amount of affordable housing Even though you'd have your people in it, but then they wouldn't be available for the market",affordable housing
