filename,date,paragraph,matched_words
09_19_2023_fayetteville_meeting_minutes.mp3.32489094-0a98-4497-a4cb-48d85999110b.Transcript.txt,09_19_2023,"This is Bob Stafford, Ward 1, 527 South Sherman Avenue. Thank you, Sarah Moore, for bringing this forward and thanks to DeAndre Jones for his vocal support. We are in a housing crisis.",housing crisis
09_19_2023_fayetteville_meeting_minutes.mp3.32489094-0a98-4497-a4cb-48d85999110b.Transcript.txt,09_19_2023,"We are in a housing crisis. If you don't know this, you're not paying attention. I had recently lost two members of the Arts Council because we are in a housing crisis.",housing crisis
09_19_2023_fayetteville_meeting_minutes.mp3.32489094-0a98-4497-a4cb-48d85999110b.Transcript.txt,09_19_2023,"One of those members is why you have a vacant seat in the horseshoe tonight because Sonya had to move.  out of the ward because she couldn't find affordable housing in the ward. The 2040 city plan is a great plan, but unfortunately with our existing zoning, it's an impossible plan. And I think this grant could help us at the very least identify changes that we need to make to our UDC, to our Unified Development Code, to find a way to realize the  Now, this is just a non-binding resolution, and there's nothing that says the city staff must do this even if you pass it.",affordable housing
09_19_2023_fayetteville_meeting_minutes.mp3.32489094-0a98-4497-a4cb-48d85999110b.Transcript.txt,09_19_2023,"I support... For the high pro housing grant, I have lived in other rapidly growing cities where new and affordable housing product projects have not kept up with demand and the results are always the same. Teachers, nurses, physical therapists, artists, and other vital members of the community are pushed out and unable to afford to live there.",affordable housing
09_19_2023_fayetteville_meeting_minutes.mp3.32489094-0a98-4497-a4cb-48d85999110b.Transcript.txt,09_19_2023,"This really starts to feel like bureaucratic doublespeak, and that's a major disappointment. Mayor, you have said numerous times that we have a housing crisis, and now it's up to you to lead us through it. You don't just have a staff.",housing crisis
09_19_2023_fayetteville_meeting_minutes.mp3.32489094-0a98-4497-a4cb-48d85999110b.Transcript.txt,09_19_2023,"They're just going to say no. So, you know, I implore that you please do something to fix this housing crisis. Because if, you know, look at how many people have stood up today who are young people and can't afford housing.",housing crisis
09_19_2023_fayetteville_meeting_minutes.mp3.32489094-0a98-4497-a4cb-48d85999110b.Transcript.txt,09_19_2023,"Back in 2020, in January of 2020, I used to be on the Housing Authority Board before I was Justice of the Peace. And when the city was deciding where to put the parking deck,  I know the Housing Authority was pushing to include some sort of affordable housing component in the arts quorum. And in January 2020, we gathered together in one meeting, representatives from the City of Fayetteville, the University of Arkansas, the Housing Authority, and the Walton Arts Center.",affordable housing
09_19_2023_fayetteville_meeting_minutes.mp3.32489094-0a98-4497-a4cb-48d85999110b.Transcript.txt,09_19_2023,"And at that meeting, I went around to each organization and I asked,  Will you please make a serious commitment on partnering to create affordable housing? And every organization said yes, the city, the university, everyone around that table. I looked up the Democrat Gazette article about it to jog my memory.",affordable housing
09_19_2023_fayetteville_meeting_minutes.mp3.32489094-0a98-4497-a4cb-48d85999110b.Transcript.txt,09_19_2023,"While we're on that tour, I asked our county road crews  Is there some part of the county where you're doing more work than others? And they said, oh, yeah, out on the west side, just beyond the Fayetteville city limits out there, they can't get the roads paved fast enough because there's so much sprawl happening out there. Because the folks, developers can't build affordable housing in Fayetteville because of COVID.",affordable housing
09_19_2023_fayetteville_meeting_minutes.mp3.32489094-0a98-4497-a4cb-48d85999110b.Transcript.txt,09_19_2023,"Everybody that spoke tonight spoke in favor of this resolution, and it's because we are experiencing a crisis. As you all probably know, last Thursday, I held a town hall meeting to discuss this very same topic, affordable housing. And I heard horror stories, stories very similar to the ones tonight and different.",affordable housing
09_19_2023_fayetteville_meeting_minutes.mp3.32489094-0a98-4497-a4cb-48d85999110b.Transcript.txt,09_19_2023,"As representative of Ward 1, I have to do everything that I can to promote affordable housing. Every opportunity. We talked earlier about, and I do, again, I appreciate you so much bringing this forth, and the fact that citizens of Fayetteville are willing to volunteer or to help in some capacity to make sure that this grant is reality.",affordable housing
09_19_2023_fayetteville_meeting_minutes.mp3.32489094-0a98-4497-a4cb-48d85999110b.Transcript.txt,09_19_2023,"This is not the first time and it won't be the last time. And this hard thing is, if we're going to do something hard, it has to be in the best interest of Fayetteville. We know that we are experiencing a housing crisis.",housing crisis
09_19_2023_fayetteville_meeting_minutes.mp3.32489094-0a98-4497-a4cb-48d85999110b.Transcript.txt,09_19_2023,"It's not going to be affordable housing. Fayetteville land costs are a third of single-family homes today, not 20%. So we're talking about the need to build multifamily housing.",affordable housing
09_19_2023_fayetteville_meeting_minutes.mp3.32489094-0a98-4497-a4cb-48d85999110b.Transcript.txt,09_19_2023,"so I guess I fall on the side of Absolutely believe we have a housing crisis in Fayetteville Absolutely 100% believe that Will this fix that problem? No, I don't think so  If I'm brought something that I realistically think can utilize staff time",housing crisis
09_19_2023_fayetteville_meeting_minutes.mp3.32489094-0a98-4497-a4cb-48d85999110b.Transcript.txt,09_19_2023,"It's not available. I certainly would want to take a really hard look at whatever was drafted and review it and ensure that it does meet the goals and the needs of our population here. And I know, I do think we have a housing crisis, and I do believe that everybody that spoke tonight and on Zoom is well-intentioned, absolutely.",housing crisis
10_04_2016_fayetteville_meeting_minutes.mp3.1265227b-4740-4aeb-a79a-9409f560c85d.Transcript.txt,10_04_2016,"The city tonight will begin consideration of formalizing a commitment to providing funds to offset infrastructure costs for Willow Bend, an affordable single-family housing project conceptualized years ago in the Walker Park neighborhood. Other tools we have at our disposal include waiving impact fees for non-profit single- and multifamily affordable housing, providing zoning districts that allow for a variety and mixture of housing types and sizes dispersed throughout the city,  We are able to waive fees and provide grant funds for rehabilitation of existing historic homes or those who qualify for economic assistance. And we also ensure that when homes are built, they're the most energy efficient possible, reducing the monthly utility bills and thereby reducing the overall cost of living for our residents.",affordable housing
10_04_2016_fayetteville_meeting_minutes.mp3.1265227b-4740-4aeb-a79a-9409f560c85d.Transcript.txt,10_04_2016,"During the interview process, the selection committee found a very high energy, committed, and professional local team that will lead Fayetteville First's entrepreneurial target sector. Specific tasks outlined in the contract, which is attached to your packet, include supporting collaborative, entrepreneurial, and innovative environment, increasing high-tech job growth through university and Arkansas research and technology partnerships,  creating and maintaining innovative spaces and programs to support entrepreneurs providing an online directory of the startup community to support and encourage mentoring opportunities technology support networks entrepreneurial initiatives and events and education exploring affordable housing options for entrepreneurs inventory and expand educational opportunities support the growing artisan food and craft beverage industry and support supporting talent attraction retention and development  So to support the growth of small businesses here in Fayetteville.",affordable housing
10_04_2016_fayetteville_meeting_minutes.mp3.1265227b-4740-4aeb-a79a-9409f560c85d.Transcript.txt,10_04_2016,"but they're also supposed to be, quote, exploring affordable housing options for entrepreneurs, unquote. So what is this? Is it low income or high income that they're dealing with?",affordable housing
10_04_2016_fayetteville_meeting_minutes.mp3.1265227b-4740-4aeb-a79a-9409f560c85d.Transcript.txt,10_04_2016,"I was on the original... Group of partners for better housing when we were looking at options for affordable housing because it was one of the goals Set forth by the city and a city plan we were fortunate to get property  that was not utilized in the south part of town, property that needed attention for infrastructure, property that was otherwise not being utilized. This program is going to allow us to expand economic opportunities for individuals that can live and work in our city and become productive in the long run.",affordable housing
10_04_2016_fayetteville_meeting_minutes.mp3.1265227b-4740-4aeb-a79a-9409f560c85d.Transcript.txt,10_04_2016,"i you know um  Our kids best advice is that it probably is You know if the city is going to get sued for something, you know, I think that Trying to find innovative ways to serve our citizens with affordable housing It's not such a bad thing to have to defend and and I'm willing to stand by that So with that I'm gonna make a motion to suspend the rules and go to the third and final reading more. I'll second that",affordable housing
10_01_2024_fayetteville_meeting_minutes.mp3.4e9684ee-7f64-4e8e-bd54-157e3ae78552.Transcript.txt,10_01_2024,"And so, you know, I think that our community has waited a long time. We've had a year between talking about the crunch of what the housing crisis looks like and what that housing stock looks like. And I don't think we should delay any further.",housing crisis
09_05_2023_fayetteville_meeting_minutes.mp3.77dcbdc2-c7ff-46ad-b8c3-c54e05c872bc.Transcript.txt,09_05_2023,"and i think she's ready to discuss it okay do i need to make a motion to suspend the rules or would you like to first actually mayor i think it's there in front of you why don't you read the title of the resolution if you're okay hang on  A resolution to address the urgency, with urgency, the affordable housing crisis to request that Mayor Jordan apply for a housing and urban development pro-housing grant of up to $4 million to fund housing, supportive changes to federal's land use and zoning ordinances.",housing crisis; affordable housing
09_05_2023_fayetteville_meeting_minutes.mp3.77dcbdc2-c7ff-46ad-b8c3-c54e05c872bc.Transcript.txt,09_05_2023,OUR $70 MILLION PROJECT IS PROJECTED TO HAVE A SUBSTANTIAL POSITIVE IMPACT ON THE CITY'S TAX SPACE. I ALSO HEARD A COMMENT EARLIER THAT REFERRED TO THE CITY'S HOUSING CRISIS. THIS PROJECT RECOGNIZES THE NEED FOR ADDITIONAL QUALITY HOUSING IN THE CITY OF FAYETTEVILLE AND IT WILL MEET THAT NEED.,housing crisis
09_05_2023_fayetteville_meeting_minutes.mp3.77dcbdc2-c7ff-46ad-b8c3-c54e05c872bc.Transcript.txt,09_05_2023,"And I guess we had a retreat in June where I felt like we all held hands to and said quality of life,  and we said we need to solve this housing crisis that we're in. You know, I tried to bring forward, I mean I'm very concerned about our budget for 24 and looking for creative solutions and I think that grant could have been part of that solution because I think we're gonna have some hard discussions But every reason where we have this conversation, where we're not able to potentially put housing on the market for people that need it today.",housing crisis
09_05_2023_fayetteville_meeting_minutes.mp3.77dcbdc2-c7ff-46ad-b8c3-c54e05c872bc.Transcript.txt,09_05_2023,so this is cumulative and so any impervious pavement and lack of low impact development will have a significant effect on on that preserve and  and also downstream on Clapper Creek. So we need to keep that in mind. The other thing I want to mention is that at no time did I hear affordable housing mentioned in the development proposal.,affordable housing
09_05_2023_fayetteville_meeting_minutes.mp3.77dcbdc2-c7ff-46ad-b8c3-c54e05c872bc.Transcript.txt,09_05_2023,"And while of course new housing is hard to make affordable just because of construction costs, that's affordable in the technical 30% of your income term. you only build ten houses out there like Councilmember Bunch outlined those ten houses will have to be massive large luxury properties to command the price that would would make the cash flow for the infrastructure investments and  While we might not get affordable housing with a capital A, we can certainly get more affordable than that and we can provide housing to people who need it. This is about half, almost exactly a half mile from a designated tier two growth center as outlined in the 2040 plan that y'all have approved unanimously and reaffirmed unanimously.",affordable housing
12_06_2022_fayetteville_meeting_minutes.mp3.6fbf5a34-1c69-48f5-b964-8145233e3366.Transcript.txt,12_06_2022,IT DOESN'T BRING AFFORDABLE HOUSING. IT BRINGS HOUSING THAT COULD BE AFFORDABLE IF EVERYONE WAS RICH THAT BOUGHT THE HOUSES.,affordable housing
12_06_2022_fayetteville_meeting_minutes.mp3.6fbf5a34-1c69-48f5-b964-8145233e3366.Transcript.txt,12_06_2022,"The ones that are already there will be old construction. New things tend to be more expensive, especially with inflation. But we will not get more affordable housing by building fewer houses.",affordable housing
12_06_2022_fayetteville_meeting_minutes.mp3.6fbf5a34-1c69-48f5-b964-8145233e3366.Transcript.txt,12_06_2022,"And you can definitely see it, you know, two, three years ago, drive through these neighborhoods and it was just dumpster, dumpster, dumpster, dumpster. And those were all affordable housings that are going away. And so by providing the houses that people that can buy a $400,000, $500,000 house, if they buy a new one, then they're not basically...  encouraging a flipper to tear apart what is affordable housing.",affordable housing
12_06_2022_fayetteville_meeting_minutes.mp3.6fbf5a34-1c69-48f5-b964-8145233e3366.Transcript.txt,12_06_2022,"I have been working for code compliance for almost six years, and it has been vacant for at least that amount of time. Thanks. Have we had anyone from the homeless community living in the house?",homeless
12_19_2017_fayetteville_meeting_minutes.mp3.017d4396-8cd2-4c0d-b9a6-38e855f6f53b.Transcript.txt,12_19_2017,"That house around that area is full with homeless people, just ethically. That house was totally livable. We've got hundreds, if not thousands, of homeless people around here.",homeless
12_19_2017_fayetteville_meeting_minutes.mp3.017d4396-8cd2-4c0d-b9a6-38e855f6f53b.Transcript.txt,12_19_2017,"And my dad has helped many of these people. And even some of the houses they're living in now, some of these people would be homeless if it wasn't for him helping them out. So ethically, it was unright for you guys to come in and tear that house down.",homeless
12_19_2017_fayetteville_meeting_minutes.mp3.017d4396-8cd2-4c0d-b9a6-38e855f6f53b.Transcript.txt,12_19_2017,"No. To a homeless person living under a bridge, that house was a step up, maybe two or three steps up. Okay?",homeless
12_19_2017_fayetteville_meeting_minutes.mp3.017d4396-8cd2-4c0d-b9a6-38e855f6f53b.Transcript.txt,12_19_2017,"So I think it's... a little bit arrogant of us to say that this house is deplorable and we you know it's below the standard we think is acceptable but to some people who are living under bridges and are homeless this house was two or three steps up there was a roof over their head and you and I wouldn't live there but some people would and I think that's what he's getting at so I would in the future I would hope that we would see that perspective also before we raise a house Sure, it doesn't meet our standards.",homeless
12_19_2017_fayetteville_meeting_minutes.mp3.017d4396-8cd2-4c0d-b9a6-38e855f6f53b.Transcript.txt,12_19_2017,"yes yes okay number two there aren't suede requirements or formal competitive bidding and approved contract seven hills homeless center in the amount of a hundred and three thousand dollars services to homeless and needy residents in federal in 2018 kit Whereas the board of directors of Seven Hills has operated a daytime facility to serve numerous homeless and needy Fayetteville residents for over 15 years, relying upon the support of several local churches, charities, and charitable persons, as well as some governmental support for veterans, et cetera.",homeless
12_19_2017_fayetteville_meeting_minutes.mp3.017d4396-8cd2-4c0d-b9a6-38e855f6f53b.Transcript.txt,12_19_2017,"And whereas the Seven Hills is currently suffering an operating income emergency and is in dire need of temporary assistance from the city of Fayetteville to be able to weather the and continue to offer vital services to Fables homeless residents during winter. And whereas if Seven Hills could no longer operate as Walker family residential community transitional housing, currently housed citizens might become homeless again and have to live on the streets or in woods during these harsh winter months. and whereas if seven hills could no longer operate as daytime facility large number of homeless residents who depend upon this facility for showers and washing hot food a warm place to stay during the day as well as access to a telephone and other job assistance services could not find such comparable services elsewhere and whereas the facility and services provided by seven hills needed need to be continued and should be temporarily supported by city taxpayers prevent our homeless and needy residents from suffering undue hardship and deprivation now therefore be it ordained by the city council the city of favela arkansas section one that the city council city of fayetteville arkansas hereby determines an exceptional situation exists in which competitive bidding is deemed not feasible or practical and therefore weighs requirements of formal competitive bidding and approves a contract between the city of fayetteville arkansas and seven hills homeless center in the amount of one hundred and three thousand dollars for services to homeless and ed fable residents and authorizes mayor jordan to sign this contract CHRIS JERRAM, Good evening, Mayor and Council.",homeless
12_19_2017_fayetteville_meeting_minutes.mp3.017d4396-8cd2-4c0d-b9a6-38e855f6f53b.Transcript.txt,12_19_2017,"And ordinance to waive the requirements of formal competitive bidding and approve a contract with Seven Hills Homeless Center in the amount of $103,000 for services to homeless and needy residents in Fayetteville in 2018. Adele. I move we suspend the rules and go to the third and final reading.",homeless
12_19_2017_fayetteville_meeting_minutes.mp3.017d4396-8cd2-4c0d-b9a6-38e855f6f53b.Transcript.txt,12_19_2017,probably every year I'm in total support of us helping seven hills homeless shelter but I think I always like to say on the record this is not just a Fayetteville homeless shelter and when we talk to people there or we talk to people on the staff there are people there from all over the region that need help and I'm glad it's there,homeless
12_19_2017_fayetteville_meeting_minutes.mp3.017d4396-8cd2-4c0d-b9a6-38e855f6f53b.Transcript.txt,12_19_2017,and i know it's hard to prove or for another city to take any responsibility that that they should help but you know i do think other cities should consider helping the homeless shelter here not just fayetteville although i'm in favor of us doing it but i do think that we have a situation there where a lot of communities have folks that are that are using that shelter not just fayetteville person who guards the the taxpayers of Fayetteville's dollars and cents I always like to say that every year just I'd love to see a more regional approach to homelessness and in this city and all cities.,homeless; homelessness
12_19_2017_fayetteville_meeting_minutes.mp3.017d4396-8cd2-4c0d-b9a6-38e855f6f53b.Transcript.txt,12_19_2017,"I would like to say we ran the numbers the other day on we took over a grant from Seven Hills one time if you remember that And the amounts of money is around $350,000 or so. I think that's a pretty close estimate of what we are spending on the homeless situation in this city, either directly or indirectly.",homeless
12_19_2017_fayetteville_meeting_minutes.mp3.017d4396-8cd2-4c0d-b9a6-38e855f6f53b.Transcript.txt,12_19_2017,helping people because I know in the studies that I've done on homelessness many most Americans in this country is about one paycheck away from being homeless and so that could be anybody at any time and I think for us to step up and help people is vitally important to this city and what this city stands for and I think that's all I have to say.,homeless; homelessness
07_16_2019_fayetteville_meeting_minutes.mp3.8ee2680b-8fd2-4269-9b43-fcb9ff3bd7b8.Transcript.txt,07_16_2019,"Going slow, getting a lot of input from different different different communities is is is really good and well thought out. Sorry if you mentioned this, but I definitely want in this study a look at the relationship between I guess the type two and homelessness in communities. I do know that some people find it financially beneficial to kick out their long term tenants so that they can rent it out at football games and bikes, booze and barbecue.",homelessness
07_16_2019_fayetteville_meeting_minutes.mp3.8ee2680b-8fd2-4269-9b43-fcb9ff3bd7b8.Transcript.txt,07_16_2019,"As a city, we're having issues with homelessness. So if we don't look at this and also look at that issue at the same time, I feel like we're missing something. So thank you.",homelessness
07_16_2019_fayetteville_meeting_minutes.mp3.8ee2680b-8fd2-4269-9b43-fcb9ff3bd7b8.Transcript.txt,07_16_2019,"Hello, my name is Angela Delford. I'm the executive director for the Fayetteville Housing Authority, also a resident just outside the city limits of Fayetteville. Thanks so much for considering this ordinance and beginning this research project, because anecdotally, we may not have done the studies, but anecdotally, I can tell you this has a huge impact on people experiencing homelessness.",homelessness
07_16_2019_fayetteville_meeting_minutes.mp3.8ee2680b-8fd2-4269-9b43-fcb9ff3bd7b8.Transcript.txt,07_16_2019,"But on this situation, we might consider it as a fee versus a tax. I don't know how that works, but perhaps maybe there's more latitude for the council to make a decision about  I also would like to talk about, I don't think it's too early to say let's talk about how that money will be used. The city spends a large amount of money on homelessness, and we greatly appreciate that.",homelessness
07_16_2019_fayetteville_meeting_minutes.mp3.8ee2680b-8fd2-4269-9b43-fcb9ff3bd7b8.Transcript.txt,07_16_2019,"And we couldn't be making the progress that we are toward ending homelessness without that. And there are some situations where we have the opportunity to apply for grants and there's not match money for that. So, for instance, right now, the continuum of care, there's a two hundred forty three thousand dollar grant that we can apply for and we'll need a twenty five percent match.  which means that one of our organizations is going to have to fundraise private donors or somewhere to be able to find the match money.",homelessness
07_16_2019_fayetteville_meeting_minutes.mp3.8ee2680b-8fd2-4269-9b43-fcb9ff3bd7b8.Transcript.txt,07_16_2019,"My also perspective is that if a private citizen is going to earn money, I think that's beautiful and amazing, and I'm an entrepreneur at heart. And if them earning money is going to result in the government having to solve some problems, then I think they need to contribute a portion of that revenue that they're generating and the profit that they're generating to be able to assist the government in solving the problem that they're helping to create. So I am very happy and would love to be part of the stakeholder group and would be happy to help in any way that we can and offer our resources to be able to help convene people, get the word out, and of course connect you with homeless service providers and other housing authorities, whatever we can do.",homeless
07_16_2019_fayetteville_meeting_minutes.mp3.8ee2680b-8fd2-4269-9b43-fcb9ff3bd7b8.Transcript.txt,07_16_2019,"So whether it is just policy goals or an ordinance, there's a couple of things I want to make sure that we consider during the study that just don't get overlooked. Sloan mentioned how short-term rentals can be part of the homelessness problem. But I want to make sure we also talk about how they can be part of the solution.",homelessness
11_05_2020_fayetteville_meeting_minutes.mp3.980303bf-2a46-4af5-9c47-58c1a5bcdf1f.Transcript.txt,11_05_2020,"And that's going to go into our pond. And there are only limited options available to truly, that truly  slow the runoff a little bit, it's going to be there. I've heard people mention that, hey, we need more affordable housing in Fayetteville, and we do.",affordable housing
