filename,date,paragraph,matched_words
06_20_2023_fayetteville_meeting_minutes.mp3.087c0fee-041a-4bec-a696-2f9eef849cfa.Transcript.txt,06_20_2023,"What compels me to come speak tonight is the deteriorating state of affordable housing in the city of Fayetteville. I support this amendment because the shrinking availability of properties that accept vouchers is alarming as someone who works with low to middle income tenants, but devastating for the individuals and families that often wait years for assistance only to wind up empty-handed. With such a situation facing our community, any step taken to address it is a step in the right direction.",affordable housing
06_20_2023_fayetteville_meeting_minutes.mp3.087c0fee-041a-4bec-a696-2f9eef849cfa.Transcript.txt,06_20_2023,"While the actions of local governments are often limited in their scope, their impacts are felt across the community. Lack of affordable housing is being felt across our city, but it is low and middle income people, many of them persons of color, who bear the brunt of this burden. I encourage this body to take yet another step to resolving our housing crisis, and I thank you for your time.",housing crisis; affordable housing
06_20_2023_fayetteville_meeting_minutes.mp3.087c0fee-041a-4bec-a696-2f9eef849cfa.Transcript.txt,06_20_2023,"We all recognize the reality that affordable housing is crucial. And my work as a community organizer for Arkansas Community Organizations, Arkansas Owners United, across the state,  The number one issue that I'm hearing from voucher recipients is inability to access a place where they can actually use the voucher. I recognize that none of us want this housing crisis.",housing crisis; affordable housing
06_20_2023_fayetteville_meeting_minutes.mp3.087c0fee-041a-4bec-a696-2f9eef849cfa.Transcript.txt,06_20_2023,"I do want the public to know that we are really concerned about affordable housing. We spent a good five or six hours discussing affordable housing this weekend, and  However, tonight I'm going to reluctantly support this. I think that the implementation piece is not well-defined because you're going to have to have all these landlords go in and actually identify whether they're going to take Section 8 or other kinds of vouchers.",affordable housing
06_20_2023_fayetteville_meeting_minutes.mp3.087c0fee-041a-4bec-a696-2f9eef849cfa.Transcript.txt,06_20_2023,Let's talk about affordable housing. We've heard a lot about that today. I think you guys probably talked about it quite a bit at your retreat.,affordable housing
06_20_2023_fayetteville_meeting_minutes.mp3.087c0fee-041a-4bec-a696-2f9eef849cfa.Transcript.txt,06_20_2023,"This will help support commercial space and affordable housing in the area. Also, it will support the golf course, which is a great amenity to the City of Fayetteville. When the area is connected to the bike path via the White River Bridge, there will be tremendous opportunities for recreation for residents.",affordable housing
06_20_2023_fayetteville_meeting_minutes.mp3.087c0fee-041a-4bec-a696-2f9eef849cfa.Transcript.txt,06_20_2023,"And giving people the opportunity to live out there  be able to use one of the only public golf courses in Northwest Arkansas and not have to pay membership fees and exclusivity and not be able to afford it. By giving these 100 homes, which we've done very successfully in Fayetteville since 1989, I'm old as a rock, but it's been a long time. We've provided affordable housing for Fayetteville.  All along the way, I think most of you are very familiar with what we do on the affordable housing.",affordable housing
06_20_2023_fayetteville_meeting_minutes.mp3.087c0fee-041a-4bec-a696-2f9eef849cfa.Transcript.txt,06_20_2023,"I don't know of another golf course community that you will find an affordable housing subdivision that's offering homes from 13, 14, 1500 square feet. So it embraces almost everything that we've heard tonight. We're bringing some attainable housing.",affordable housing
06_20_2023_fayetteville_meeting_minutes.mp3.087c0fee-041a-4bec-a696-2f9eef849cfa.Transcript.txt,06_20_2023,"So what density does, by decreasing the density with that bill of assurance, you're making the houses more expensive. If you have asked about affordable housing in this plan, think about what that's going to do to the affordable housing aspect of it. you take the same amount of land, you divide it by fewer buyers, each one's going to pay a bigger chunk of the price.",affordable housing
02_04_2020_fayetteville_meeting_minutes.mp3.3a2cb375-21ad-49e1-b589-3e836647a0fd.Transcript.txt,02_04_2020,"We put more two to four hundred thousand dollar houses what happens is people don't buy houses that are 150,000 in that neighborhood put in 50 and then sell it for 300 the affordable housing Happens because we're not gutting now houses in the neighborhood already there. So if we're talking about affordable housing, um  I think this helps even if these specifically aren't affordable go through some of these neighborhoods You see so many dumpsters and so many yards because that's what's happening as they're gutting what used to be affordable houses So hopefully this helps prevent that All right, this is no other final comments care would you please cover up  Petty?",affordable housing
06_04_2020_fayetteville_meeting_minutes.mp3.12284b55-a031-4621-b497-302e2b12ff32.Transcript.txt,06_04_2020,"a resolution authorized the purchase of a kubota mower from springdale tractor any amount of 13 329.22 pursuant to a source well co-opted purchasing contract for use by the airport and to approve budget adjustment number seven a resolution to approve the renewal of three special needs assistance program grant agreements with u.s department of housing and urban development  in the total amount of 238 765 dollars for the city to administer programs to assist homeless federal residents number eight  a resolution to award bid number 20-38 and to authorize a five-year hay field lease with proud farms for for about 54.5 acres at lake federal madison natural area barry park rodney ryan park and combs park for the amount of 150 dollars per year and to authorize mowing at other park properties as needed for the amount of two dollars  for bail number nine a resolution to approve task order number three with the watershed conservation resource center in the amount of 269 500 for a stream restoration project on tanglewood branch in the cultural arts corridor and to approve a project contingency in the amount of twenty six thousand nine hundred and fifty dollars this is a 2019 drainage bond project  Number 10, a resolution to approve a professional engineering services agreement with Garver LLC in the amount of not to exceed $311,600 pursuant to an RFQ number 20-01, section 12, selection 12, for design and bidding phase services for a booster pumping station at the Kessler Mountain ground storage tank site. and number 11 a resolution to approve a professional engineering services agreement with black and beach corporation in the amount of not to exceed 107 592 dollars for analysis and design of a audible water pressure management solutions for the greater clabber creek area i'm entertaining most except agenda as red so moved second  We have a motion and a second to accept the consent agenda as read. Caravans, please call the roll.",homeless
06_04_2020_fayetteville_meeting_minutes.mp3.12284b55-a031-4621-b497-302e2b12ff32.Transcript.txt,06_04_2020,"I think I'm glad that we're  pulling the trails off because those are used by different folks for not only leisure needs but also for transportation needs and many of our homeless population use those so I appreciate not making ordinances as well that may be target someone or very small instances particularly or I agree with many of the commenters we do have laws on the books that exist today for things that are stalking loitering criminal mischief  that our law enforcement can use to keep our citizens safe. I very much applaud the conversation in regard to etiquette, and And I think this can be not only trail etiquette, but any etiquette around the city.",homeless
03_01_2022_fayetteville_meeting_minutes.mp3.807067b3-c123-46e9-a3c0-88f3b25183e2.Transcript.txt,03_01_2022,"support groups who have  experiencing issues before COVID and now these communities are really being impacted. African Americans, Hispanic, New Beginning, homelessness. And so that's what we're looking at.",homelessness
03_01_2022_fayetteville_meeting_minutes.mp3.807067b3-c123-46e9-a3c0-88f3b25183e2.Transcript.txt,03_01_2022,"We would like to be able to  Jessica Crouch NE ReMEDIES CREATIONS  It could be for food. It could be for clothing needs, things that they're needing. We're also working on a shower trailer for our unhoused neighbors.",unhoused
03_01_2022_fayetteville_meeting_minutes.mp3.807067b3-c123-46e9-a3c0-88f3b25183e2.Transcript.txt,03_01_2022,"For two years, we have impacted 15,000 people in...  WASHINGTON COUNTY AND BENTON COUNTY PROVIDING EXPRESSIVE ART CLASSES, EXERCISE CLASSES FOR CHILDREN IN PERSON AND VIRTUALLY, CAREER READINESS TRAINING WORKSHOPS,  for kids that are homeless, teens that are on probation, within the juvenile detention centers, and feeding. We have hosted back to school events, Christmas holiday giveaways for families that are in dire need in Washington County. Our impact report is very impressive and it shows that we are determined and dedicated to improve the quality of life for all individuals, especially children here in Northwest Arkansas.",homeless
02_20_2018_fayetteville_meeting_minutes.mp3.38aa16de-fc39-46d3-9d0f-1fa5e9f46e0b.Transcript.txt,02_20_2018,"One of the things that Fayetteville, as well as all the towns in northwest Arkansas, one of the biggest requests there is right now is for affordable housing. With the 2030 plan with the two-acre lots, that's just not a possibility. It's just not a feasible thing.",affordable housing
02_20_2018_fayetteville_meeting_minutes.mp3.38aa16de-fc39-46d3-9d0f-1fa5e9f46e0b.Transcript.txt,02_20_2018,"Thank you. I agree with staff and planning commission's assessment of this property that RMF, or the four units per acre, is not an appropriate land use. Based on our 2030 plan, you know, we're supposed to be discouraging suburban sprawl, and I would say that this  parcel probably has a walk score of zero and that you can't walk anywhere it's well outside our box around the city its adjacency to the floodplain means that developing this land could exacerbate flooding issues downstream and as far as affordable housing affordable housing there's a caveat of that the the cost of transportation um",affordable housing
02_20_2018_fayetteville_meeting_minutes.mp3.38aa16de-fc39-46d3-9d0f-1fa5e9f46e0b.Transcript.txt,02_20_2018,"We need to have variety in the marketplace, and if that goes against the 2030 plan to let this happen, to allow people to have a place to live on the edge of town, then we  who prefer to live on the edge of town, why should we try to fit a square peg in a round hole? Why don't we let the market offer variety? I don't view it as a great immoral breach by letting this landowner develop his land with affordable housing in an area of town that is growing.",affordable housing
02_20_2018_fayetteville_meeting_minutes.mp3.38aa16de-fc39-46d3-9d0f-1fa5e9f46e0b.Transcript.txt,02_20_2018,"But on the other hand, I also see the challenges that people face trying to find affordable housing in Fayetteville and I can tell you that affordable housing for most people is  for a lot of people is not in central Fayetteville. I mean, that's where I live, and I'm lucky to live there, but for a lot of the people that I work with as a real estate agent, it's just not an option. And so they are looking outside the city limits of Fayetteville.",affordable housing
02_20_2018_fayetteville_meeting_minutes.mp3.38aa16de-fc39-46d3-9d0f-1fa5e9f46e0b.Transcript.txt,02_20_2018,"You know, I don't necessarily...  like this exactly but I'm not exactly against it either because I understand the Need for affordable housing and that just that just does not end up all the time in the middle of Fayetteville Sorry, thank you. Okay, mark This is very tough for me to say too because I'm going to go right along with the arguments that we just heard from this bunch as a banker  Every day I'm faced with trying to find affordable housing with an affordable mortgage plan for families of modest means.",affordable housing
02_20_2018_fayetteville_meeting_minutes.mp3.38aa16de-fc39-46d3-9d0f-1fa5e9f46e0b.Transcript.txt,02_20_2018,"This is in a rural development area, and so there are programs that would allow a family to get into this with a rural development loan. These loans are specifically for this type of development. I have compassion for these individuals that have looked and looked and looked and looked for affordable housing in Fayetteville, and they can't find it.",affordable housing
02_20_2018_fayetteville_meeting_minutes.mp3.38aa16de-fc39-46d3-9d0f-1fa5e9f46e0b.Transcript.txt,02_20_2018,and so i had to balance a lot of that affordability and opportunity for some people that i know personally on a daily basis that are struggling to find a place to live this is not ideal there's a lot of things about this that is not ideal but i'm going to support the development of this property  because I do see it as an opportunity for affordable housing for people that otherwise won't have it. It's not so far away from services that I think it's going to make transportation a large issue.,affordable housing
02_20_2018_fayetteville_meeting_minutes.mp3.38aa16de-fc39-46d3-9d0f-1fa5e9f46e0b.Transcript.txt,02_20_2018,"okay i guess we've had the conversation about affordable housing enough now that i've got a question for mr walker um  Knowing how far out Weddington this is in transportation costs, can you put a number on what you consider affordable housing on this area? Affordable housing for any of this area I would think would probably be around the 200 grains, 175 to maybe two range, something in that area right there. That's one thing that's always driven the affordable housing market to the west side of Fayetteville because of the terrain out there allows you to get some pretty good yield on your lots.",affordable housing
02_20_2018_fayetteville_meeting_minutes.mp3.38aa16de-fc39-46d3-9d0f-1fa5e9f46e0b.Transcript.txt,02_20_2018,And I'm glad you do. And I look forward to being able to add something to the study of Fayetteville and give us some more affordable housing out there. Thank you.,affordable housing
02_20_2018_fayetteville_meeting_minutes.mp3.38aa16de-fc39-46d3-9d0f-1fa5e9f46e0b.Transcript.txt,02_20_2018,"council member petty just hit on some of the points that i was going to talk about that you know rsf4 development does not pay for the cost of infrastructure to maintain it but also you know we talk about affordable housing and a key part of this discussion is  It's about right size housing and we have an abundance of the single family, three bedroom, two bath homes but the dynamics of the demographics of our households are changing. We're already over 75% child free households and that number is going to rise.  because of empty nesters, because of people delaying housings. We're having non-custodial households and families of divorce.",affordable housing
02_20_2018_fayetteville_meeting_minutes.mp3.38aa16de-fc39-46d3-9d0f-1fa5e9f46e0b.Transcript.txt,02_20_2018,"And we're also fortunate to bring in eight industry experts, people with expertise in public-private partnerships with health institutions to anchor development, expertise in jurisdictional transfers working with state departments of transportation, and expertise in public health  commercial development and affordable housing and they are tasked with interviewing more than 48 people on Thursday from the community across all sectors and Developing summary recommendations for presentation on Friday those presentations will be at the town center starting at 1015 and go until 12 I think we start at 1030. I hope you can be there Tonight for first miss mayor. I have a question for Don first time for me to ask a question on I  Can you explain to the people what items are available to be disposed of on our cleanup days?",affordable housing
05_03_2016_fayetteville_meeting_minutes.mp3.5b85005b-f2a7-400f-bd57-7dfa770f0fa5.Transcript.txt,05_03_2016,"So we feel like we're still in line with where we're trying to go as a with our city and traditional development patterns. One of the advantages, one of the reasons we created the RSF 18  zoning district was to allow for some smaller single-family infill lots to be Built out and also allow for some potential for more affordable housing. However, as you guys see when sometimes you'll have To get those smaller single-family lots in the past We would have to rezone it to a multi-family zoning and that had a difficult time going through the political process",affordable housing
05_03_2022_fayetteville_meeting_minutes.mp3.6cb2c442-b8da-4ace-b8d7-98e7815734bb.Transcript.txt,05_03_2022,"If the drive-in must go away, how can we ensure that its lands utilization will go towards affordable housing, affordable entertainment options, and the general betterment of the city? And how can the city government ensure the survival of our independent art and cultural spaces? The pandemic took a grave toll on these spaces locally and nationwide.",affordable housing
05_03_2022_fayetteville_meeting_minutes.mp3.6cb2c442-b8da-4ace-b8d7-98e7815734bb.Transcript.txt,05_03_2022,"They didn't buy the land intending to only have affordable housing on it. They didn't buy it or they're not selling it, you know, just to have affordable entertainment or affordable housing. They're selling it because they no longer want to run the drive-in or they're ready to retire or whatever.",affordable housing
03_06_2018_fayetteville_meeting_minutes.mp3.8b54ce55-f0d4-45de-a2a0-4e576fc8ce5b.Transcript.txt,03_06_2018,"Our concern on this is safety. We're just as concerned about the safety of a panhandler in the middle of the road as we are a pedestrian. And when you have people... texting and the number of, we've written over 146 tickets of people texting and driving when you have the distracted individual and you have people standing longer periods of time, not in a pedestrian crossing aspect, it is a real safety issue.",panhandler
03_06_2018_fayetteville_meeting_minutes.mp3.8b54ce55-f0d4-45de-a2a0-4e576fc8ce5b.Transcript.txt,03_06_2018,"Mayor, do you want to add a comment? Because I don't want misinformation getting out. The city contributes over $600,000 to homeless services, over $450,000 for housing with a veterans housing focus.",homeless
03_06_2018_fayetteville_meeting_minutes.mp3.8b54ce55-f0d4-45de-a2a0-4e576fc8ce5b.Transcript.txt,03_06_2018,"And we also have roughly $200,000 for various homeless services, including contributions to Seven Hills Homeless. So when you talk about we need to do something, I do want you to get credit for the money that you have allocated which is over a half a million dollars to this problem i'm not aware of any other city that can make that statement thank you for setting your own chart on that i did not intend to imply that we weren't we're doing anything to tackle the problem just there's a whole lot more problem we've left in front of us okay well let's open it up for some public comment i guess by now everybody knows the rules Good evening, Mayor, Council.",homeless
03_06_2018_fayetteville_meeting_minutes.mp3.8b54ce55-f0d4-45de-a2a0-4e576fc8ce5b.Transcript.txt,03_06_2018,"We are a civil rights organization that helped pass the civil rights ordinance here in the city. We have since become a local political action committee supporting progressive candidates and policies, but at its heart, For Fayetteville is a civil rights organization. Homelessness is the next big civil rights challenge here in this city.",homelessness
03_06_2018_fayetteville_meeting_minutes.mp3.8b54ce55-f0d4-45de-a2a0-4e576fc8ce5b.Transcript.txt,03_06_2018,"We do not have very many homeless beds in Fayetteville. Until we can do this, we believe we're going to be continually chasing our tails and handing people citations they cannot pay. Our homeless neighbors need housing, not handcuffs.",homeless
03_06_2018_fayetteville_meeting_minutes.mp3.8b54ce55-f0d4-45de-a2a0-4e576fc8ce5b.Transcript.txt,03_06_2018,"For every 100 people eligible for low income housing in Arkansas, there are 41 available units and 31 units is the national average. We are in an affordable housing crisis and the future outlook isn't positive as wages stay stagnant and rent increases substantially. Housing is the best intervention coupled with a supportive community.",housing crisis; affordable housing
03_06_2018_fayetteville_meeting_minutes.mp3.8b54ce55-f0d4-45de-a2a0-4e576fc8ce5b.Transcript.txt,03_06_2018,"As a student, I've logged almost 1,000 hours working with low-income individuals and our neighbors who are experiencing homelessness. There's always a concern. First, I'd like to thank the city of Fayetteville for the resources that they do provide for our vulnerable citizens and the police officers themselves.",homelessness
03_06_2018_fayetteville_meeting_minutes.mp3.8b54ce55-f0d4-45de-a2a0-4e576fc8ce5b.Transcript.txt,03_06_2018,"And the last thing I might say is, yeah, I've been in a couple of communities that have have posted signs like text a certain number with a certain phrase to donate a certain amount to your local homeless shelter signs. And I wonder if something like that might help out with this particular issue.",homeless
03_06_2018_fayetteville_meeting_minutes.mp3.8b54ce55-f0d4-45de-a2a0-4e576fc8ce5b.Transcript.txt,03_06_2018,"It's not directed toward panhandlers. And even if being a panhandler, though, doesn't give you the right to break the law, it doesn't give you the right to jaywalk or to create danger for other people. You have a right to ask for money, and you can do that, and we don't say you can't.",panhandler
02_21_2017_fayetteville_meeting_minutes.mp3.94229f14-530c-4291-b4dc-067f457e5075.Transcript.txt,02_21_2017,"We're going to be talking about a regional approach to this. Folks, it's like the homeless situation. That is a regional thing that we need to address.",homeless
04_04_2023_fayetteville_meeting_minutes.mp3.f69dd308-9d70-4ef8-9be3-6d88a93a7e60.Transcript.txt,04_04_2023,This program is a federal block grant program that provides annual funding used exclusively for affordable housing activities to benefit low-income households. Funding for homelessness services is not an eligible activity for this funding. I think that was mentioned at the last meeting I wanted to make sure that you were all aware that that is not an eligible funding activity.,homelessness; affordable housing
04_04_2023_fayetteville_meeting_minutes.mp3.f69dd308-9d70-4ef8-9be3-6d88a93a7e60.Transcript.txt,04_04_2023,"This will help us to get there. This is a first-time participation dollar amount. And then moving forward, we will have our allocation that will come to us every year to use to assist individuals to get into affordable housing.",affordable housing
04_04_2023_fayetteville_meeting_minutes.mp3.f69dd308-9d70-4ef8-9be3-6d88a93a7e60.Transcript.txt,04_04_2023,I assume we'll be completing the application tonight. The home funds do have different uses than some of the programs that we currently offer. i know that the planning process in the next four months before the plan is submitted in august will we'll have a lot of opportunity to discuss that i hope that we will lean more into uses that expand our inventory of affordable housing and not just the the easy way to do it is to to set up rental assistance programs that  just dump our public money into the hands of landlords that already exist and will have somebody no matter what.,affordable housing
06_07_2022_fayetteville_meeting_minutes.mp3.ed187959-a742-42b6-b70a-603eacdfe147.Transcript.txt,06_07_2022,"St. James Squire-Johagan Outreach Center, we have partnered with Theater Squared and our pillars are addressing hunger, homelessness, and poverty. In that collaboration with Theater Squared, we address poverty through exposing them to the arts through the Lights Up program. This exposure would not be available to some of the citizens in South Fayetteville, as well as underrepresented and underserved citizens without Theater Squared offering these lights up tickets.",homelessness
06_07_2022_fayetteville_meeting_minutes.mp3.ed187959-a742-42b6-b70a-603eacdfe147.Transcript.txt,06_07_2022,"And that comment came from the president of Northwest Arkansas Home Builders Association. So I like to think he speaks for a larger group in a lot of ways. And that is consistent feedback we've had from a lot of our applicants is whatever,  Our fees are considered so nominal to many of our applicants that it does not pose any obstruction to their ability to deliver a product, their ability to provide affordable housing.",affordable housing
06_06_2023_fayetteville_meeting_minutes.mp3.65c81954-eda8-4a44-baac-3e2de402405b.Transcript.txt,06_06_2023,"I'm not I understand, you know, I understand our housing crisis and everything. So, again, I don't have a dog in this fight. But again, just on that one point, I think is kind of important.",housing crisis
06_06_2023_fayetteville_meeting_minutes.mp3.65c81954-eda8-4a44-baac-3e2de402405b.Transcript.txt,06_06_2023,"We could take Sharon's map and that blue line and make it a  The black heritage district, and maybe we should look into that, but that's not going to stop people from being displaced. That's not going to solve the problem. We're in the midst of a huge affordable housing crisis here.",housing crisis; affordable housing
