filename,date,paragraph,matched_words
01_17_2017_fayetteville_meeting_minutes.mp3.2708115c-0f5b-4c71-9f92-bd1235046a4a.Transcript.txt,01_17_2017,"To meet this goal, the city will continue to explore affordable housing developments. continue to support public transit, using the mobility plan and participating in a region-wide transit development plan to understand the needs and improvements that can be made to public transit, as well as what funding needs and sources are sustainable. We will continue to install wayfinding signage throughout the city to assist visitors.",affordable housing
01_17_2017_fayetteville_meeting_minutes.mp3.2708115c-0f5b-4c71-9f92-bd1235046a4a.Transcript.txt,01_17_2017,"Through the HEARTH program, our goal is to house 100 homeless individuals as we did last year. Rangers Pantry will continue to assist citizens experiencing financial hardships with pet food. Strategies for affordable housing.",homeless; affordable housing
08_04_2020_fayetteville_meeting_minutes_compressed.mp3.a5143574-13fb-480f-b49b-5835ea8c5a9a.Transcript.txt,08_04_2020,"One is a teardown in a floodplain, and the other two, they're not really great options either. And so...  in thinking about you know why two hundred thousand dollars that's about the cost to just construction costs of a two bedroom one and a half bath home um and to put that into perspective to purchase a two hundred thousand dollar home um a person would need forty thousand dollars down and an income of over fifty eight thousand dollars a year meanwhile that's far above the average household income in the city of Fayetteville So when we talk about having a housing crisis in this city, that's what we're talking about.",housing crisis
08_04_2020_fayetteville_meeting_minutes_compressed.mp3.a5143574-13fb-480f-b49b-5835ea8c5a9a.Transcript.txt,08_04_2020,"The pandemic has opened our eyes very wide to the gaps of care and, you know, the fact that there's food insecurity and housing insecurity. Yeah, we knew that, but like it is eyes wide open right now. I hear Deputy Fields.",housing insecurity
10_02_2018_fayetteville_meeting_minutes_compressed.mp3.0a9e3e44-2456-4ea7-8bea-b8033b7bde75.Transcript.txt,10_02_2018,"And that's something that we have to really take seriously in a legislative manner. So I really feel like this land use plan is adding housing supply to the city's urban core, and that really combats the housing crisis that we're having. So traditional town form is what else we're supposed to do.",housing crisis
10_02_2018_fayetteville_meeting_minutes_compressed.mp3.0a9e3e44-2456-4ea7-8bea-b8033b7bde75.Transcript.txt,10_02_2018,"It's hard to see how commercializing that hill is going to make a difference in improving the green network. Attainable housing is another thing, and I hope that when we talk about attainable housing, we mean housing that is affordable. Our neighborhood is not well known for its affordable housing.",affordable housing
10_02_2018_fayetteville_meeting_minutes_compressed.mp3.0a9e3e44-2456-4ea7-8bea-b8033b7bde75.Transcript.txt,10_02_2018,"Because if it's not, if we don't add the housing units there, they're going to be added elsewhere and eventually, most likely, on the outskirts, which would increase transportation costs, city public infrastructure costs, greenhouse gas emissions from single occupant vehicle transportation. So... affordable housing and environmental concerns are the issues that I care most about and spend a lot of time working on, and that's why I support this rezone request. Thank you.",affordable housing
10_02_2018_fayetteville_meeting_minutes_compressed.mp3.0a9e3e44-2456-4ea7-8bea-b8033b7bde75.Transcript.txt,10_02_2018,"I love what they do in Fayetteville. I'm a big fan of Uptown Project. But when I asked about affordable housing, the truth was that the land is so valuable that it actually doesn't fall within affordable.",affordable housing
10_02_2018_fayetteville_meeting_minutes_compressed.mp3.0a9e3e44-2456-4ea7-8bea-b8033b7bde75.Transcript.txt,10_02_2018,"I just, I'd love to, I wish that we had just a big sack of money that we could just reach into and take it out and just sprinkle it here and have all the things that have all this wonderful maintained green space and still have affordable housing and still have maybe not so affordable housing for people that want to move here. We need all types of housing. And, you know, it's just a hard decision, but I'm going to vote in favor of this.",affordable housing
10_02_2018_fayetteville_meeting_minutes_compressed.mp3.0a9e3e44-2456-4ea7-8bea-b8033b7bde75.Transcript.txt,10_02_2018,"I'm the director of development for theater squared. I just wanted to take a quick minute and read a letter that we received from Solomon Birchfield, who is the director of operations for seven Hills homeless shelter each year for the past two years we've hosted what we call a picnic and a play. on a Saturday in May where we bring a number, quite a few of the homeless clients from Seven Hills.",homeless
10_02_2018_fayetteville_meeting_minutes_compressed.mp3.0a9e3e44-2456-4ea7-8bea-b8033b7bde75.Transcript.txt,10_02_2018,"As we discussed yesterday, there will always be a homeless population for various reasons, and that one of the things we can do to treat them as humans with dignity. What T2 has provided to them through this experience is a definition of that. For them to sit in theater and enjoy a world-class production, and maybe not be defined by their homelessness for at least a few hours.",homeless; homelessness
10_02_2018_fayetteville_meeting_minutes_compressed.mp3.0a9e3e44-2456-4ea7-8bea-b8033b7bde75.Transcript.txt,10_02_2018,"Young people are burdened with incredible amounts of student loan debt. Renting is the new reality, and we need to offer a variety of household types for people who rent. And if we want to have affordable housing, it is a lot more affordable to subdivide one lot into three separate units or multiple units to distribute the cost of that lot and land development over multiple units so that they can become more affordable.",affordable housing
01_04_2022_fayetteville_meeting_minutes.mp3.2bcc1899-2ce3-47db-987e-81f43450f09f.Transcript.txt,01_04_2022,"Number two, a resolution to authorize an agreement between the city of Feville, Arkansas and Ozark. Tennis Academy LLC to provide tennis programs for federal residents in 2022 with automatic renewals for up to four additional one-year terms at a total estimated cost of $61,000. Number three, a resolution to approve a proposal from King Electric Contractors, Inc. in the total amount of $218,125 pursuant to bid number 2058 for electrical service associated with Square Lighting and Electrical Improvements Project.  and downtown walkability project to approve a project contingency in the amount of twenty thousand dollars and to approve a budget adjustment this is 2019 street improvements bond and park improvement bond project number four a resolution to approve a contract seven hills homeless center to provide funding assistance in the amount of forty thousand dollars for maintenance and repairs at walker family residential community complex in 2022.",homeless
01_04_2022_fayetteville_meeting_minutes.mp3.2bcc1899-2ce3-47db-987e-81f43450f09f.Transcript.txt,01_04_2022,This is a strategy that works toward Fayetteville's 2040 plan for affordable housing. It works toward a wider range of housing options. There are already many standards which protect the city's interest related to property density and the rules that would keep a neighborhood in its own personality and what makes this neighborhood special.,affordable housing
01_18_2022_fayetteville_meeting_minutes.mp3.9b87bbae-c50a-4ad0-b7c4-a5e4d919bf72.Transcript.txt,01_18_2022,"I think looking at the city's 2040 plan and reading all the information on the city about planning that we need more density, we need more inflow. We simply will never get to affordable housing if we can't increase the number of units. And providing more options beyond just multi-story apartment complexes, I think will help get us closer to this goal.",affordable housing
01_18_2022_fayetteville_meeting_minutes.mp3.9b87bbae-c50a-4ad0-b7c4-a5e4d919bf72.Transcript.txt,01_18_2022,"but but we gotta add more houses um i know a lot of people want to protect the integrity of rsf4 but basically you can protect the art integrity of rsf4 or you can help homeless you can't do both and i know a lot of people are trying to say let's be creative  No, if you just don't allow houses, then you have decided houses should be more expensive or you've decided that you want people to drive through your city.",homeless
01_18_2022_fayetteville_meeting_minutes.mp3.9b87bbae-c50a-4ad0-b7c4-a5e4d919bf72.Transcript.txt,01_18_2022,"And so the buy-write and expanding upon that, I think, is one of some of my concerns. Thank you. Well, what other discussion would the council like to have?  on this where you are this is an ordinance it's on the second reading or another discussion or action items from the council like I just uh I just have a comment you know I do think we need to come back to one of our core tenants that we've been working on for a while is creating affordable housing and having a house with an apartment or another rule you know space in it would have been really helpful for me when I was looking for a space for um  you know, my mom that had dementia.",affordable housing
01_18_2022_fayetteville_meeting_minutes.mp3.9b87bbae-c50a-4ad0-b7c4-a5e4d919bf72.Transcript.txt,01_18_2022,"So this is, and this is unfortunately a giant, you know,  thing that plagues are, plagues people. And I think a lot of people would like to be able to have their ailing family members or aging family members, maybe disabled family members, have a private space amongst their space. So it's not just only about affordable housing, but it's also about just taking care of people.",affordable housing
01_18_2022_fayetteville_meeting_minutes.mp3.9b87bbae-c50a-4ad0-b7c4-a5e4d919bf72.Transcript.txt,01_18_2022,"Okay, thank you all. Let's go to number two. a resolution to approve a budget adjustment of twenty one thousand four hundred and forty two dollars to partially fund emergency shelters for homeless persons provided by seven hills homeless center genesis church central united methodist church in northwest arkansas continuing their care when when the salvation army shell when the salvation army shelter and other shelters are fully occupied during dangerous cold nights deandre i believe this is yours",homeless
01_18_2022_fayetteville_meeting_minutes.mp3.9b87bbae-c50a-4ad0-b7c4-a5e4d919bf72.Transcript.txt,01_18_2022,"And this collaborative is made up of Seven Hills Homeless Shelter, Genesis Church, New Beginnings, Northwest Arkansas Continuum of Care, Salvation Army, Central United Methodist Church, and the United Way. And they have made tentative plans to assist the homeless residents of Fayetteville when it is too cold for them to safely sleep outside. And of course, that temperature will be 15 degree wind chill or colder.",homeless
01_18_2022_fayetteville_meeting_minutes.mp3.9b87bbae-c50a-4ad0-b7c4-a5e4d919bf72.Transcript.txt,01_18_2022,okay go ahead hi there uh stephen mills seven hills homeless center,homeless
01_18_2022_fayetteville_meeting_minutes.mp3.9b87bbae-c50a-4ad0-b7c4-a5e4d919bf72.Transcript.txt,01_18_2022,"um this is a this is a great opportunity that um several of  the organizations that are working to end homelessness and provide for those that are suffering from homelessness have kind of come together in this collaborative to ensure that there's a gap, especially when it's extremely cold outside in overnight shelter in our community. So coming together, several organizations are able to kind of build a plan, rotate staffing, ensure that these individuals who in our community are most vulnerable are provided care during that time. So I'm...  the the uh the collaborative's uh case for support uh has been made available and i'm happy to answer any questions um i know that um you know in the past  This has been kind of a goal of ours, this collaboration, and it's something that we've kind of built up to.",homelessness
02_02_2023_fayetteville_meeting_minutes.mp3.544a5a53-5209-4a42-8a0f-fed0f11b4a0c.Transcript.txt,02_02_2023,"For many years, we have provided funding to Seven Hills Homeless Shelter and other groups who work directly with this population. Through the Pick Me Up program, people in our unsheltered community are employed to clean up litter in South Federal. Last year, participants cleaned up 66,000 pounds of litter.",homeless
01_18_2024_fayetteville_meeting_minutes.mp3.be1a982c-6600-4b10-86d1-113c40148907.Transcript.txt,01_18_2024,"So overall, this project, if you look at it from a big picture, this project is more of a microcosm of vehicle-centric development pattern that has...  PERPETUATED INDIVIDUAL SITE PAD DEVELOPMENT AND HAS LED TO, HAS NOT HELPED THE CURRENT HOUSING CRISIS IN THE CITY AND WE BELIEVE THAT THIS PROJECT WILL NOT SIGNIFICANTLY IMPROVE THE LIFE, SAFETY OR WELFARE OF THE CITIZENS OF PAYETTEVILLE. IN CLOSING, JUST BECAUSE A GAS STATION CAN BE BUILT THERE DOES NOT MEAN THAT A GAS STATION SHOULD BE BUILT THERE.",housing crisis
11_07_2024_fayetteville_meeting_minutes_compressed.mp3.b2011206-c98d-4848-9aaf-95ed5b856983.Transcript.txt,11_07_2024,"probably would be more along the lines of those that are battling homelessness and mental health issues. Absolutely, so my final point is that the it comes down to collaboration and so you've seen it sounds like you've seen a lot of success with collaborating with drug court and mental health facilities and so that's that's that's also great because I  We recognize that collaboration is key as it relates to solving this crisis.",homelessness
11_07_2024_fayetteville_meeting_minutes_compressed.mp3.b2011206-c98d-4848-9aaf-95ed5b856983.Transcript.txt,11_07_2024,"i i  I think that there have been a lot of good points made around this, but I want to kind of recenter us to the investment that we've made in this corridor as we're kind of considering this, that we really were looking to really create, you know, a very, you know, an area that would have transit with lots of density of individuals that are, you know, walking to like services and thinking about sidewalk cafes and coffee shops. And so, you know, I have hesitation and concern when I think about the considerable spend that taxpayers are making where we really want to have, you know, bodies there in commerce versus storing goods and the fact that we store in our housing crisis.",housing crisis
11_07_2024_fayetteville_meeting_minutes_compressed.mp3.b2011206-c98d-4848-9aaf-95ed5b856983.Transcript.txt,11_07_2024,"Many of my classmates and friends are in the same position wanting to stay and contribute to this community but facing limited options. The city has so much to offer yet affordable housing options are scarce, especially for those of us starting out. I believe that projects like this one can make a real difference by giving people a better chance to stay in Fayetteville.",affordable housing
11_07_2024_fayetteville_meeting_minutes_compressed.mp3.b2011206-c98d-4848-9aaf-95ed5b856983.Transcript.txt,11_07_2024,All of the requested variances are reasonable and necessary for developing this land to its highest and best use. And any project that would get built or proposed on this property would likely need at least the forbearance of being asked by this project. Our city is currently dealing with a housing crisis as declared by this very city council a few months ago.,housing crisis
11_07_2024_fayetteville_meeting_minutes_compressed.mp3.b2011206-c98d-4848-9aaf-95ed5b856983.Transcript.txt,11_07_2024,No. but we can't let perfect be the enemy of good when we are in a declared housing crisis i ask that you please deny this appeal and let this project move forward thank you thank you who else sorry good evening my name is kelly schwarting i live at 324 southeast avenue i retired to fayetteville in 2017 after spending 30 plus years in real estate and multi-family property management we welcome infill in our neighborhood we just want to protect  a new development from adversely affecting our single-family homes.,housing crisis
11_07_2024_fayetteville_meeting_minutes_compressed.mp3.b2011206-c98d-4848-9aaf-95ed5b856983.Transcript.txt,11_07_2024,"First of all, I am for infill, quality infill. That's properly done. I think there's a lot of good things about this project, but  I keep hearing the argument tossed around about affordable housing, infill, and how this is going to solve the housing crisis.",housing crisis; affordable housing
11_07_2024_fayetteville_meeting_minutes_compressed.mp3.b2011206-c98d-4848-9aaf-95ed5b856983.Transcript.txt,11_07_2024,I had five calls this week This it is disingenuous It is it's really not telling the truth in my opinion took all this affordable housing or to imply that somehow this is going to be  magically cause additional cheaper housing to spring up elsewhere in walkable neighborhoods.,affordable housing
11_07_2024_fayetteville_meeting_minutes_compressed.mp3.b2011206-c98d-4848-9aaf-95ed5b856983.Transcript.txt,11_07_2024,"And the idea that they are going to be able to enforce any kind of parking, they would have to have a force patrolling the streets day and night.  making 800 more car trips probable in our neighborhood will not do anything to help Fayetteville or especially our neighborhood, but Fayetteville on the whole. Whatever they say about affording affordable housing, $1200 a month  For I would know last meeting they were mentioning senior citizens It's not something senior senior citizens are going to want to do this is being marketed mainly to Transients I mean, you know, I don't mean like bombs.",affordable housing
11_07_2024_fayetteville_meeting_minutes_compressed.mp3.b2011206-c98d-4848-9aaf-95ed5b856983.Transcript.txt,11_07_2024,"But I happen to love Fayetteville, and I happen to love that neighborhood, and I walk around it a lot. You talk about affordable housing. Well, $1,200 isn't.",affordable housing
11_07_2024_fayetteville_meeting_minutes_compressed.mp3.b2011206-c98d-4848-9aaf-95ed5b856983.Transcript.txt,11_07_2024,"This project is in alignment with the city's goals outlined in City Plan 2040 and conforms with the recent rezoning of Business 71. We're in the middle of a housing crisis. Some may not think so, but we are.",housing crisis
11_07_2024_fayetteville_meeting_minutes_compressed.mp3.b2011206-c98d-4848-9aaf-95ed5b856983.Transcript.txt,11_07_2024,"My name is Franklin Everts. I live at 11 West South Street in Fayetteville, and I just want to reiterate that we're not against  Housing in Fayetteville, affordable housing in Fayetteville. We're just against the size of this and how it fits into our neighborhood.",affordable housing
11_07_2024_fayetteville_meeting_minutes_compressed.mp3.b2011206-c98d-4848-9aaf-95ed5b856983.Transcript.txt,11_07_2024,There may be some of your neighbors that are currently in your neighborhood today that would struggle to afford to come back into your neighborhood. I couldn't afford to buy in your neighborhood today. And that's because we do have a housing crisis and we have a lack of inventory.,housing crisis
11_07_2024_fayetteville_meeting_minutes_compressed.mp3.b2011206-c98d-4848-9aaf-95ed5b856983.Transcript.txt,11_07_2024,"You probably know of people that want to live in the downtown area, that want to be close to amenities, that desire to have a certain lifestyle that they're not able to have. There was talk about safety and quality of life. We've listened to stories while we declared a housing crisis of individuals that are having to make safety choices staying with domestic partnerships where there is violence because they don't have housing they can get to.",housing crisis
11_07_2024_fayetteville_meeting_minutes_compressed.mp3.b2011206-c98d-4848-9aaf-95ed5b856983.Transcript.txt,11_07_2024,"I don't know any way we don't support this project if we really believe that we're striving for equity in Fayetteville, if we're trying to make a place for everyone, and we think that we're in a housing crisis. It was mentioned by one resident, the concern that because we're in a housing crisis, that might make us make certain decisions. I want to say yes, it does make us make certain decisions.",housing crisis
11_07_2024_fayetteville_meeting_minutes_compressed.mp3.b2011206-c98d-4848-9aaf-95ed5b856983.Transcript.txt,11_07_2024,"And if they are, please hold me accountable.  and send me packing. But I just, when I look at this, I don't. And as I said earlier, I ran, we have a housing crisis.",housing crisis
11_07_2024_fayetteville_meeting_minutes_compressed.mp3.b2011206-c98d-4848-9aaf-95ed5b856983.Transcript.txt,11_07_2024,"I think they're great and I will advocate for that and I will help you with that. I will help advocate for a parking district. But at the end of the day, we have a housing crisis.",housing crisis
01_31_2017_fayetteville_meeting_minutes.mp3.7ceda46d-4c7b-4300-8a4d-6a53d3545945.Transcript.txt,01_31_2017,"The only item that we have here before us tonight is under new business and it is an order to waive the competitive bidding to approve an emergency two month purchase of services contract with seven years homeless center with possible extensions of up to four additional months and to approve a budget adjustment kit. Whereas the Board of Directors of Seven Hills has operated a daytime facility to serve numerous homeless and needy Fayetteville residents for over 15 years, relying upon the support of several local churches, charities, and charitable persons, as well as some governmental support for veterans, etc.,  And whereas through generous contributions by the Walker family and others, Seven Hills was able to construct and operate the Walker family residential community complex for transitional housing for homeless residents of Fayetteville on leased city property south of Huntsville Road for many years,  And whereas Seven Hills is currently suffering an operating income emergency, it is in dire need of temporary assistance from the City of Fayetteville to be able to weather the storm and continue to offer vital services to Fayetteville's homeless residents during winter. And whereas if Seven Hills could no longer operate its Walker Family Residential Community Transitional Housing facility, currently housed citizens might become homeless again and have to live on the streets or in the woods during these harsh winter months.",homeless
01_31_2017_fayetteville_meeting_minutes.mp3.7ceda46d-4c7b-4300-8a4d-6a53d3545945.Transcript.txt,01_31_2017,"And whereas if Seven Hills could no longer operate its daytime facility, the large number of homeless residents who depend upon this facility for showers and washing hot food warm place to stay during the day, as well as access to a telephone and other job assistance services could not find such comparable services elsewhere. and whereas the facility and services provided by Seven Hills need to be continued and should be temporarily supported by the city taxpayers to prevent our homeless and needy residents from suffering undue hardship and deprivation during these winter months. Now, therefore, it be ordained by the City Council of the City of Fayetteville, Arkansas, Section 1, that the City Council of the City of Fayetteville, Arkansas hereby determines that the facts shown above...  constitute an exceptional situation in which formal competitive bidding is not practical or feasible and therefore weighs formal competitive bidding and approves the attached emergency purchase of services contract with Seven Hills Homeless Center and authorized Authorizes mayor Jordan to sign this contract section 2 that City Council city of Fayetteville-Arkansas hereby approves the attached budget adjustment",homeless
01_31_2017_fayetteville_meeting_minutes.mp3.7ceda46d-4c7b-4300-8a4d-6a53d3545945.Transcript.txt,01_31_2017,"And on behalf of our entire board of directors, most of whom are here, and our committed and dedicated hardworking staff, quite a few of whom are here, I just want to say thank you very much for all that the city has done for us in the past and for even considering this additional emergency funding. Thank you. I think it's important for you to know that the homeless population of Northwest Arkansas has grown exponentially faster than the population in general, and we do not see an end to the increased need for the kinds of services we are providing, some of which are unique to Seven Hills.",homeless
01_31_2017_fayetteville_meeting_minutes.mp3.7ceda46d-4c7b-4300-8a4d-6a53d3545945.Transcript.txt,01_31_2017,"We believe that what we provide is essential to the overall system of supports providing care to our neighbors in need while they move toward recovery and self-sufficiency. To cut to the chase, let me say that despite the growing need, our organization has reached the point where we can no longer maintain the full range of services for people who are homeless. We have been working diligently.  to avoid having to cut services and we have made tremendous progress.",homeless
01_31_2017_fayetteville_meeting_minutes.mp3.7ceda46d-4c7b-4300-8a4d-6a53d3545945.Transcript.txt,01_31_2017,"Closing both these facilities will have serious consequences for other organizations in Northwest Arkansas that depend on the Walker Family Residential Community to support a client or family's transition to self-sufficiency. It will also impact other programs that offer some services during the day, as the demand for these services will increase greatly. As a lifelong citizen of Northwest Arkansas, I absolutely believe that all of us must work together to raise awareness of the issue of homelessness in this area and do something about it.",homelessness
