Submission Title,Submission Score,Submission URL,Submission Timestamp,Comment,Comment Score,Comment Timestamp
Low Barrier Homeless Shelter on Bendix now on hold,17,https://www.reddit.com/r/SouthBend/comments/1abvcg0/low_barrier_homeless_shelter_on_bendix_now_on_hold/,2024-01-26 22:47:51 UTC,"Yeah we know you said it. Most people are tired of all the services being downtown.

Some of us are tired of the people zoned out on drugs who nearly stumble into the street while we're driving, people sleeping during the day on the little post office hill, taking dumps on the steps of the old school administration building where it's hard to see, drama around the tent towns, many women feeling unsafe using the gas stations downtown, the federal buildings installing 8' fences around their buildings and the BMV/social security offices moving away, random windows of businesses broken because of fits of mental illness, guys ripping the head off of geese at Leeper Park, and random people yelling all damn time, and litter everywhere. 

You can care about the homeless, but not feel it necessary for us to have every homeless service in our downtown.",14,2024-01-26 23:14:09 UTC
Low Barrier Homeless Shelter on Bendix now on hold,17,https://www.reddit.com/r/SouthBend/comments/1abvcg0/low_barrier_homeless_shelter_on_bendix_now_on_hold/,2024-01-26 22:47:51 UTC,"That low barrier is what gets them off the street not harassing people. The center itself is gated with wraparound services to keep folks in there for treatment. Like it’s not 100% but better than just being a warming shelter and they go back out into a neighborhood or the downtown That housing first is offering what everyone generally wants which is containment. Once needs are met and theirs a roof over your head it’s a lot lot easier to recover you know? It won’t be everyone but it’s better than asking people who literally shit outside and are ignored by everyone out of fear that they have to meet unrealistic standards for their basic needs to be met before they can get help for said condition. Once they fail that we can turn around and say well we tried, tough shit bud you clearly don’t want it bad enough. These centers are bending over backwards to meet every persons concern as best they can and it never gets reciprocated. Where are there not people in south bend? They wanted it in portage manor but the county said no. They won’t work with them. Everyone’s homeless roll into south bend and everyone gets to say wow what a messed up city.",9,2024-01-27 01:15:14 UTC
Low Barrier Homeless Shelter on Bendix now on hold,17,https://www.reddit.com/r/SouthBend/comments/1abvcg0/low_barrier_homeless_shelter_on_bendix_now_on_hold/,2024-01-26 22:47:51 UTC,"""Put the money towards helping the homeless get on their feet...""

Which is exactly what this is. Have you read any of the proposals about the facility, and the services it might offer? How many people can successfully work on their addiction or mental health problems if they don't even have anything but a tent under a bridge to live in, and an alleyway for a toilet? Can't bathe, or get a full night of rest for weeks at a time?",6,2024-01-27 16:55:12 UTC
South Bend business owners propose alternative sites for low-barrier homeless center,15,https://www.reddit.com/r/SouthBend/comments/1bcw71n/south_bend_business_owners_propose_alternative/,2024-03-12 12:35:42 UTC,"Their sites are [here](https://www.redresssouthbend.com/post/a-closer-look-at-potential-new-day-intake-center-locations-in-south-bend). Ill say, I think this effort is a bit disingenuous. They spout off on the mayor's office about how they were able to locate these sites in two weeks vs the multi year process, but the fact that it took them two weeks shows. The first site on the list, for example, is barred from residential development by IDEM. The second site, Rabbi Shulman, is highlighted because it is an existing structure with existing apartments. The site is scheduled for demolition because the work needed is too great, and affordable housing units are set to be built in its place. Even if they constructed on the site, it is trading one problem for another. Not to mention, many of their complaints about the Bendix site (too close to business) would apply, and then some, to that site. The sixth site abuts a residential neighborhood and Stanley Clark school, again, why would their previous complaints about Bendix not apply here and then some? 

Im not going to spend my time and pick apart each location, this is just what a 5 minute cursory glance shows. There are glaring problems with many of the sites they proposed. It is clear that they dont actually care about finding another location, they simply want to turn this into a divisive issue and stall the process. 

[Bonus commentary from a listener, aired on WVPE this morning.](https://www.wvpe.org/commentary/2024-03-11/commentary-new-day)",40,2024-03-12 12:48:18 UTC
South Bend business owners propose alternative sites for low-barrier homeless center,15,https://www.reddit.com/r/SouthBend/comments/1bcw71n/south_bend_business_owners_propose_alternative/,2024-03-12 12:35:42 UTC,"There is also the Portage Manor that could work and sit empty as well.  Maybe too ""nice"" for homeless?",7,2024-03-12 12:47:23 UTC
South Bend business owners propose alternative sites for low-barrier homeless center,15,https://www.reddit.com/r/SouthBend/comments/1bcw71n/south_bend_business_owners_propose_alternative/,2024-03-12 12:35:42 UTC,"I know it’s an odd thing to ask, but is the Bendix site near the services and support that homeless people need to access? 

If they are accustomed to being downtown, are they going to utilize a shelter that is not in walking distance to where they congregate?",2,2024-03-12 14:15:56 UTC
South Bend business owners propose alternative sites for low-barrier homeless center,15,https://www.reddit.com/r/SouthBend/comments/1bcw71n/south_bend_business_owners_propose_alternative/,2024-03-12 12:35:42 UTC,"It looks like OP posted an AMP link. These should load faster, but AMP is controversial because of [concerns over privacy and the Open Web](https://www.reddit.com/r/AmputatorBot/comments/ehrq3z/why_did_i_build_amputatorbot).

Maybe check out **the canonical page** instead: **[https://www.wndu.com/2024/03/11/south-bend-business-owners-propose-alternative-sites-low-barrier-homeless-center/](https://www.wndu.com/2024/03/11/south-bend-business-owners-propose-alternative-sites-low-barrier-homeless-center/)**

*****

 ^(I'm a bot | )[^(Why & About)](https://www.reddit.com/r/AmputatorBot/comments/ehrq3z/why_did_i_build_amputatorbot)^( | )[^(Summon: u/AmputatorBot)](https://www.reddit.com/r/AmputatorBot/comments/cchly3/you_can_now_summon_amputatorbot/)",1,2024-03-12 12:35:53 UTC
South Bend agrees to purchase land proposed for low-barrier homeless shelter,15,https://www.reddit.com/r/SouthBend/comments/1g12x42/south_bend_agrees_to_purchase_land_proposed_for/,2024-10-11 05:47:45 UTC,"# City finalizes land purchase for homeless intake centerCity finalizes land purchase for homeless intake center

[https://www.wvpe.org/wvpe-news/2024-10-11/city-finalizes-land-purchase-for-homeless-intake-center](https://www.wvpe.org/wvpe-news/2024-10-11/city-finalizes-land-purchase-for-homeless-intake-center)",3,2024-10-11 06:04:35 UTC
Homeless shelter on Bendix ,5,https://www.reddit.com/r/SouthBend/comments/1dmthlh/homeless_shelter_on_bendix/,2024-06-23 19:01:54 UTC,Can I ask why? And if you have volunteered at any of the organizations that provide resources to the homeless?,1,2024-06-27 20:24:55 UTC
Michiana Five for the Homeless shutting down operations,6,https://www.reddit.com/r/SouthBend/comments/18hrfv6/michiana_five_for_the_homeless_shutting_down/,2023-12-13 21:17:07 UTC,They have been a small but mighty group advocating for the unhoused in our community. Sad to see that they are being forced to shut down their operations.,10,2023-12-13 21:18:04 UTC
Homeless encounters,0,https://www.reddit.com/r/SouthBend/comments/qst1ai/homeless_encounters/,2021-11-13 04:13:13 UTC,"My best homeless experience was when I was volunteering I met and talked to some of downtowns street dwellers and learned of their personal hardships, passions and stories of hope. Very humanizing. My worst homeless experience was when I was driving under a bridge downtown that had a light right after you exit from under the bridge. Three street dwellers came up to my car tried to get me to roll down my window. I didn’t because it was 11pm nor did I have anything to give them. They seemed mad but it looked like they were going to walk away. Right before the light turned green two of the street dwellers  grabbed something from the third street dwellers backpack and then threw grey “slop” all over on my windshield. I have no idea what it was but it shocked me and I drove away quickly. When I got home most of it had run off the car but what was left was very thick and pasty. Had no odor to it. Very odd. Street dweller encounters are hit or miss. Regardless it’s important to remember they are human. I always keep some nickels and dimes on me now to hopefully avoid situations like the car slop incident. They’re just trying to survive and I will help them out when I can. You should too.",6,2021-11-13 16:53:55 UTC
Homeless encounters,0,https://www.reddit.com/r/SouthBend/comments/qst1ai/homeless_encounters/,2021-11-13 04:13:13 UTC,"This thread only serves to increase stigma around people experiencing homelessness. Sorry about that experience, but this is a mean-spirited post.",20,2021-11-13 15:18:52 UTC
Homeless encounters,0,https://www.reddit.com/r/SouthBend/comments/qst1ai/homeless_encounters/,2021-11-13 04:13:13 UTC,Do not give money to homeless.,1,2021-11-14 15:23:58 UTC
Homeless encounters,0,https://www.reddit.com/r/SouthBend/comments/qst1ai/homeless_encounters/,2021-11-13 04:13:13 UTC,"My understanding is the ""don't give to panhandlers, donate to____"" signs were the only way to get the downtown business owners to relent to allowing another year of weather amnesty downtown.

No concessions re: signs = no weather amnesty that year.

The signs were bad, but the alternative was worse.",2,2021-11-15 05:08:14 UTC
Homeless encounters,0,https://www.reddit.com/r/SouthBend/comments/qst1ai/homeless_encounters/,2021-11-13 04:13:13 UTC,"Learning about people's South bend experiences with homeless people, both good and bad",1,2021-11-15 18:22:39 UTC
"Protesters chalk South Bend's County City Building, demand more help for city's homeless",32,https://www.reddit.com/r/SouthBend/comments/htfbtb/protesters_chalk_south_bends_county_city_building/,2020-07-18 11:47:53 UTC,"I hear alot of big ideas with no suggestion on how to execute those ideas. Everybody wants more homeless shelters, until they are to be built in thier neighborhood.",23,2020-07-18 15:11:42 UTC
"Protesters chalk South Bend's County City Building, demand more help for city's homeless",32,https://www.reddit.com/r/SouthBend/comments/htfbtb/protesters_chalk_south_bends_county_city_building/,2020-07-18 11:47:53 UTC,Just do what NYC does with their homeless. Ship them to San Francisco because they have more rights there than the locals that pay taxes and live there. They get all the benefits and care they need.,0,2020-07-21 15:59:09 UTC
"Protesters chalk South Bend's County City Building, demand more help for city's homeless",32,https://www.reddit.com/r/SouthBend/comments/htfbtb/protesters_chalk_south_bends_county_city_building/,2020-07-18 11:47:53 UTC,"I'd take one in my neighborhood. homeless shelters are a part of the solution, but jobs and cheap housing are better.",8,2020-07-18 15:36:49 UTC
"Protesters chalk South Bend's County City Building, demand more help for city's homeless",32,https://www.reddit.com/r/SouthBend/comments/htfbtb/protesters_chalk_south_bends_county_city_building/,2020-07-18 11:47:53 UTC,"according to the HUD website, this year the city of south bend was awarded an emergency shelter grant of 1 million dollars in addition to the CARES ACT monies given to the city specifically to care for houseless populations during COVID. the city has the money, why don’t they open the wallet? and why don’t you say something helpful or informative instead of ignorant?",2,2020-07-20 03:27:56 UTC
"Protesters chalk South Bend's County City Building, demand more help for city's homeless",32,https://www.reddit.com/r/SouthBend/comments/htfbtb/protesters_chalk_south_bends_county_city_building/,2020-07-18 11:47:53 UTC,"Wow, what am immature statement that assumes so much. The article mentions one of the protestors ea shomeles themselves (so it's safe to assume others may have been too) so what kind of financial freedom do you think they have to solve the homeless problem with their own wallet?

How do you know they aren't donating money and wouldn't donate money if the city set up temporary housing? How do you know they aren't donating money to other causes becuase they are clearly compassionate people?

What have you done for the homeless? Drop the cynicism and stop beating down people who are trying to make the city better.",2,2020-07-18 15:14:06 UTC
"Protesters chalk South Bend's County City Building, demand more help for city's homeless",32,https://www.reddit.com/r/SouthBend/comments/htfbtb/protesters_chalk_south_bends_county_city_building/,2020-07-18 11:47:53 UTC,"Want to help a homeless person? House them, feed them literally do anything but morally grandstand",-5,2020-07-18 19:33:56 UTC
"Protesters chalk South Bend's County City Building, demand more help for city's homeless",32,https://www.reddit.com/r/SouthBend/comments/htfbtb/protesters_chalk_south_bends_county_city_building/,2020-07-18 11:47:53 UTC,"https://www.southbendtribune.com/news/local/south-bend-mayor-vetoes-resolution-calling-for-action-state-of-emergency-on-homelessness/article_9367c7ea-c785-11ea-9f9f-5ffff858fd83.html?fbclid=IwAR1dAGjYneA-t2P0kUPE_R_fh1ty3Yu7iN9crVz_vA_e7tV-LqBvD14qXtk


It was a resolution, my mistake.",1,2020-07-18 21:44:17 UTC
"Protesters chalk South Bend's County City Building, demand more help for city's homeless",32,https://www.reddit.com/r/SouthBend/comments/htfbtb/protesters_chalk_south_bends_county_city_building/,2020-07-18 11:47:53 UTC,text of the resolution: https://southbendin.gov/wp-content/uploads/2019/04/COSB-Working-Group-Report-on-Chronic-Homelessness.pdf,1,2020-07-18 21:46:02 UTC
South Bend building 22-unit apartment complex to house the homeless,63,https://www.reddit.com/r/SouthBend/comments/ivug3h/south_bend_building_22unit_apartment_complex_to/,2020-09-19 15:20:35 UTC,"Long overdue. Faced so many unnecessary stalls because neighbors got in a fit about a homeless dormitory in their neighborhood. 

It’s gotta go somewhere, folks.",26,2020-09-19 16:22:22 UTC
South Bend building 22-unit apartment complex to house the homeless,63,https://www.reddit.com/r/SouthBend/comments/ivug3h/south_bend_building_22unit_apartment_complex_to/,2020-09-19 15:20:35 UTC,"Most comments are saying how great it is to homeless (and it usually is) but are ignoring or unaware of the ***type*** of homeless they plan to place here.  *Drug addicts and people with mental issues.*  If it were more homes for homeless and/or low income families, I wouldn't think twice about it but I'm very concerned about a facility housing drug addicts and people with mental issues just a couple hundred feet from a school in the middle of a residential neighborhood.",1,2020-09-28 02:55:57 UTC
South Bend building 22-unit apartment complex to house the homeless,63,https://www.reddit.com/r/SouthBend/comments/ivug3h/south_bend_building_22unit_apartment_complex_to/,2020-09-19 15:20:35 UTC,"I'm not exactly sure where they're putting it, being fairly new to South Bend and bad at geography, but I've worked with homeless people in a few of my jobs and I'd be happy to have permanent supportive housing in my neighborhood (we do live on the east side of SB). They're even screening people for histories of violence and providing Oaklawn support services! I'm sure there will be challenges both for the residents there and the community, but that's true for a lot of things you might live by, like a factory, a gas station, a big road, etc.",1,2020-10-02 21:24:14 UTC
South Bend building 22-unit apartment complex to house the homeless,63,https://www.reddit.com/r/SouthBend/comments/ivug3h/south_bend_building_22unit_apartment_complex_to/,2020-09-19 15:20:35 UTC,"While I support the idea of a shelter, sorry ""supportive permanent housing"" I doubt anyone here who thinks it's great lives in the neighborhood. I challenge any of you to say the same thing if this was moving in right next door to your home. Read the articles, all people quoted acknowledge there have been ""issues"" with other projects like this in town, Troy Warner even acknowleged as much saying he lived near one previously. The fact that he no longer lives there, I guarantee you the facility factored into him relocating. This neighborhood has been a nice quiet neighborhood with many families with young children. Our property values were finally coming up. What happens when my house is worth half what I paid for it? A lot of people have moved in recently paying upwards of $150 for their houses. Several of those now will back up directly to this building. If this project turns out the way others have, those homeowners are liable to be underwater on their mortgage before hardly moving in. some of those are liable to walk away from their mortgages, and where does that lead? See the west side before Buttigieg had many abandoned homes razed. 
The Corby homes, while not having the best history, are not drug addicts and mental health patients unable to access other services. What happens when a resident stops taking their medication? Or relapses and is expelled from the program? When that happens people are evicted from the building, where will they go? They stay where they were. Our neighborhood is enclosed by busy roads and a golf course with its own barbed wire fence. The expensive new condos are safe they have Ironwood as a buffer. Once people are here they will stay here whether they are living in the residence or not. There's no where else to go, but the park around Edison middle school sure looks like a nice place to shoot up. Take a look at the center for the homeless downtown, or the soup kitchen at the Methodist Church. People hang out all around there at all hours. I have a friend who lived near the soup kitchen and there were constantly seedy characters hanging out in her yard, fights, shouting about taking the word of christ to heart or face his wrath in hell....that was at 2am on a Tuesday, ans she lived a block away from the kitchen. 
Besides all that, it's especially angering that the city has done this with zero involvement from the neighborhood, zero warning, zero comment. They recently started building a security fence around the Edison IT department parking lot a few weeks before this was announced. We should ""go greet [our] new neighbors"", yet the SBCSC is worried about their vans? My nextdoor neighbor has been here since the early 80s, this exact same project was tried in the 90s, the land was rezoned, but then the project abandoned after outcry from the neighborhood, much like th articles allude to. Fast forward 25 years they no longer have to have council approval because the land is already zoned as such, especially convinient we now only have virtual common council meetings, no one can voice opposition. They knew no one would want it in the neighborhood so they just looked the other way and literally said ""deal with it"". It's especially grand they only alerted residents within 350 feet of the property. You know how many houses are within that zone? About 6.   (and they only got a letter in the mail a few days before the press release). Are you telling me this will affect no one outside that radius? 
Even more angering is that last year Mueller vetoed, and Troy Warner voted against a planned car wash next to the McClure station because such use was ""deemed to negatively affect neighborhood property values, and was not in keeping with the atmosphere of the neighborhood"". But now with this they're just like ""oh uh....you know the west side has had a lot, we thought we'd spread it around let everyone share, but you guys are just gonna love it trust me, and with the school there, what a learning opportunity! Kids! You seeing all this plight??""

https://youtu.be/i3EUJWMWeqg",2,2020-09-20 17:12:30 UTC
South Bend building 22-unit apartment complex to house the homeless,63,https://www.reddit.com/r/SouthBend/comments/ivug3h/south_bend_building_22unit_apartment_complex_to/,2020-09-19 15:20:35 UTC,The [Oliver Apartments](https://abc57.com/news/crime-still-an-issue-at-oliver-apartments-as-city-considers-another-homeless-apartment-complex) had almost 350 calls to the police between fall of 2017 and July 2019.  That's a call to the cops every other day.,1,2020-09-21 19:45:51 UTC
South Bend building 22-unit apartment complex to house the homeless,63,https://www.reddit.com/r/SouthBend/comments/ivug3h/south_bend_building_22unit_apartment_complex_to/,2020-09-19 15:20:35 UTC,"Hey neighbor, I live over here as well! 

I share a lot of your concerns, but we have to remember that this needs to go *somewhere*. Its probably going to have a negative impact wherever it goes, it just happens we drew the short straw this time. I already sent an email to Warner (and I should probably send one to Mueller as well) requesting some more specifics on what the plan is to maintain the neighborhood. Id suggest you do the same. The more pressure, the better. When this happens, because it certainly sounds like its going to, we are going to have to try to make the most of it. We will have a vested interest in making sure the residents there succeed and receive the resources they are promised. We will also need to make sure we hold the city's feet to the fire to make sure they fulfill their promises to us and maintain our neighborhood. 

Thankfully this is a little different than a soup kitchen or shelter. Its actual housing, its designed for people who are maybe one step up from living on the streets, but still one step down from being on their feet enough to live in someplace like Corby Homes. Im genuinely hoping and cautiously optimistic that it wont be much of a problem.",3,2020-09-21 13:18:41 UTC
South Bend building 22-unit apartment complex to house the homeless,63,https://www.reddit.com/r/SouthBend/comments/ivug3h/south_bend_building_22unit_apartment_complex_to/,2020-09-19 15:20:35 UTC,"The issue is that the problem doesn’t go away if the apartments aren’t there. I’m reminded of the halfway home here in River Park for young men who had served time in juvie. People didn’t want “delinquents” in the neighborhood so they protested the program. But those boys are already here. 

Do we want homeless people to live in our communities without this resource or with it? Those are the only two choices.",18,2020-09-19 16:44:29 UTC
Resources for Homeless?,19,https://www.reddit.com/r/SouthBend/comments/rxntv9/resources_for_homeless/,2022-01-06 20:15:29 UTC,Sending you a PM. I work with the homeless and can try and connect him to services.,12,2022-01-07 01:16:36 UTC
Resources for Homeless?,19,https://www.reddit.com/r/SouthBend/comments/rxntv9/resources_for_homeless/,2022-01-06 20:15:29 UTC,We have a vibrant homeless district south of downtown.  Well-funded,-14,2022-01-07 04:16:46 UTC
"Homeless Camp Near Downtown South Bend Asked To Disperse, Results In Protest",28,https://www.reddit.com/r/SouthBend/comments/gr9r5u/homeless_camp_near_downtown_south_bend_asked_to/,2020-05-27 01:04:38 UTC,"This opinion might be unpopular - but that type of homeless camp is the last thing the homeless need in SB right now. I've driven by many times, and there is always music blasting and young people (who arguably don't look homeless, given their attire, but I won't make that assumption) lined up to receive food from whoever is handing it out at the time, with pushing and shoving, etc.  It honestly reminds me more of a party than a lifeline, and is just asking for trouble.

Then again, the squeaky wheels get the oil, so it could be that most of the people there have stayed quiet and to their own, while only a few are making it the loud dangerous mess it currently seems to be...",11,2020-05-27 12:45:40 UTC
"Homeless Camp Near Downtown South Bend Asked To Disperse, Results In Protest",28,https://www.reddit.com/r/SouthBend/comments/gr9r5u/homeless_camp_near_downtown_south_bend_asked_to/,2020-05-27 01:04:38 UTC,"I truly think these camps cause more harm than good for everyone involved and only exist because certain activists love to bring them dozens of tents, food, etc. I think their hearts are in the right place but honestly it does the homeless more harm than good, in my mind. 

Not that I have any answers, mind you. I just don't think this is ever one of them. I know when the camp was set up and supported by activists under the bridge. I talked to one of homeless individuals and he said it was just a few people at first and was okay. But then they brought in sleeping bags and tents and drug dealers just camped out all day then dealing. If you concentrate dozens of homeless people in one area that is not an official shelter with monitors etc. all the ills homeless people are subject to are multiplied.",11,2020-05-27 12:55:09 UTC
