Submission Title,Submission Score,Submission URL,Submission Timestamp,Comment,Comment Score,Comment Timestamp
"My good friend, a Homeless mother of 2 young kids is on streets. Anyone know of any resources she could use to help?",4,https://www.reddit.com/r/SouthBend/comments/89novv/my_good_friend_a_homeless_mother_of_2_young_kids/,2018-04-04 08:30:52 UTC,I volunteered at Center for the Homeless if she hasn't been there yet! Good facilities and resources for adults and children. ,2,2018-04-04 14:34:30 UTC
The homeless under the bridge,7,https://www.reddit.com/r/SouthBend/comments/53h17w/the_homeless_under_the_bridge/,2016-09-19 11:11:18 UTC,The community under the bridge is one of the more prominent and vibrant features of South Bend's Homeless District.  You should not look at our local spate of indigence as a problem... it is a great opportunity for volunteerism and self-promotion!  ,1,2016-09-19 16:16:40 UTC
The homeless under the bridge,7,https://www.reddit.com/r/SouthBend/comments/53h17w/the_homeless_under_the_bridge/,2016-09-19 11:11:18 UTC,"You could invite them into your home, or perhaps offer them a well paying and not demeaning job - so they can live a better life.

Also giving them proper mental care free of charge would be a good start as well.

P.S. Don't go to San Fran, not sure you could handle it. Like 15k homeless vs like 4 in South Bend.",-7,2016-09-19 13:30:47 UTC
The homeless under the bridge,7,https://www.reddit.com/r/SouthBend/comments/53h17w/the_homeless_under_the_bridge/,2016-09-19 11:11:18 UTC,"Definitely more than four homeless in South Bend, but yeah, we dont have it nearly as bad as other cities. Out West, where they dont have to contend with brutal winters, there are full encampments and they are everywhere. ",4,2016-09-19 13:39:00 UTC
The homeless under the bridge,7,https://www.reddit.com/r/SouthBend/comments/53h17w/the_homeless_under_the_bridge/,2016-09-19 11:11:18 UTC,"> Many are homeless by choice.....

I don't think you understand mental health disorders very well. This sounds like a very Republican thing to say.

> This day and age most individuals fall under some sort of mental health disorder....

This is true. Doesn't mean you should lack compassion or treatment for those with disorders. 

> The real question is why shit where you sleep

1) Lack of public bathrooms. Which public location near the underpass lets homeless in to use the facilities?

2) Mental health disorders. When the world is a blur and you are hearing voices in your head, where you drop a loaf is not that important.

",0,2016-09-19 14:12:26 UTC
The homeless under the bridge,7,https://www.reddit.com/r/SouthBend/comments/53h17w/the_homeless_under_the_bridge/,2016-09-19 11:11:18 UTC,"Make proper mental health care free of charge for the homeless and watch the claims of homelessness rise like the Bolivar's inflation.

Sweet summer socialists.",2,2016-09-19 23:30:42 UTC
City of South Bend Clearing Homeless Encampment from Under Bridges,6,https://www.reddit.com/r/SouthBend/comments/796klq/city_of_south_bend_clearing_homeless_encampment/,2017-10-27 22:36:06 UTC,Stop all giving of anything to panhandlers. ,1,2017-10-29 20:55:08 UTC
South Bend businesses claim negative impact from growing number of homeless,6,https://www.reddit.com/r/SouthBend/comments/5eat84/south_bend_businesses_claim_negative_impact_from/,2016-11-22 13:54:24 UTC,How could 30-40 years of massive funding for several different homeless initiatives focusing on facilities in a well-defined section of town have anything but positive results?,3,2016-11-24 16:14:19 UTC
South Bend businesses claim negative impact from growing number of homeless,6,https://www.reddit.com/r/SouthBend/comments/5eat84/south_bend_businesses_claim_negative_impact_from/,2016-11-22 13:54:24 UTC,Between the homeless strip mall and the streets bass ackwards I really have not seen 2016 go well for south bend. At least with one way streets I wouldn't be stuck downtown long enough to have to stare at the line of tents during rush hour traffic. Now with the 2 way streets and the traffic moving at a slow crawl I want nothing to do with the area. ,2,2016-11-25 07:48:50 UTC
Questions for the NIMBYs concerning Motels 4 Now,72,https://www.reddit.com/r/SouthBend/comments/1agw6k8/questions_for_the_nimbys_concerning_motels_4_now/,2024-02-02 05:23:52 UTC,"It’s SOP for this area (and maybe the world), wait until the last minute and then scream NO. In this case, not “here”.

Full disclosure - I dont live near either location. 

I honestly dont care where they put it. There’s more than three acres available a quarter mile from where I live they could use. But I’m not on the bus route and neither is that land. If there was a bus route into Granger, I’d suggest putting it there.

I lived on Ewing for two decades. Had plenty of homeless stop by when I was working in the yard asking for handouts or offering to work for money. I was usually happy to oblige and quick to suggest moving along to those who appeared to be up to no good. Found plenty of junkies asleep in the alley. Well, better there then at a school. 

No matter where this place ends up, someone will not be happy. I get it. My neighbors would be pissed if it ended up near us. Whatever. However, if the city is using data and not emotions, to make the decision, I’m good with it. The citizens will bring emotions, and typically, no solutions to counter it. SSDD",24,2024-02-02 11:42:46 UTC
Questions for the NIMBYs concerning Motels 4 Now,72,https://www.reddit.com/r/SouthBend/comments/1agw6k8/questions_for_the_nimbys_concerning_motels_4_now/,2024-02-02 05:23:52 UTC,"I’ve lived downtown for five years and see homeless people sleeping in my parking lot on benches, setting up tents by the river and sleeping, just trying to be comfortable somewhere. I think it is ridiculous to act like providing homeless people housing would somehow increase crime when we know that evidence shows providing stable living environments brings DOWN crime. I would much rather live next door to a housing facility for the homeless than continue to see people sleeping on the bare ground. The same people who complain about the amount of homeless people are the same ones who complain whenever the city does anything to try to assist them. It’s ridiculous. we shouldn’t listen to these people because they will complain no matter what because at the end of the day, they just like to look down on others",16,2024-02-02 15:40:45 UTC
Questions for the NIMBYs concerning Motels 4 Now,72,https://www.reddit.com/r/SouthBend/comments/1agw6k8/questions_for_the_nimbys_concerning_motels_4_now/,2024-02-02 05:23:52 UTC,"So, I've changed a lot on this one over time. I spent many years as an advocate working against chronic homelessness, have participated on some of the city's workgroups on homelessness, etc, but I don't think the city, nor this take are being entirely generous.

1 - yes, housing first is scientifically the most effective model for caring for the homeless. It's math, not feelings. It works.2 - but... housing first doesn't give free license to do housing first poorly. there are ways to do zero barrier in ways that are more harmful and less harmful.3 - less harmful = scattered site. less harmful = day shelter programming and a more controlled check in/check out process. more harmful = large complexes. more harmful (to the community) = no day programming, free roaming, full freedom, full visitation (allows for drug dealers)4 - Motels4Now has been good for the homeless, but harmful for many near it. It just has. Businesses have closed, people feel less safe, and it decreases the dignity and pride of the people near it (who - as those on the NW side - have already dealt with a lot of disinvestment). I'm not sure it's fair to help some people by harming some others, especially when it's just due to not being willing to produce the funding to do it in a way that is even more helpful and less harmful.I think at this point my preference would be something outside of city limits, on the edge of town where there's still zero restrictions on sobriety, but still a more programmatic or controlled environment. And let's pay for a shuttle that can connect people to the bus line. Surely a small shuttle bus and a full-time driver is within financial reason, given the total project will cost millions anyway.

I'm not saying my idea is the best one. But we at least have to have some compassion for the real expressed needs of neighbors and business owners without painting them out to be petty or greedy.  


edit: we obviously also need to do it without stigmatizing or making false claims about the character of our unhoused neighbors.",12,2024-02-02 14:52:22 UTC
Questions for the NIMBYs concerning Motels 4 Now,72,https://www.reddit.com/r/SouthBend/comments/1agw6k8/questions_for_the_nimbys_concerning_motels_4_now/,2024-02-02 05:23:52 UTC,"The meeting was cut short because Derrick the Dick Dieter or however you spell his name filled the audience early so when supports showed they were over max capacity. Then he called the fire marshal to try and get it shut down. 

I was at a neighborhood meeting once for M4N where a woman was talking mad shit about the place. I think the lady who was presenting was the boss or what not and she recognized the woman’s last name. She asked if she was related to so and so and the woman replied with a yes. Turns out her nephew was homeless and staying there. 

These NIMBYS are talking about taking away housing from their own families, the ones they’re trying to “protect”. 

People who oppose the idea now will forever. There is no changing their mind unless it is actively effecting them.",4,2024-02-02 17:14:34 UTC
Questions for the NIMBYs concerning Motels 4 Now,72,https://www.reddit.com/r/SouthBend/comments/1agw6k8/questions_for_the_nimbys_concerning_motels_4_now/,2024-02-02 05:23:52 UTC,https://abc57.com/news/public-meeting-about-homeless-intake-center-evacuated-hundreds-in-attendance,4,2024-02-02 07:33:20 UTC
Questions for the NIMBYs concerning Motels 4 Now,72,https://www.reddit.com/r/SouthBend/comments/1agw6k8/questions_for_the_nimbys_concerning_motels_4_now/,2024-02-02 05:23:52 UTC,https://www.wndu.com/2024/02/02/city-meeting-new-homeless-intake-center-cut-short-due-overcapacity/,3,2024-02-02 06:57:09 UTC
Questions for the NIMBYs concerning Motels 4 Now,72,https://www.reddit.com/r/SouthBend/comments/1agw6k8/questions_for_the_nimbys_concerning_motels_4_now/,2024-02-02 05:23:52 UTC,">It’s SOP for this area (and maybe the world), wait until the last minute and then scream NO. In this case, not “here”.  
>  
>Full disclosure - I dont live near either location.  
>  
>I honestly dont care where they put it. There’s more than three acres available a quarter mile from where I live they could use. But I’m not on the bus route and neither is that land. If there was a bus route into Granger, I’d suggest putting it there.  
>  
>I lived on Ewing for two decades. Had plenty of homeless stop by when I was working in the yard asking for handouts or offering to work for money. I was usually happy to oblige and quick to suggest moving along to those who appeared to be up to no good. Found plenty of junkies asleep in the alley. Well, better there then at a school.  
>  
>No matter where this place ends up, someone will not be happy. I get it. My neighbors would be pissed if it ended up near us. Whatever. However, if the city is using data and not emotions, to make the decision, I’m good with it. The citizens will bring emotions, and typically, no solutions to counter it. SSDD

To be fair it is standard procedure for the groups trying to create homeless facilities to wait until the last minute to reveal their plans. 

See the Hope Avenue Homes (PSH) in Edison Park. South Bend Heritage and the city very clearly hid their intent especially through the process of acquiring the land, because if its already zoned properly, then they don't need an iota of public input. They held a meeting and told the neighborhood to screw off which I don't think is the right way to go about it, but its the easiest route. 

I really place the blame on the city because the opposition is always going to be more fiery when the first time they are made aware of a project the city is basically 5 months from construction. Im very for this project, but come on......the city didn't let anyone know until planning was 80% complete and the school corp didnt know they couldn't secretly sell the land without advertising it.....really?",6,2024-02-02 14:09:16 UTC
Questions for the NIMBYs concerning Motels 4 Now,72,https://www.reddit.com/r/SouthBend/comments/1agw6k8/questions_for_the_nimbys_concerning_motels_4_now/,2024-02-02 05:23:52 UTC,"Thanks for your thoughtful response. 

I'm curious how large complexes are more harmful? And I also thought m4n doesn't allow visitors or drugs. Maybe a safe injection site is also needed so people aren't shooting up in people's yards. I think it was a little misguided that the director of m4n said homelessness was done for with m4n running. 

To the point of something outside the city, good luck getting the county to agree to that. Commisioner Deiter and Amy Drake hate homeless people to the point of calling them garbage. The county commissioners don't want to fund anything that isn't already a running program or a giant corporation trying to move in. Deiter didn't even pay attention to the meeting, just got the fire department to shut things down(there were clearly too many people, but that was an observation I had). Honestly if m4n stops getting funded by the county I'm all down for camping in Deiter's years till he changes his mind.",5,2024-02-02 15:06:03 UTC
Questions for the NIMBYs concerning Motels 4 Now,72,https://www.reddit.com/r/SouthBend/comments/1agw6k8/questions_for_the_nimbys_concerning_motels_4_now/,2024-02-02 05:23:52 UTC,"I can see homeless people walking up bendix to the growing kids center. Yeah it’s closish but there’s almost nothing but industrial up that way. Unless you know, these folks get a job near there.",5,2024-02-02 10:09:46 UTC
Questions for the NIMBYs concerning Motels 4 Now,72,https://www.reddit.com/r/SouthBend/comments/1agw6k8/questions_for_the_nimbys_concerning_motels_4_now/,2024-02-02 05:23:52 UTC,"Large complexes are more harmful in that you are putting a lot of people with high levels of challenges in close proximity to each other. It's much better for the people with challenges & the broader community to do scattered site housing where people with high needs can be surrounded by others with some levels of stability to contribute to them and where the high needs of others aren't constantly triggering their personal challenges. It is also less stigmatizing.

Obviously, scattered site still faces NIMBY opposition and is more expensive. I believe the city previously made an attempt at that and was shot down.

re: m4n, I've been more out of the loop for a bit now, but I think you're probably right re: on site -- but the issue is (as anyone who has ever protested anything knows) the sidewalk out in front is likely public property. And I do know from past work, the least of the issue is the actual residents of our homeless centers and the bigger issue is the people who come to prey on them. Unfortunately, anywhere you place a complex like this becomes a giant beacon to attract bad actors to come try to prey on the people there.

re: county gov't. I agree completely. They are a mess and make anything difficult.",8,2024-02-02 15:41:47 UTC
Questions for the NIMBYs concerning Motels 4 Now,72,https://www.reddit.com/r/SouthBend/comments/1agw6k8/questions_for_the_nimbys_concerning_motels_4_now/,2024-02-02 05:23:52 UTC,"former M4N employee chiming in 👋 Guests are allowed visitors during limited hours with a guest pass signed at least a day in advance, and ID presented upon arrival, a limited number of times per week per guest (2x last I was aware). Intoxication alone is not grounds for program dismissal, but drug dealing and violent conduct are. Treatment is encouraged and facilitated, with guests generally pursuing their paths to recovery at their own pace with the support of staff & Oaklawn Recovery Coaches onsite.

I do think that anything regarding helping the unhoused faces a massive uphill battle for public image, and the general public finds low-barrier housing first approaches even more distasteful despite all evidence of its efficacy. obviously this leads shelter administrators to speak in oversimplified platitudes to beef up their pitch, but her line about ~functionally ending homelessness~ drives me up a wall every time I hear it, and I have heard it dozens of times. I feel like it also discredits those arguing in favor of the program, because those opposed can so easily say, “well I saw a homeless person last Tuesday, so you must be full of crap!”
it’s just so validating to hear someone else mention that damn talking point.

I wish that public discussion had room for the nuance and complexity of all the entangled issues at play here. some of the worries are rooted in legitimate concerns, but the opposition gets too riled up and the narrative gets too polarized to facilitate a fruitful, good faith community discussion.

FWIW, through my personal experience, I would say the biggest contributing factor to concerns over a lack of safety/drug dealing/guests etc. would overwhelmingly be put in check with the construction of a purpose-built facility where those coming and going could be kept track of easily. a three building motel campus is extremely hard to supervise. IMO this is one of the best points in favor of the intake center’s construction, but to even discuss it would require acknowledging where the current program falls short, and no one is willing to do that because it will be gobbled up and twisted by people like Dieter, Drake, and French and fed right into the script for the riled up NIMBY’s 🫠",6,2024-02-03 01:00:12 UTC
Willow Wetherall and Downtown Train at Union Station Technology Center,14,https://www.reddit.com/r/SouthBend/comments/154uk3y/willow_wetherall_and_downtown_train_at_union/,2023-07-20 15:45:30 UTC,Right  next to the homeless  incampment would be a great  place,-1,2023-07-21 13:37:59 UTC
Christmas Volunteering,7,https://www.reddit.com/r/SouthBend/comments/1hgdpan/christmas_volunteering/,2024-12-17 15:56:49 UTC,Check with the Food Bank of Northern Indiana and the Center for the Homeless. They do Christmas dinners as I recall.,3,2024-12-18 04:46:43 UTC
Christmas Volunteering,7,https://www.reddit.com/r/SouthBend/comments/1hgdpan/christmas_volunteering/,2024-12-17 15:56:49 UTC,"Driving downtown this morning, I see that the First United Methodist Church on Main has a soup kitchen on Christmas day. They might need volunteers.",3,2024-12-18 19:51:28 UTC
Didn’t know this was even an issue,10,https://www.reddit.com/r/SouthBend/comments/188ls1t/didnt_know_this_was_even_an_issue/,2023-12-01 20:37:34 UTC,Or the homeless tbh,2,2023-12-02 20:09:38 UTC
What are your thoughts on what to do with the County-City Building?,8,https://www.reddit.com/r/SouthBend/comments/1bkr1wu/what_are_your_thoughts_on_what_to_do_with_the/,2024-03-22 04:37:27 UTC,Turn it into a homeless shelter.,1,2024-03-25 16:21:03 UTC
Taking South Shore train soon,8,https://www.reddit.com/r/SouthBend/comments/1d1z72j/taking_south_shore_train_soon/,2024-05-27 19:04:43 UTC,Ignore the homeless they will ask for money and get real shitty if you don't give them anything,0,2024-05-28 18:51:05 UTC
What animal does the following?,15,https://www.reddit.com/r/SouthBend/comments/13n8cpl/what_animal_does_the_following/,2023-05-20 20:47:55 UTC,Homeless people??,-2,2023-05-20 22:24:05 UTC
shelters to donate clothes??,7,https://www.reddit.com/r/SouthBend/comments/18h7eit/shelters_to_donate_clothes/,2023-12-13 03:27:41 UTC,"The homeless shelter, hope ministries, there are a number of them.",3,2023-12-13 12:01:52 UTC
shelters to donate clothes??,7,https://www.reddit.com/r/SouthBend/comments/18h7eit/shelters_to_donate_clothes/,2023-12-13 03:27:41 UTC,You can also check with Broadway Christian. They do a lot of support services for the homeless.,2,2023-12-13 14:56:03 UTC
shelters to donate clothes??,7,https://www.reddit.com/r/SouthBend/comments/18h7eit/shelters_to_donate_clothes/,2023-12-13 03:27:41 UTC,"I’ve found a lot of foster children’s charities accept and appreciate new, like new and very gently worn clothing. The main homeless shelter in town also serves families with children. Groups donate new winter items for kids, but someone told me they also accept children’s clothing. They probably do not have a ton of room for storage so maybe it depends on who they are serving at that time and I know they only want stuff for the current season (summer clothes in summer/winter clothes in winter). I’d give them a call!",1,2024-08-19 16:32:51 UTC
What’s up with suitcases outside dt Burger King?,41,https://www.reddit.com/r/SouthBend/comments/pe4xpb/whats_up_with_suitcases_outside_dt_burger_king/,2021-08-29 22:09:58 UTC,It belongs to an older homeless woman that walks around in a little league baseball helmet. When I worked at Walmart she would come in often.,19,2021-08-29 23:43:30 UTC
What’s up with suitcases outside dt Burger King?,41,https://www.reddit.com/r/SouthBend/comments/pe4xpb/whats_up_with_suitcases_outside_dt_burger_king/,2021-08-29 22:09:58 UTC,I have always assumed a homeless person has used that spot for storage and it’s just become an accepted staple. Seems like a risky spot to put all yours things but I guess it’s worked this long. No idea though.,13,2021-08-29 23:21:37 UTC
What’s up with suitcases outside dt Burger King?,41,https://www.reddit.com/r/SouthBend/comments/pe4xpb/whats_up_with_suitcases_outside_dt_burger_king/,2021-08-29 22:09:58 UTC,"i've seen her moving things around with a cart (as recently as this morning, as she crossed the crosswalk dangerously this morning) . i just figured she was homeless and not in the right state of mind.",3,2021-08-30 12:47:13 UTC
Anyone know what’s going on on the south side of downtown?,8,https://www.reddit.com/r/SouthBend/comments/11bxyek/anyone_know_whats_going_on_on_the_south_side_of/,2023-02-25 22:38:30 UTC,"Maybe a homeless person was trying to get warm, happened a lot at the old Niles Inn. Before it was demolished.",1,2023-02-26 15:48:45 UTC
Where do I move to?,5,https://www.reddit.com/r/SouthBend/comments/jau7g6/where_do_i_move_to/,2020-10-14 04:52:10 UTC,"I lived downtown for 2 years at The Point and besides the random homeless person acting up I never saw anything sketchy.  I used to walk to the burger king down the road on the ""sketchy side"" of downtown and never felt threatened.  The Midwest is a really boring place and South Bend has changed a lot in the recent years.  I think people are just trying to keep themselves entertained by making up stories about how bad it is around here.",1,2020-10-15 20:58:39 UTC
Where do I move to?,5,https://www.reddit.com/r/SouthBend/comments/jau7g6/where_do_i_move_to/,2020-10-14 04:52:10 UTC,"Yes in order to get to those walkable places from Irish hills you have to walk on the shoulder of a very busy road - ireland - where there is no sidewalk or any other type of pedestrian friendly infrastructure. Then when you get to the corner of ireland/ironwood you're greeted with a suburban style CVS and cross the busy street and you get a gas station! And then you get to a few restaurants in a suburban style strip mall. 

Just because things are physically close to a residence doesn't make it walkable or urban. Especially considering if you're on the northern side of irish hills it's a ten min walk just to get out of the complex. That not in any way city life. 

You act like the just seeing a homeless person does someone ill.",8,2020-10-14 23:19:35 UTC
Looks like the building above Cambodian Thai is out of commission.,12,https://www.reddit.com/r/SouthBend/comments/blt12s/looks_like_the_building_above_cambodian_thai_is/,2019-05-07 16:49:04 UTC,That place is a dump. I had to go in there for work and the owner would never lock the doors so homeless people would help themselves inside,9,2019-05-07 17:16:23 UTC
Looks like the building above Cambodian Thai is out of commission.,12,https://www.reddit.com/r/SouthBend/comments/blt12s/looks_like_the_building_above_cambodian_thai_is/,2019-05-07 16:49:04 UTC,"I had my photography studio on the 3rd floor 4 years ago and left after only 1 lease term. The elevator broke 5 times in 12 months, heat and AC were always wonky and homeless people snuck in to sleep in the basement. I had photographer friends on the 2nd floor they stayed till this notice was up. They had no heat, no water and people were still using the bathrooms! Those were also not cleaned. Absolutely horrible.",6,2019-05-07 17:20:34 UTC
