Submission Title,Submission Score,Submission URL,Submission Timestamp,Comment,Comment Score,Comment Timestamp
"BMV says it's moving from downtown South Bend because of fights, drugs, panhandlers",17,https://www.reddit.com/r/SouthBend/comments/9ir8tp/bmv_says_its_moving_from_downtown_south_bend/,2018-09-25 11:17:45 UTC,"In other words, aggressive people, drug users, and panhandlers win downtown!  Never mind soooo much money was spent ""modernizing"" downtown streets.",6,2018-09-25 13:40:55 UTC
"BMV says it's moving from downtown South Bend because of fights, drugs, panhandlers",17,https://www.reddit.com/r/SouthBend/comments/9ir8tp/bmv_says_its_moving_from_downtown_south_bend/,2018-09-25 11:17:45 UTC,"We wrapped up our time in South Bend when my father gave up on his business, but as early as 1998 the Center for the homeless had negatively transformed michiana.
I'd ask the guys questions, it seemed like an awful lot of them arrived on a Greyhound with a map to downtown, and instructions on how to hook up with cfh and Madison Center.
We're in Skokie now but Chicago is filled with under 25, spoiled, entitled junkies.",2,2018-09-29 14:46:49 UTC
"BMV says it's moving from downtown South Bend because of fights, drugs, panhandlers",17,https://www.reddit.com/r/SouthBend/comments/9ir8tp/bmv_says_its_moving_from_downtown_south_bend/,2018-09-25 11:17:45 UTC,"Took my girlfriend on a date to downtown south bend. Never again after being harassed by an aggressive panhandler on a bicycle that had a speech disability and had his sob story written on a piece of paper, in broad daylight.",4,2018-09-25 15:43:44 UTC
"BMV says it's moving from downtown South Bend because of fights, drugs, panhandlers",17,https://www.reddit.com/r/SouthBend/comments/9ir8tp/bmv_says_its_moving_from_downtown_south_bend/,2018-09-25 11:17:45 UTC,"Oh, I agree. I do not expect our bmv employees to deal with the panhandlers, as I wouldn't want my employees to have to deal with that. 

I just find it kind of alarming that the solution is to move, rather than deal with the problem via the police. ",2,2018-09-25 16:13:46 UTC
Panhandler Downtown,42,https://www.reddit.com/r/SouthBend/comments/a8vavj/panhandler_downtown/,2018-12-23 15:05:41 UTC,Are you implying that local police beat panhandlers with batons?  Because they don't .,-3,2018-12-23 17:44:54 UTC
SB Common Council approves measure to reduce panhandling,8,https://www.reddit.com/r/SouthBend/comments/apwggy/sb_common_council_approves_measure_to_reduce/,2019-02-12 18:26:46 UTC,"They approved a resolution....to have a discussion or look further into. This is the same stupid one that Oliver has been pushing for and that Buttigieg said he wouldn't provide money for a couple years ago. Oliver wants to offer homeless people $10.10 hour jobs to clean our parks, our city's current minimum wage. Panhandlers don't want $10.10 an hour.

Mayors Deputy Chief of Staff "" Fritzberg said she learned that service providers have collected data indicating that “a vast majority” of panhandlers are not homeless.""

"" Hope Ministries executive director David Vanderveen says he doesn't think the proposal would reduce panhandling much around South Bend. He says more attention should go toward helping people who are truly homeless. ""

Also Vanderveen "" “A good percentage of people who panhandle are not homeless, and therefore they probably do have transportation (to and from the street corners where they hold signs) and have a certain system regarding which street corners they go to,” Vanderveen said. """,4,2019-02-12 20:17:27 UTC
'Suckers' for panhandling? - WNDU story about the recent explosion of panhandling in our area.,16,https://www.reddit.com/r/SouthBend/comments/3b5dau/suckers_for_panhandling_wndu_story_about_the/,2015-06-26 02:41:30 UTC,"I live on the southside of downtown, around rum village (the ghetto) and there is definitely been an increase in beggars. I see them everywhere. Every street corner is swarming! What's the explanation behind this?! I don't see how people can get so lazy all of a sudden. When I was moving a refrigerator into my house I had one run up to me and ask if he could help, he did, very briefly, then he expected cash after! I'm 17 years old! What the fuck is going on! Has Mayor Buttigieg said anything about this? This is a serious problem!",4,2015-06-26 03:22:55 UTC
'Suckers' for panhandling? - WNDU story about the recent explosion of panhandling in our area.,16,https://www.reddit.com/r/SouthBend/comments/3b5dau/suckers_for_panhandling_wndu_story_about_the/,2015-06-26 02:41:30 UTC,"If the city did not want this, they would not have dedicated half of the downtown area to homeless shelters. This is what we get for narcissistically institutionalizing compassion, the flipside to self congratulatory circle-jerk galas.",-3,2015-06-27 02:07:43 UTC
'Suckers' for panhandling? - WNDU story about the recent explosion of panhandling in our area.,16,https://www.reddit.com/r/SouthBend/comments/3b5dau/suckers_for_panhandling_wndu_story_about_the/,2015-06-26 02:41:30 UTC,"I know the corner of  Angela and Michigan is one of the corners this guy apparently has people 'working.' The corner is always covered and it seems to rotate through a few of the same individuals, almost as if the are on shifts. I haven't heard much more than that, but I have heard the same thing from various people who work with homeless and/or addicts. I don't personally provide direct services or work with clients anymore so I haven't heard it myself but I trust those I have heard it from. Some were talking about trying to alert media or police to it but not sure that anyone has enough information to work with. ",3,2015-06-26 04:44:22 UTC
[South Bend] Proposed Bill/Program to Help Get Panhandlers Off the Corners,8,https://www.reddit.com/r/SouthBend/comments/6fmzdf/south_bend_proposed_billprogram_to_help_get/,2017-06-06 16:41:36 UTC,"Don't read the comments on WNDU. Quite a bit of thickheadedness and ignorance. I'm not sure it'll work here (I don't think most of the panhandlers are homeless, I think they are looking to supplement some sort of handout (e.g. disability) where if they got a W-2 job they'd lose that handout), but it's certainly an interesting idea that has apparently had success in Albuquerque. ",2,2017-06-06 16:45:03 UTC
[South Bend] Proposed Bill/Program to Help Get Panhandlers Off the Corners,8,https://www.reddit.com/r/SouthBend/comments/6fmzdf/south_bend_proposed_billprogram_to_help_get/,2017-06-06 16:41:36 UTC,"Not really a downside but it is a stupid idea in my opinion. 

- A panhandler makes more than $2 every 15 minutes standing still.

- Panhandlers, moreso homeless squatters are a huge polluters of our parks. I've personally relocated them and cleaned their piles of shit off the steps in front of buildings.

- I don't want them hanging out in our parks. I fully understand this is a shitty thing to say but I don't want to be told to feel sympathy for the homeless that don't utilize the shelter due to mental illness or drug addiction only to have them in our parks. 

- If there isn't already, the city can pass an ordinance to prevent it, plain and simple. If we can tell them they are not allowed to sleep under the viaduct (which we did), we can tell them they can't panhandle on the medians or sidewalks. If it gets challenged upstream so be it, at least we actually tried.",3,2017-06-06 20:46:28 UTC
[South Bend] Proposed Bill/Program to Help Get Panhandlers Off the Corners,8,https://www.reddit.com/r/SouthBend/comments/6fmzdf/south_bend_proposed_billprogram_to_help_get/,2017-06-06 16:41:36 UTC,"I agree with literally all of your points. I do think it is important to distinguish between the homeless and the panhandlers. We know they are not the same thing, and have different solutions. 

I personally do have a bit of sympathy (tiny, tiny amounts) for those who can't get assistance because of an addiction or other mental illness. Being cut off from help is just going to make them more desperate. Like it or not, they are here and will continue to be our problem. If they can't get help, they will be out there in perpetuity, which isn't good for any of us. 

As far as passing an ordinance, I'm all for enforcing existing legal ordinances and if anyone can come up with something legal that isn't already on the books, they absolutely should get it done. We should not be allowing them to create makeshift communities, especially at the expense of the health, safety, and cleanliness of our city. However, it is extremely foolish and short sided to suggest that we should do more and let it be challenged in the courts. Panhandlers and homeless are a known problem across the country, and it is pretty well established what you can and can not do. We absolutely need to be wary of inflicting legal penalties and costs upon us when that money could be used towards actually fixing the problem. 

So what works? What can we do that we aren't doing? Like you said, we need to be much more tough on enforcing actual existing rules. We need to be less tolerant of them outside of predetermined areas. On the more creative side of things, we need to focus on reducing homelessness and making it inconvenient for the panhandlers. I would love to see a campaign where actual, well dressed people go with nice bright collection buckets and work the corners. Occupy the space they are already utilizing, then use the proceeds to fund services that get those who need legitimate assistance help, and does it in a way that we we a community can control and supervise. I'd especially like to see stuff like this on Notre Dame weekends. Living near campus, the panhandlers are out in full force whenever out of towers are around. It's a huge image problem for us, and it does nothing but encourage them because they can rank in a lot of cash quickly. I also wouldn't be opposed to buying these people one way plane/train/bus tickets to any place a few hundred miles away. Make it a one time deal, and give them $50 if they accept. I'm sure some will find their way back, and others will take their place, but it keeps them moving. I'm sure that will be controversial, but sometimes you gotta do whatever you can. ",1,2017-06-06 23:42:54 UTC
South Bend mayor not backing jobs proposal for panhandlers,4,https://www.reddit.com/r/SouthBend/comments/6th94i/south_bend_mayor_not_backing_jobs_proposal_for/,2017-08-13 19:42:15 UTC,"Not a big surprise?

There is not a lack of low paying jobs here. The top needs of the panhandlers is usually mental care, which we as a society really suck at providing. Giving someone with a substance abuse problem or a mental disorder a trashbag and $10 an hour to pick up trash isn't going to do a lot.",8,2017-08-13 19:46:36 UTC
South Bend mayor not backing jobs proposal for panhandlers,4,https://www.reddit.com/r/SouthBend/comments/6th94i/south_bend_mayor_not_backing_jobs_proposal_for/,2017-08-13 19:42:15 UTC,"Good call Pete. Many, not all, of the panhandlers don't want a job. A great deal of them are former residents of the Dismas House in town. They are usually out there begging for money to pay for their addiction and put money in their dealers hand.

I believe a better option is to take any money that could have gone to this and continue to provide low cost housing for the truly homeless. Couple that with finding a way to get more mental health facilities in town would go a longer way than jobs for these people.",4,2017-08-14 01:30:05 UTC
South Bend mayor not backing jobs proposal for panhandlers,4,https://www.reddit.com/r/SouthBend/comments/6th94i/south_bend_mayor_not_backing_jobs_proposal_for/,2017-08-13 19:42:15 UTC,"Next, they can relocate the homeless district closer to their conspicuous benefactors",1,2017-08-18 16:31:01 UTC
Panhandlers now going door to door in South Bend,7,https://www.reddit.com/r/SouthBend/comments/3ob870/panhandlers_now_going_door_to_door_in_south_bend/,2015-10-11 08:15:28 UTC,"Not really a new thing. When I lived in that area about 4 years ago, we'd have panhandlers come to our door a few times a month.",4,2015-10-11 15:03:15 UTC
Winter coat donation? ,10,https://www.reddit.com/r/SouthBend/comments/1hf98v8/winter_coat_donation/,2024-12-16 02:41:27 UTC,Broadway Christian does a lot of work supporting the poor and houseless population. They would likely get it to someone who needs it.,3,2024-12-16 17:58:10 UTC
All of the hard work and money spent on Smart Streets is going down the drain,6,https://www.reddit.com/r/SouthBend/comments/6nbsgx/all_of_the_hard_work_and_money_spent_on_smart/,2017-07-14 20:48:27 UTC,"Just for shit's and giggles, I'll throw this out here. Recent trip to Nashville TN, figured it would be a homeless Mecca because the weather is primo. Instead noticed 0 homeless. Turns out Nashville puts them up in apartments as long as they're not on drugs/alcohol. Vets go to the front of the line I believe. Somehow it works, they even save money by doing it. Fuck if I know how",6,2017-07-14 21:53:08 UTC
All of the hard work and money spent on Smart Streets is going down the drain,6,https://www.reddit.com/r/SouthBend/comments/6nbsgx/all_of_the_hard_work_and_money_spent_on_smart/,2017-07-14 20:48:27 UTC,"There were homeless people doing the same  before smart streets.  There are lots of homeless people and drug-addicted vagrants in most cities.  I personally believe that our local culture of conspicuous compassion is a big draw for homeless people.  Not saying anything bad about the programs themselves, they do great things for people. Just saying that most solutions offered will only increase the problem in the long run, and a lot of people are helping for the wrong reason",4,2017-07-15 00:37:40 UTC
All of the hard work and money spent on Smart Streets is going down the drain,6,https://www.reddit.com/r/SouthBend/comments/6nbsgx/all_of_the_hard_work_and_money_spent_on_smart/,2017-07-14 20:48:27 UTC,"thats what salt lake did, housing first. http://www.npr.org/2015/12/10/459100751/utah-reduced-chronic-homelessness-by-91-percent-heres-how",8,2017-07-14 22:18:36 UTC
All of the hard work and money spent on Smart Streets is going down the drain,6,https://www.reddit.com/r/SouthBend/comments/6nbsgx/all_of_the_hard_work_and_money_spent_on_smart/,2017-07-14 20:48:27 UTC,"That is the approach currently being taken, however we have no housing currently. There is a 30 some unit to come online later this year. It's called housing first. 

But I agree. The panhandling has gotten a lot worse the last month. Something does need to be done short term and long term. I don't think we'll see much retail downtown until this is solved. 

I do believe that the panhandling and homelessness is possibly the last major hurdle for downtown. Friends and family that visit comment about it everytime to me. It's something we have to solve that other local communities don't. I think it's the last major blemish on downtown that can hopefully have a permanent solution. ",6,2017-07-15 01:01:00 UTC
All of the hard work and money spent on Smart Streets is going down the drain,6,https://www.reddit.com/r/SouthBend/comments/6nbsgx/all_of_the_hard_work_and_money_spent_on_smart/,2017-07-14 20:48:27 UTC,"My two issues are your hype and you act like it's new and growing.... We have had around the same population of homeless for several years...there was a surge around when the economy collapsed but that has tapered back off...


My other issue is with complaining with no solutions...



If you have no solutions maybe not bring it up every month...perhaps just once a quarter...(jokes)",3,2017-07-15 11:34:37 UTC
All of the hard work and money spent on Smart Streets is going down the drain,6,https://www.reddit.com/r/SouthBend/comments/6nbsgx/all_of_the_hard_work_and_money_spent_on_smart/,2017-07-14 20:48:27 UTC,"I experience the same comments with non-benders in my car. It's tough because we want South Bend to be better, and there's been large improvements. But there is still a LOT of work to be done. At this point, I feel as if the homeless issue is starting to hold back development and other progress in the city, mainly downtown. I can't stress enough how delicate and sensitive of an issue this is for SB. Agree or not, we are a liberal city, with quite a few Democrats in charge. The bread of butter of Democrats is poor relief. Is the current situation a result of the current (local) administration/leaders? I mean, this doesn't happen overnight and is really a product of issues that effect the entire US (is South Bend the only or select few with this problem? No). But here we are, with this issue in our laps. It doesn't matter so much as to how they got here. The real focus needs to be how to get them back onto their feet and self sufficient. There has been proven success with the housing first model. We don't have the capital to overnight the project and get results right away, so we are left in a holding pattern waiting for the first units to come online and gather data on how that works for us. 

I think this issue could actually be a fantastic opportunity for Notre Dame to step in. They have some of the brightest individuals there, that could use their resesrch expertise, and other knowledge to come with up with a collaborative approach with the City of South Bend to help tackle this problem the right way. I've always thought Notre Dame should be a little more involved with SB, and I don't see why this issue would be any different. ND benefits from a better SB. ",5,2017-07-15 01:40:18 UTC
All of the hard work and money spent on Smart Streets is going down the drain,6,https://www.reddit.com/r/SouthBend/comments/6nbsgx/all_of_the_hard_work_and_money_spent_on_smart/,2017-07-14 20:48:27 UTC,"Your opinions about my hype are irrelevant and this sub is for posting opinions -so, if you don't mind, I will choose to continue as often as I please.  Frankly, it is the comments I hear from visitors that inspire my posts and I can tell you with certainty that they are taking notice too of the good AND the bad.  

It's not the same in almost all ways.   Again, I'm downtown every single day and have been for several years.  I've lived here for 40 yrs.  Smart Streets has brought activity and energy unseen in that time.  The Cubs, 1st Friday's, The East Race and River Lights are really starting to gain traction.  

It's true that for the last 20 or so years there has been a relatively small presence of beggars and street people.  It has spiked greatly in the last year and IMHO poses a grave threat to the really exciting things that seem to be gaining traction.

",2,2017-07-15 12:08:05 UTC
All of the hard work and money spent on Smart Streets is going down the drain,6,https://www.reddit.com/r/SouthBend/comments/6nbsgx/all_of_the_hard_work_and_money_spent_on_smart/,2017-07-14 20:48:27 UTC,"There have been waves... I agree it is an issue...

In my youth central park was full of used needles and crusty porn mags..

Through community involvement and improvements made to the park and surrounding areas it is a great and successful area...


The dtsb ambassadors police and mayor have allowed this to go on for far too long....

As i have stated originally it is all the services we provide which draws the homeless all to here... And many of the services (food and medical) we still provide even if they do not meet the criteria for shelter(pass a drug/alcohol screening)

It is a problem that is exacerbated by being the crossroads of america
Stuff is cheap here...not just cost.of living but drugs also...which just fuels the fire


(many of the drug addicts are self medicating and so much of our mental health services have dried up)..


Is that the option then... Dry up services for those who are.not.trying to help themselves.... Those who do not meet the requirements....couple that with stepped up enforcement....

It is cold...and kind of heartless.... But it is a.solution.... 

Id always.rather.discuss.possible solutions then.whine over the same problem time and time again",4,2017-07-15 13:34:31 UTC
C'mon SB..what the hell are you thinking?,0,https://www.reddit.com/r/SouthBend/comments/6i2dia/cmon_sbwhat_the_hell_are_you_thinking/,2017-06-18 22:07:16 UTC,"What do you have against beggars, street people, and not so friendly looking outsiders?",4,2017-06-19 10:52:56 UTC
C'mon SB..what the hell are you thinking?,0,https://www.reddit.com/r/SouthBend/comments/6i2dia/cmon_sbwhat_the_hell_are_you_thinking/,2017-06-18 22:07:16 UTC,"I think I just got used to seeing homeless and pannhandlers. I didn't notice how many we had till I went to some surrounding towns and noticed that they didn't have any. So now I'm curious, why does southbend have so many homeless and street beggars? I go to mishawaka, elkhart, Michigan City and I don't see them on the street corners, but drive from note dame to Michigan and Ireland and you will see them at the major intersections. ",2,2017-06-19 10:47:21 UTC
C'mon SB..what the hell are you thinking?,0,https://www.reddit.com/r/SouthBend/comments/6i2dia/cmon_sbwhat_the_hell_are_you_thinking/,2017-06-18 22:07:16 UTC,"I am in the area every single night throughout game times.  It has gotten worse by the day.  If you like stepping over drunk bums, getting harassed by beggars and wondering if it's safe to walk through them with your family then more power to you.

Ever see someone that isn't somewhere for any other reason to be hanging out somewhere?  They aren't there to go to the game, spend money at the surrounding business's - why do you think they are there? Get real.  Ray Charles could pick them out and it doesn't require checking ID's.  

I made a suggestion in my post and that was if we are either unwilling or unable to clear them out then there ought to be a very visible security presence...even if it is just added DTSB people keeping an eye on things.  That's it...not trying to be a hard ass or pick a fight - just trying to ensure that what looks very promising doesn't fizzle out.

How often are you there?  Sounds like you've been there one time and really aren't up to speed on what is really happening.",-2,2017-06-19 00:11:24 UTC
C'mon SB..what the hell are you thinking?,0,https://www.reddit.com/r/SouthBend/comments/6i2dia/cmon_sbwhat_the_hell_are_you_thinking/,2017-06-18 22:07:16 UTC,Hope rescue and the homeless shelter,3,2017-06-19 11:01:23 UTC
C'mon SB..what the hell are you thinking?,0,https://www.reddit.com/r/SouthBend/comments/6i2dia/cmon_sbwhat_the_hell_are_you_thinking/,2017-06-18 22:07:16 UTC,"I see panhandlers in Mishawaka, specifically the northern part near the mall/shopping areas. I've also started seeing a couple by Cleveland/Ironwood, which according to Google Maps is technically the corner of Granger and SB County. But the reason St. Joseph county has so many is because SB serves as the main place for homeless services. If you are homeless and can only travel so far, SB is where you go because the shelters and stuff are here. 

I also see panhandlers in Elkhart, just not nearly as many. 

Edit: Also, if you break the county into 3 groups of people by income level (I'm generalizing here), SB is the poorest 1/3. Followed by Mishawaka and Granger/ Saint Joseph county being the richest 1/3. ",2,2017-06-19 13:01:03 UTC
C'mon SB..what the hell are you thinking?,0,https://www.reddit.com/r/SouthBend/comments/6i2dia/cmon_sbwhat_the_hell_are_you_thinking/,2017-06-18 22:07:16 UTC,"Calm down guy

No one said contradictory

Rather you over exaggerate


A real hype beast

Best week ever was meh compared to sb150 or even some past ethnic fests...

And as for the ""growing"" problem of bums in the streets....

We have had bum issues for several years and it is due in large part to all our services we offer to the homeless

",1,2017-06-19 17:33:22 UTC
SB Cops Murdered a 69 year old Homeless Man,0,https://www.reddit.com/r/SouthBend/comments/1df7oiy/sb_cops_murdered_a_69_year_old_homeless_man/,2024-06-13 19:38:52 UTC,We have a lot of resources for the homeless.  Maybe don’t threaten people with knives.,11,2024-06-13 19:54:56 UTC
SB Cops Murdered a 69 year old Homeless Man,0,https://www.reddit.com/r/SouthBend/comments/1df7oiy/sb_cops_murdered_a_69_year_old_homeless_man/,2024-06-13 19:38:52 UTC,"So many people in this thread mad about me calling SBPD murderers for killing a man who I knew even years ago as being so old and chronically homeless that he needed help getting around. I don't care if he had a gd chainsaw, you're telling me that SBPD doesn't have anyway to stop a 69 year old homeless dude having a mental breakdown without shooting him dead at 6:30 in the morning? Genuinely shameful.",2,2024-06-13 22:38:28 UTC
SB Cops Murdered a 69 year old Homeless Man,0,https://www.reddit.com/r/SouthBend/comments/1df7oiy/sb_cops_murdered_a_69_year_old_homeless_man/,2024-06-13 19:38:52 UTC,Damn so because we have resources that are proven by the state government to be useless in a city our size we should give cops a free pass to kill homeless 69 year olds if they threaten people?,2,2024-06-13 22:31:06 UTC
SB Cops Murdered a 69 year old Homeless Man,0,https://www.reddit.com/r/SouthBend/comments/1df7oiy/sb_cops_murdered_a_69_year_old_homeless_man/,2024-06-13 19:38:52 UTC,"The thing is, South Bend has been trying for years to build another facility to offer housing and services to the homeless, but each time a location is chosen people from that neighborhood get the latest plan scrapped.",3,2024-06-14 17:26:21 UTC
