city,article_title,article_date,article_source,city_source,paragraph_text,keywords_matched
fayetteville,STATE-BY-STATE News from across the USA,2016-02-16T00:00:00Z,USA Today,Northwest Arkansas Democrat-Gazette,"Iowa Iowa City City staff is nearing completion of a draft ordinance intended to shape future growth and create more affordable housing stock in the growing Riverfront Crossings District, the Iowa City Press-Citizen reported.",affordable housing
fayetteville,STATE-BY-STATE,2016-02-16T00:00:00Z,Dayton Daily News (Ohio),Northwest Arkansas Democrat-Gazette,"IOWA Iowa City City staff is nearing completion of a draft ordinance intended to shape future growth and create more affordable housing stock in the growing Riverfront Crossings District, the Iowa City Press-Citizen reported.",affordable housing
fayetteville,"Alan D. Schnitzer CEO of Travelers in top 11% of price performers of NYSE stocks in past week Tuesday August 16, 2022",2022-08-16T00:00:00Z,News Bites - People in Business,Northwest Arkansas Democrat-Gazette,"We re in the business of taking care of the communities were privileged to serve, and in that spirit, were proud to help New Yorkers in need through the Homeless Assistance Fund",homeless
fayetteville,STATE-BY-STATE,2016-10-26T00:00:00Z,Dayton Daily News (Ohio),Northwest Arkansas Democrat-Gazette,"DISTRICT OF COLUMBIA WUSATV reported that the Vida Thrive 5K Run and Walk at Hains Point drew more than 600 participants and raised 16,000 for the citys homeless.",homeless
