city,article_title,article_date,article_source,city_source,paragraph_text,keywords_matched,original_count,processed_count,was_shortened,used_sentence_method,segment_count,segment_index
fayetteville,STATE-BY-STATE News from across the USA,2016-02-16T00:00:00Z,USA Today,Northwest Arkansas Democrat-Gazette,"Iowa Iowa City City staff is nearing completion of a draft ordinance intended to shape future growth and create more affordable housing stock in the growing Riverfront Crossings District, the Iowa City Press-Citizen reported.",affordable housing,1,1,False,True,1,0
fayetteville,STATE-BY-STATE,2016-02-16T00:00:00Z,Dayton Daily News (Ohio),Northwest Arkansas Democrat-Gazette,"IOWA Iowa City City staff is nearing completion of a draft ordinance intended to shape future growth and create more affordable housing stock in the growing Riverfront Crossings District, the Iowa City Press-Citizen reported.",affordable housing,1,1,False,True,1,0
fayetteville,"Alan D. Schnitzer CEO of Travelers in top 11% of price performers of NYSE stocks in past week Tuesday August 16, 2022",2022-08-16T00:00:00Z,News Bites - People in Business,Northwest Arkansas Democrat-Gazette,"We re in the business of taking care of the communities were privileged to serve, and in that spirit, were proud to help New Yorkers in need through the Homeless Assistance Fund",homeless,1,1,False,True,1,0
fayetteville,STATE-BY-STATE,2016-10-26T00:00:00Z,Dayton Daily News (Ohio),Northwest Arkansas Democrat-Gazette,"DISTRICT OF COLUMBIA WUSATV reported that the Vida Thrive 5K Run and Walk at Hains Point drew more than 600 participants and raised 16,000 for the citys homeless.",homeless,1,1,False,True,1,0
fayetteville,Best of Arkansas 2021,2021-08-02T00:00:00Z,Newstex Blogs,KUAF,"Sen. Joyce Elliott is indeed the best Arkansan. The Van, which supported the dignity of our homeless population even through the pandemic by helping them secure essentials like clothes, food and toothpaste, deserves accolades and support. Discoverys reign as the best gay bar should not and has not been challenged.",homeless,102,3,True,True,1,0
fayetteville,NEWS OF THE WEIRD,2017-04-23T00:00:00Z,The San Diego Union-Tribune,KFSM,"A June 2016 police raid on David Jessens Fresno County farmhouse caused a 150,000 mess when sheriffs deputies and Clovis Police Department officers rescued it from a trespassing homeless man - with the massive destruction leading to Jessens lawsuit announced in March. The misdemeanant helped himself to an ice cream bar, some milk and half a tomato, but was otherwise unarmed however, by the time the police standoff ended, the crime scene included more than 50 cop cars, a SWAT team and backups, two helicopters, standby ambulances, a police robot, and a crisis negotiation team. Windows, walls and wrought-iron doors were destroyed tear gas and a flash bomb were employed. Jessen suspects that the farmhouses isolation enticed police to decide that it presented an excellent training opportunity.",homeless,4,4,False,True,1,0
fayetteville,New Year Honours,2022-12-31T00:00:00Z,The Daily Telegraph (London),KFSM,"Yorkshire and Humberside, for services to Law and Order Prof Peter Ghazal, Ser Cymru II Prof of Systems Medicine, Cardiff Univ, for services to Systems Immunology James Bradley Gilbert, lately Deputy Director, Scottish Government, for services to Housing Hadley Gill, Sen Officer, National Crime Agency, for services to Law Enforcement and to Diversity Ravinder Gill, Founder, College of Accountancy, for services to Higher Education Matthew Cardover Gordon, Ch Executive Officer, Spectra First, for services to Vulnerable Young People Helen Goulden, Ch Executive Officer, Young Foundation, for services to the Dev of Sustainable Communities Beverley Karen Gower-Jones, Founder and Ch Executive Officer, Carbon Limiting Technologies, for services to Net Zero Innovation Stephen Graham, Actor, for services to Drama Helen Grant, MP, MP for Maidstone and the Weald, for Political and Public Service James Joshua Gray, jt MD, Gray and Adams Holdings, for services to Industry and to the community in Fraserburgh Peter Gray, jt MD, Gray and Adams Holdings, for services to Industry and to the community in Fraserburgh Ian Richard Green, Ch Executive, Terrence Higgins Trust for services to Charity and to Public Health Dr Rosemary Christine Green Rosemary Loftus, lately Ch Medical Officer, Macmillan for services to People with Cancer Maruska Greenwood-Dalecki, lately Ch Executive Officer, LGBT Health and Wellbeing, for services to Equality Puneet Gupta, Co-Founder and Ch Executive Officer, PG Paper, for services to Business, to Charity and to the community in Scotland Jennifer Anne Hall, Director of Nursing and Clinical Delivery, Covid-19 Vaccination Programme, NHS England and NHS Improvement, for services to the NHS, particularly during Covid-19 Simon David Hankins, Head of Operations, Parliamentary Security Department, for services to Parliament Mark Richard Harbord, Director of Cyber Security, Parliamentary Digital Service, for services to Parliament Ian John Hares, lately Ch Executive Officer, UK Asset Resolution, for services to the Financial Services Sector David Michael Harewood, Actor and Broadcaster for services to Drama and to Charity Prof Ewen Munro Harrison, Prof of Surgery and Data Science, Univ of Edinburgh for services to the Covid-19 Response Wendy Elizabeth Haxell, Technical Official, UK Athletics, for services to Athletics and to the community in Hampshire Dr Ross Hemingway, Civilian Medical Practitioner, Commando Training Centre, RM for services to the RM James Patrick Hepburne Scott, Director, Forest Carbon, for services to Forestry and to the Environment in Scotland Rachel Hick, Deputy Head, Finance Team, Army HQ, MoD for services to Defence Susan Julie Higginson, Principal and Ch Executive, Wirral Met College, Birkenhead, Merseyside for services to FE Patricia Anne Higson Paddy Higson, Patron and lately Ch Executive Officer, Glasgow Media Access Centre GMAC Film, for services to the Film and Television Industry and to Diversity and Inclusion in Film and Television Andrew Hill, Ch Executive, Hill Partnerships, for services to Affordable Housing Diane Patricia Hill, Employment Tribunal Lay Panel Member, Midlands West for services to the Admin of Justice Dr Vivian Ivor Hinchcliffe, Chair and Managing Trustee, St Jude Foundation, for services to Children and Young People with Special Educational Needs Peter James Hines, Headteacher, Perryfields Primary Pupil Referral Unit, Worcester, for services to Education Catherine Elizabeth Hinwood, Lead for Domestic Abuse and Sexual Violence, NHS England and lately Deputy Director, Victim and Witness Policy, Policy and Strategy Group, Ministry of Justice for Public Service Geoffrey Mark Hodgson, DL, Chair, Blyth Harbour Commission, for services to the UK Ports Sector and to the Economy in NE England Paula Ann Holland, Deputy Director, Work and Health Decision Making, Dept for Work and Pensions for Public Service Alaric Guy Code Horridge, Ch Executive, Cadet Vocational Qualification Organisation, for services to FE Dr Richard Charles Horton, Editor-in-Chief, Lancet, for services to Health and Medical Journalism Karen Anne Howell, Ch Executive, Wirral Community Health and Care NHS Foundation Trust, for services to Healthcare Paula Jane Hudgell,",affordable housing,1,1,False,True,1,0
fayetteville,New Year Honours,2022-12-31T00:00:00Z,The Daily Telegraph (London),KFSM,"Economy and to the community in Wrexham Edward Fletcher Lynch, Co-Founder, RJC Dance for services to Dance Iain Aitken Mackinnon, lately Sec, Maritime Skills Alliance for services to the Maritime Sector Geraldine Stewart Maclaine, for services to the community in the London Borough of Redbridge, Gt London Lucy Wolcott Maguire, Founder, Ch Executive Offr and Programme Director, Nucleo for services to Children and Young People Dr Shaid Mahmood, Chair of Govs, Leeds City College Group, for services to FE in Leeds Edward Roger Mallinson, Chair and Boat Manager, Shamrock Trust, for services to Steam Boating Heritage and to the community in Cumbria Prof David Charles Mangham, Prof of Musculoskeletal Pathology, Univ of Manchester and Manchester Univ NHS Foundation Trust, for services to Forensic Science Jaspal Singh Mann, Director, Simply Shred and Recyclefor services to the Environment David Claude Ernest Mann, Co-chair, Freehold LGBT CIC for services to Inclusion in the Property Industry Yiannis Kyriacos Maos, Founder and Ch Executive Officer, Birmingham Tech CIC, for services to the Technology Sector Jennie Kristina Martin, DG, ITS-UK, for services to Transport Technology Paula Margaret Matthews, Farmer, for services to Sustainable Agric Elizabeth Annette Maytom, Project Manager, Norwood and Brixton Foodbank for services to the community in the London Borough of Lambeth, particularly during Covid-19 Helen Esther McAleavy, Pte Sec to the Ch Medical Officer, DoH and Social Care for Public Service Richard James George McAvoy, Armed Forces Champion, Dept for Work and Pensions for Public Service Peter McBride, for services to the Economy and to the community in Co Tyrone Mary McCourt, Campaigner for Helens Law and Support After Murder and Manslaughter Merseyside, for services to Families of the Victims of Unlawful Killing Katrina McDonnell, Founder, Homeless Period Belfast for services to Womens Health James Anderson McEwan, for services to the Scotch Whisky Industry and to the community in Islay Patrick Joseph McGurn, Ch Executive Officer, Lakeland Community Care, for services to the community in Co Fermanagh and Tyrone Prof Sonja Jayne McIlfatrick, Dean of the Ulster Doctoral College and Prof of Nursing and Palliative Care, Ulster Univ, for services to Higher Education and Public Health Penelope Lewis McKissock, for services to the community in Somerset Samuel McKnight, Founder, Hair by Sam McKnight for services to the Fashion and Beauty Industries Teresa Michelle McLaughlin, Student Engagement and Student Voice Lead, Trafford College Group, Trafford, Gt Manchester for services to Education Hugh McLean, for services to the community in Oban and Lorn, Scotland Margaret Alison McLennan, lately Deputy Leader, Brent Council, London Borough of Brent, for services to Digital Inclusion and to the community in Brent Bethany Jane Mead, for services to Assn Football Dr Joel Meyer, Co-Founder, Life Lines and Intensive Care Consultant, Guys and St Thomas NHS Foundation Trust, for services to the NHS during Covid-19 Sophie Clare Milliken, Founder and Ch Executive Officer, Moja Group, for services to Business and to Education Nicholas John Millington, Director, Safety Task Force Network Rail for services to the Railway and to the NHS during Covid-19 John Mills, Vice-Chair and Director of Operations, Vasculitis UK, for services to People with Rare Diseases Prof Eugene Michael Gerard Milne, lately Director of Public Health, Newcastle City Council, for services to Public Health and Wellbeing Syed Khaja Mohi Moinuddin, Customs Cooperation Agreements Lead, HM Revenue and Customs, for Public Service Aston Moore, National Coach, British Athletics for services to Athletics Simon Peter Couldrey Moring, Det Supt, Met Police Service for services to Health and Wellbeing Elizabeth Morley, for services to the community in Bolton and Bury, Gt Manchester Sheila Mary Morrison, lately Gov, Meadow Primary, Epsom, Surrey, for services to Education Dr Stephen Huang Mowle, Hon Treasurer, Royal College of General Practitioners and General Practitioner, Hetherington Grp Practice, London Borough of Lambeth, for services to Healthcare Bejay Mulenga, Founder, Supa Network, for services to",homeless,1,1,False,True,1,0
fayetteville,New Year Honours: Full list of UK recipients,2022-12-30T00:00:00Z,The Herald (Scotland) Online,KFSM,"Andrew Hill. Chief Executive, Hill Partnerships Limited. For services to Affordable Housing. Cambridge, Cambridgeshire",affordable housing,4,4,False,True,1,0
fayetteville,New Year Honours: Full list of UK recipients,2022-12-30T00:00:00Z,The Herald (Scotland) Online,KFSM,"Katrina McDonnell. Founder, Homeless Period Belfast. For services to Womens Health. Belfast, Belfast",homeless,4,4,False,True,1,0
fayetteville,King's Birthday Honours,2023-06-17T00:00:00Z,The Daily Telegraph (London),KFSM,"Voluntary Youth Organisations for services to Young People in Essex Emma Elizabeth Fry Emma Bristow, for services to Motor Sports and Women in Sport John Fyffe, for services to Education and to Young People in Scotland Pauline Marie Gamester, Founder, Connector Media Community Interest Co and Co-Founder and Director, Sewing Room for services to Social Enterprise and to the community in Lancashire Janice Rosanne Gault, Ch Executive, Northern Ireland Hotels Fed for services to Tourism and Hospitality Rosamund Jane Gentle, for voluntary service to Children with Special Needs and their Families in West Sussex Diana Judith Gerald, Ch Executive Officer, Book Trust for services to Reading and Childrens Literature Michael Frederick Gibbons, Comm Operations, St John Ambulance for Voluntary Service Mary Gillespie, People and Capability Team, HM Treasury for services to People with Disabilities Sarah Na-Lamle Godwin Lamptey, Founder, ShowerBox for services to Homeless People Dr Alice Karen Good, Founder, Sunflower Sisters for services to Ukrainian Refugees Mark Andrew Goodway, Founder and Ch Executive, Matthew Tree Project Charity for services to Charity and to Disadvantaged People Jon-Paul Graham, Head of City Operations, Gt London Authority for services to the State Funeral of Her Majesty Queen Elizabeth II William Gerald Gray, Chmn, Royal Highland and Agric Society of Scotland for services to Agric, to Charity and to the community in Scotland Sarah Greenhalgh Sarah Smith, Chair, Tobacco Factory Theatres for services to Theatre and to the community in Bristol and Cornwall Luke Peter Grenfell-Shaw, Cancer Activist and Cyclist, Founder, Bristol2Beijing for services to Charitable Fundraising for People with Cancer Colin James Griffiths, Campaigner, Maternity Services, Shrewsbury and Telford Hosp NHS Trust for services to Maternity Healthcare Jacqueline Amanda Griffiths, Sen Policy Adviser, Dept for Business and Trade for Public Service John Parry Griffiths, Coach, British Canoeing for services to Canoeing and Paddlesport Kayleigh Rhianon Griffiths, Campaigner, Maternity Services, Shrewsbury and Telford Hosp NHS Trust for services to Maternity Healthcare Rhiannon Mair Griffiths, Co-Founder and MD, Comics Youth for services to Young People Nigel Sylvester Guy, Director, Windrush Generations UK for services to the Windrush Generation Lynne Haines, Headteacher, Greenvale School, London Borough of Lewisham for services to Children and Young People with Special Educational Needs Lindsey Victoria Hall, Ch Executive Officer, Real Ideas Organisation for services to Social Enterprise and to the community in Cornwall and Plymouth Thomas Kingsley Hall, Welfare Support Officer, BLESMA for services to Veterans in Wales William Andrew Hall, MC, Head of Testing, Exercising and Activation Team, Cabinet Office for services to the State Funeral of Her Majesty Queen Elizabeth II Stephen Philip Hallam, lately MD, Ye Olde Pork Pie Shoppe, Melton Mowbray for services to the Baking Industry and to the community in Leicestershire and Lincolnshire Jenny Halpern Prince, Founder and Chair, Access Aspiration for services to Charity, to Young People and to Social Mobility Caroline Marie Hamilton, Ch Executive, Safety Assessment Fed for services to Business and to Eng Elaine Hammans, lately Head of Early Years, Southend City Council, Essex for services to Education Dr Stewart John Harding, lately Co-Founder, Parks Agency and Director, GreenSpace for services to Heritage and Park Conservation Jennifer Anne Hardy, Campaigner and Founder, Cancer Card for services to Cancer Support Andrea Harford, lately Work Coach Team Leader, Dept for Work and Pensions for services to People with Autism Robert Harper, Volunteer, Belfast Lough Sailability for services to Sailing for People with Disabilities in Northern Ireland Kathryn Ann Harper-Quinn, Headteacher, Hounslow Heath Infant and Nursery School, London Borough of Hounslow for services to Education Dr Victoria Louise Harrington, lately Asst Ch Officer, Essex Police for services to Policing Mary Rosaleen Harrison, Headteacher, St Francis Catholic Primary, Morley, Leeds for services to Education Tanya Olivia Harrod, Art Historian for services to the Crafts Emma",homeless,2,2,False,True,1,0
fayetteville,King's Birthday Honours,2023-06-17T00:00:00Z,The Daily Telegraph (London),KFSM,"Executive for services to Social Housing Petro Rewko, Board Chmn, Assn of Ukrainians in GB for services to the Ukrainian Community Dr Martin Richard Finch Reynolds, Volunteers Co-ordinator, MissionAssist Charity for services to Indigenous Languages Suzanne Jacqueline Richards, Campaigner, Smile for Joel for services to People Bereaved by Homicide Elizabeth Anne Rix, Ch Nurse, Portsmouth Hospitals Univ NHS Trust for services to Nursing Leadership Paul Anthony Roach, Town Manager, Windsor, Eton and Ascot and Deputy Chair, Ceremonial Events Planning Group, Royal Borough of Windsor and Maidenhead for services to the State Funeral of Her Majesty Queen Elizabeth II Sonia Heather Roberts, for services to the community in Shropshire Dr Claire Elisabeth Robinson, Consultant Radiographer in Forensic Imaging, Univ Hospitals of Leicester NHS Trust for services to Forensic Investigations Graham Robinson, Policy Manager, Scottish Government for services to Equality in Scotland Suzann Marie Robinson Suzann McLean, Ch Executive Offr and Artistic Director, Theatre Peckham for services to the Arts and to Marginalised Young People in London Lt-Col Rtd Paul Damian Rodgers, Staff Officer, HQ Infantry, MoD for services to the Army and to Veterans Ian Malcolm Rogers, Athletics Official for services to Athletics Helen Margaret Rooker Helen Hughes, lately Voluntary Ch Executive Officer, Ludlow Assembly Rooms for services to Charity, to the Arts and to the community in Ludlow, Shropshire Alison Ross, Operations and Culture Director, Auto Trader for services to the Digital and Technology Industry Erika Ann Rushton, Co-Founder, Kindred Liverpool City Region Community Interest Company for services to Civil Society and to Social Enterprise Alison Ryland, lately Head of Healthcare, HM Prisons Usk and Prescoed, Aneurin Bevan Univ Health Board for services to Prison Healthcare in Monmouthshire Narinder Singh Sagoo, for services to Charity Reverend Fiona Jean Sample, Founder and Ch Executive Officer, Oswin Project for services to the Rehabilitation of Offenders Bilal Bin Saqib, Co-Founder, One Million Meals for services to the NHS and to the community in Stanmore, London Borough of Harrow Prodaman Kumar Sarwal, lately Trustee, Chatham Historic Dockyard Trust and Chair, Master Ropemakersfor services to Heritage and to the Charitable Sector Jacqueline Ann Sawdon, Co-Founder, Exodus Project for services to Young People and to Charity in Barnsley, S Yorks Martin Harold Sawdon, Co-Founder, Exodus Project for services to Young People and to Charity in Barnsley, S Yorks Clare Elizabeth Scherer, Ch Executive Officer, Naval Childrens Charity for services to RN Families Kendra Amelia Schneller, Homeless and Inclusion Health Programme Lead, Queens Nursing Inst and Nurse Practitioner, Guys and St Thomas NHS Foundation Trust for services to Homeless and Inclusion Health Nursing Susannah Ruth Schofield, for services to Journalism and to Diversity in the Broadcasting Industry Joe Scotland, Director, Studio Voltaire for services to Art Jane Elizabeth Scott, Div Bereavement Project Lead Midwife, West Hertfordshire Teaching Hospitals NHS Trust, and Lead and Founder, National Bereavement Midwives Forum for services to Bereaved Parents Sophie Elizabeth Scowen, Major Ceremonials Manager, Gt London Authority for services to the State Funeral of Her Majesty Queen Elizabeth II Richard Anthony Selby, DL, MD Pro Steel Eng and National Chair, Inst of Directors for services to the Economy and to Charity in Wales John Alexander Charles Sennett, Police Staff, Met Police Service for services to Policing Dr Farrukh Tasnim Shah, Consultant Haematologist, Whittington Health NHS Trust for services to Thalassaemia and Sickle Cell Patients Sarah Isobel Sharpe, lately Support Staff Member, National Assembly for Wales for Political and Public Service Catherine Annette Shaw, Lead Advanced Nurse Practitioner, NHS Highland for services to Nursing in Rural Scotland Dr Natalie Susannah Shenker, Co-Founder, Human Milk Foundation for services to Charity and to Human Milk Banking Fallon Suzanne Michelle Sherrock, for services to Darts Mercy Lusungu Shibemba, Speaker and Campaigner for services to People with HIV Colin Shields, for services to Ice Hockey Samuel Shouksmith, Team Leader, MoD for services to Defence David Arthur Shreeve, Co-Founder and Director, Conservation Foundation and Environmental Adviser, Archbishops Council, Church of England for services to the Environment Andrew Paul Simpson, Head of Digital Comms, Dept for Culture, Media and Sport for services to Government Comms James Simpson, for services to Wheelchair Rugby League Michelle Gabriel Anita Simpson, Project Co-ordinator, St Columbs Park House for services to Young People in Northern Ireland Dr Inderjit Singh, for voluntary and charitable services to the community in Scotland Harvinder Singh Rai, Sergeant, West Midlands Police for services to Policing and to the Sikh Community Rosalind Margaret Slinger, Chair, Centre Membership Committee, Pony Club for services to Equestrianism and to Charity David Mark Smith, lately Ch Executive, Energy Networks",homeless,2,2,False,True,1,0
