city,article_date,article_source,city_source,keywords_matched,original_count,processed_count,was_shortened,used_sentence_method,segment_count,segment_index,Deidentified_article_title,Deidentified_paragraph_text
rockford,2019-12-30T00:00:00Z,Associated Press State & Local,Rockford Register Star,homeless,1,1,False,True,1,0,[PERSON]: Recent editorials in [ORGANIZATION] newspapers,Thumbs up to initiative to improve coordinated service for the homeless
rockford,2019-12-30T00:00:00Z,Associated Press State & Local,Rockford Register Star,"homeless, homelessness",3,3,False,True,1,0,[PERSON]: Recent editorials in [ORGANIZATION] newspapers,"Thumbs up to the leadership of the city of [ORGANIZATION], [ORGANIZATION] and ORG1 for their initiative to secure improved service coordination for the homeless. The group announced plans to hire a coordinator by [ORGANIZATION]. Though this action does not eliminate homelessness, this one step - creating a centralized point of contact - has the potential for much improved outcomes."
rockford,2019-12-30T00:00:00Z,Associated Press State & Local,Rockford Register Star,homeless,4,4,False,True,1,0,[PERSON]: Recent editorials in [ORGANIZATION] newspapers,"Since DATE0, the [ORGANIZATION] agency for ORG1 ORG2 has required areas to establish local continuums of care, that is, agencies providing services to homeless should collaborate to assure coordination of services. Locally, representatives of some 20 agencies come together through board and task force meetings to improve coordination, all the while, working full time at their respective agencies. ORG3, then, serves as the primary ORG2 designated body designated to develop, coordinate and implement long-range plans meeting the needs of homeless persons. These leaders began to imagine the value of a full-time, paid coordinator who will improve the communication between and among these member agencies, who finds and applies for grants to further their collective work, and who will identify overlaps and gaps in these services to strengthen the safety net."
rockford,2019-12-30T00:00:00Z,Associated Press State & Local,Rockford Register Star,homelessness,5,5,False,True,1,0,[PERSON]: Recent editorials in [ORGANIZATION] newspapers,"Like waves on a beach and over [ORGANIZATION], homelessness has come to our attention and then receded. Events of [LOCATION] and fall, though, have prompted a deeper commitment to addressing this challenge in a permanent, thoughtful, and systemic fashion. Listening to what service providers said they needed, staff of [ORGANIZATION] identified this initiative and secured the generous support of ORG1 and PERSON0 Family Funs and ORG2. PERSON1, ORG3 president and CEO, sees the person in this position making sustainable system-level improvements by better coordinating our system of care and bringing additional resources. Mayor [PERSON] noted that the city is proud to enhance this partnership in order to provide greater efficiencies to all our efforts to end homelessness in our community."
rockford,2019-12-30T00:00:00Z,Associated Press State & Local,Rockford Register Star,homelessness,1,1,False,True,1,0,[PERSON]: Recent editorials in [ORGANIZATION] newspapers,We applaud this important first step to assure the long-term resolution of homelessness.
rockford,2017-06-23T00:00:00Z,Dayton Daily News (Ohio),Rockford Register Star,homeless,2,2,False,True,1,0,STATE-BY-STATE,"[PERSON] [ORGANIZATION] count finds 4,025 homeless people living in [ORGANIZATION]. [ORGANIZATION] says thats a decline from the last point-in-time count of the homeless, but its not a significant reduction."
rockford,2015-06-10T00:00:00Z,Associated Press Online,Rockford Register Star,homeless,1,1,False,True,1,0,"[ORGANIZATION] staff wins awards for [ORGANIZATION], ORG2 coverage","-Honorable mention [ORGANIZATION], based in [ORGANIZATION], [PERSON], for Leaving the Jungle, the journey of a homeless woman as she reluctantly moves from one of the poorest areas of [ORGANIZATION] to her own apartment."
rockford,2019-12-23T00:00:00Z,Associated Press State & Local,Rockford Register Star,homeless,3,3,False,True,1,0,[PERSON]: Recent editorials in [ORGANIZATION] newspapers,"Several generations of American children have grown up absorbing the shows message of kindness and acceptance. They have met a Muppet named [PERSON] who was homeless, a Muppet named [PERSON] who was blind, and a Muppet named [PERSON] who had autism. They have met Muppets and human beings of all colors and abilities - and disabilities."
rockford,2016-05-09T00:00:00Z,PR Newswire,WIFR,"homeless, homelessness",1,1,False,True,1,0,PERSON0 Honored With Unprecedented Number Of Major Awards And Recognitions,"[ORGANIZATION] ORG1, [ORGANIZATION], GPE1,was recently awarded the [ORGANIZATION] Area Homeless Coalition Outstanding Volunteer of the Year Award for bringing awareness to the community of the dramatic increase in homelessness."
