city,article_date,article_source,city_source,keywords_matched,original_count,processed_count,was_shortened,used_sentence_method,segment_count,segment_index,Deidentified_article_title,Deidentified_paragraph_text
buffalo,2017-09-07T00:00:00Z,States News Service,WNY,affordable housing,2,2,False,True,1,0,GOVERNOR PERSON0 ANNOUNCES $11.4 MILLION FOR SUPPORTIVE HOUSING IN GPE0 AND [PERSON],"From [ORGANIZATION] to [PERSON], we are building new affordable and supportive housing to give the most vulnerable New Yorkers a [STREET] to call home, Governor [PERSON] said. These three projects will help to revitalize the neighborhoods where they are located, offering clean, safe and affordable housing and supporting the transformation and growth of the communities."
buffalo,2017-09-07T00:00:00Z,States News Service,WNY,homeless,2,2,False,True,1,0,GOVERNOR PERSON0 ANNOUNCES $11.4 MILLION FOR SUPPORTIVE HOUSING IN GPE0 AND [PERSON],"Supportive housing plays an important role in overcoming a variety of conditions that could have contributed to individuals becoming homeless by providing easy access to services that will help them remain stably housed. Services provided at these three developments will include case management, mental health care, education, substance abuse treatment and vocational support, among others."
buffalo,2017-09-07T00:00:00Z,States News Service,WNY,homeless,1,1,False,True,1,0,GOVERNOR PERSON0 ANNOUNCES $11.4 MILLION FOR SUPPORTIVE HOUSING IN GPE0 AND [PERSON],"[ORGANIZATION], [ORGANIZATION] - 5.5 million - This funding will be used for the new construction of an eight-story building that, when combined with other funding sources, will create 71 units of permanent housing, including 42 units of supportive housing for formerly homeless individuals."
buffalo,2017-09-07T00:00:00Z,States News Service,WNY,homeless,2,2,False,True,1,0,GOVERNOR PERSON0 ANNOUNCES $11.4 MILLION FOR SUPPORTIVE HOUSING IN GPE0 AND [PERSON],"[ORGANIZATION], [ORGANIZATION] - 1.3 million - This funding will be used to rehabilitate a building the organization currently operates as low-income and homeless veterans housing. Together with other funding sources, this award will preserve 41 units, including 15 units of supportive housing for homeless veterans."
buffalo,2017-09-07T00:00:00Z,States News Service,WNY,homeless,1,1,False,True,1,0,GOVERNOR PERSON0 ANNOUNCES $11.4 MILLION FOR SUPPORTIVE HOUSING IN GPE0 AND [PERSON],"[ORGANIZATION], [ORGANIZATION] - 4.7 million - This funding will be used to substantially rehabilitate a vacant building and create 23 units of permanent supportive housing for homeless individuals in long-term recovery from substance abuse disorders."
buffalo,2017-09-07T00:00:00Z,States News Service,WNY,"homeless, homelessness, affordable housing",2,2,False,True,1,0,GOVERNOR PERSON0 ANNOUNCES $11.4 MILLION FOR SUPPORTIVE HOUSING IN GPE0 AND [PERSON],"These projects are part of Governor PERSON0 20 billion Homelessness and [ORGANIZATION], which includes 10 billion dedicated to creating and preserving 100,000 units of affordable housing and 10 billion devoted to tackling homelessness by developing 6,000 new, permanent supportive housing units. [ORGANIZATION] is a key part of the [PERSON] plan."
buffalo,2017-09-07T00:00:00Z,States News Service,WNY,homelessness,2,2,False,True,1,0,GOVERNOR PERSON0 ANNOUNCES $11.4 MILLION FOR SUPPORTIVE HOUSING IN GPE0 AND [PERSON],"[ORGANIZATION] Commissioner [PERSON] said, Everyone deserves to have a roof over their head and these projects will provide that and so much more for some of our most vulnerable New Yorkers. We are committed to doing all we can to help carry out the Governors comprehensive plan to address homelessness in [ORGANIZATION]."
buffalo,2017-09-07T00:00:00Z,States News Service,WNY,homeless,2,2,False,True,1,0,GOVERNOR PERSON0 ANNOUNCES $11.4 MILLION FOR SUPPORTIVE HOUSING IN GPE0 AND [PERSON],"[ORGANIZATION] Commissioner Dr. [PERSON] said, The awards provided through [ORGANIZATION] will help ORG2 build 44 housing units for formerly homeless individuals living with mental illness. We at ORG3 are proud to work with our colleagues at [LOCATION], helping to give our most vulnerable neighbors an opportunity to live, and thrive, in their community."
buffalo,2017-09-07T00:00:00Z,States News Service,WNY,homelessness,3,3,False,True,1,0,GOVERNOR PERSON0 ANNOUNCES $11.4 MILLION FOR SUPPORTIVE HOUSING IN GPE0 AND [PERSON],"[ORGANIZATION] State [ORGANIZATION] Commissioner [PERSON] said, Initiatives like ORG1 are so important to breaking the cycle of homelessness. Access to stable housing and quality services will give these individuals the resources they need to achieve independence while simultaneously investing in stronger and more economically vibrant neighborhoods. With this 11.4 million in funding, the Governor has once again shown his commitment to improving the lives of [ORGANIZATION]ers who need our help most."
buffalo,2017-09-07T00:00:00Z,States News Service,WNY,housing crisis,4,4,False,True,1,0,GOVERNOR PERSON0 ANNOUNCES $11.4 MILLION FOR SUPPORTIVE HOUSING IN GPE0 AND [PERSON],"Senator [PERSON] said, Tackling our housing crisis requires concerted action across government. Thats why I welcome Governor [PERSON] announcement [ORGANIZATION] of 11.4 million in state funding of supportive housing, including a 5.5 million investment here in [ORGANIZATION]. We need to seek out opportunities to deliver assistance to the most vulnerable communities across [ORGANIZATION], and across our [PERSON], attempting to overcome this housing crisis. This investment represents an additional, important step in that direction."
buffalo,2017-09-07T00:00:00Z,States News Service,WNY,homelessness,3,3,False,True,1,0,GOVERNOR PERSON0 ANNOUNCES $11.4 MILLION FOR SUPPORTIVE HOUSING IN GPE0 AND [PERSON],"[PERSON] said, Supportive housing strengthens our communities and provides a beacon of hope for those who are facing homelessness and trying to get back on their feet. This important investment from [ORGANIZATION] will improve the lives of New Yorkers from [PERSON] to GPE2. I am proud to have worked with my colleagues in the legislature and the Governor to make this funding a reality."
buffalo,2017-09-07T00:00:00Z,States News Service,WNY,"homeless, homelessness",3,3,False,True,1,0,GOVERNOR PERSON0 ANNOUNCES $11.4 MILLION FOR SUPPORTIVE HOUSING IN GPE0 AND [PERSON],"Mayor [PERSON] said, This is wonderful news for [ORGANIZATION] and [ORGANIZATION], which both work tirelessly to eliminate homelessness in [ORGANIZATION]. I thank Governor [PERSON] and ORG2. This 6 million will allow these agencies to preserve 41 housing units and create 23 new units of housing for our veterans and individuals in long-term recovery from substance abuse disorders."
buffalo,2017-09-07T00:00:00Z,US States News,WNY,"homeless, homelessness",4,4,False,True,1,0,[ORGANIZATION]. PERSON0 ANNOUNCES $11.4M FOR SUPPORTIVE HOUSING IN GPE0 AND [PERSON],"Mayor [PERSON] said, This is wonderful news for [ORGANIZATION] and [ORGANIZATION], which both work tirelessly to eliminate homelessness in [ORGANIZATION]. I thank Governor [PERSON] and ORG2. This 6 million will allow these agencies to preserve 41 housing units and create 23 new units of housing for our veterans and individuals in long-term recovery from substance abuse disorders. For any query with respect to this article or any other content requirement, please contact Editor at [URL]"
buffalo,2022-11-29T00:00:00Z,Contify Energy News,WNY,homelessness,3,3,False,True,1,0,"[ORGANIZATION] more than $110,000 in [LOCATION] to Community Nonprofits","The board of directors of [ORGANIZATION], the charitable giving arm of [PERSON], recently held its DATE0 meeting and approved [PERSON] grants totaling 110,325. According to [ORGANIZATION], [PERSON] President and President and CEO of ORG2, our [PERSON] is proud to announce its ongoing commitment to initiatives that uphold community health and vitality across the ORG2 service territory. Our recent grant recipients comprise organizations that focus on food insecurity, homelessness and human services, provide education and youth programs, and preserve and enhance state parks, [PERSON] said."
buffalo,2022-11-29T00:00:00Z,Contify Energy News,WNY,homelessness,2,2,False,True,1,0,"[ORGANIZATION] more than $110,000 in [LOCATION] to Community Nonprofits","According to [ORGANIZATION], [ORGANIZATION] President and President and CEO of [ORGANIZATION], our [ORGANIZATION] is proud to announce its ongoing commitment to initiatives that uphold community health and vitality across the [ORGANIZATION] service territory. Our recent grant recipients comprise organizations that focus on food insecurity, homelessness and human services, provide education and youth programs, and preserve and enhance state parks, [PERSON] said."
buffalo,2022-11-29T00:00:00Z,Contify Energy News,WNY,homeless,1,1,False,True,1,0,"[ORGANIZATION] more than $110,000 in [LOCATION] to Community Nonprofits",Hearts for the Homeless
buffalo,2022-11-29T00:00:00Z,Contify Energy News,WNY,homeless,3,3,False,True,1,0,"[ORGANIZATION] more than $110,000 in [LOCATION] to Community Nonprofits","[ORGANIZATION] employees will participate in various volunteer events in [ORGANIZATION] including preparing and serving meals with [ORGANIZATION], helping the ORG2 of WNY to decorate their facility, assembling care packages for [PERSON], making holiday cards for [LOCATION], and for [ORGANIZATION] sponsoring the [ORGANIZATION] adopt-a-family program. In [ORGANIZATION], food drives have been held across the entire service territory. Employees also are participating in a virtual holiday gift collection benefiting families via ORG6 and assembling meal boxes at ORG7."
buffalo,2016-09-30T00:00:00Z,States News Service,WNY,affordable housing,5,5,False,True,1,0,"[ORGANIZATION], [PERSON] AND ORG2 ANNOUNCE DEDICATION OF BELLAMY COMMONS - PART OF BETTER BUFFALO FUND INITIATIVE","30 Apartments of Affordable Housing for Low-Income Families, [PERSON] [ORGANIZATION] [ORGANIZATION], [PERSON] agencies and partners dedicated FAC0, the completion of conversion of a [ORGANIZATION] former warehouse at 1490 FAC1 from a vacant [INSTITUTION] to a 30 apartment development for low-income families. The restored building on [ORGANIZATION]s East Side, which received funding through the Governor [PERSON] [ORGANIZATION] Fund initiative, will also house the [ORGANIZATION], dedicated to recognizing and celebrating the achievements of many of [ORGANIZATION]s prominent African Americans. There are 20 one-bedroom and 10 two-bedroom apartments, including five for persons with mobility issues and hearing or vision impairments. The building has an elevator, community room with kitchen, separate bulk storage units, laundry facilities, onsite parking and a playground. The commercial space also includes the local office of the ORG1."
buffalo,2016-09-30T00:00:00Z,States News Service,WNY,"homelessness, affordable housing",37,3,True,True,3,0,"[ORGANIZATION], [PERSON] AND ORG2 ANNOUNCE DEDICATION OF BELLAMY COMMONS - PART OF BETTER BUFFALO FUND INITIATIVE","[ORGANIZATION] Commissioner [PERSON] said, A once vacant eyesore has become FAC0 where 30 families can live in dignity and have vital access to essential neighborhood amenities. From here on [ORGANIZATION] of [ORGANIZATION] to [PERSON], to GPE2 and all the [STREET] north and all the [STREET] south, [ORGANIZATION] and our partners are hard at work making Governor [PERSON] aggressive 20 billion agenda combat homelessness and expand access to affordable housing a reality. Since DATE0 in [LOCATION], [ORGANIZATION] has invested 119 million to create and preserve more than 1,630 affordable homes and apartments."
buffalo,2016-09-30T00:00:00Z,States News Service,WNY,"homelessness, affordable housing",37,6,True,True,3,1,"[ORGANIZATION], [PERSON] AND ORG2 ANNOUNCE DEDICATION OF BELLAMY COMMONS - PART OF BETTER BUFFALO FUND INITIATIVE","Mr. [PERSON] said This building was a vital piece of this community in its prime. To be able to be a part of its rebirth and see this historic [ORGANIZATION] which my father started move from warehouse to [INSTITUTION] to become this incredible mix of high-quality affordable housing and commercial space has been exciting. PERSON1, President of [ORGANIZATION] said [PERSON] new opportunities for affordable housing for the residents of [ORGANIZATION] is something that we take great pride in. We are grateful to Governor [PERSON] and his team for their commitment to [PERSON] Commons. They recognize that affordable housing strengthens families and builds strong communities which are key elements of ORG2 revitalization. This is our third new housing project completed on [ORGANIZATION] in [ORGANIZATION]."
buffalo,2016-09-30T00:00:00Z,States News Service,WNY,"homelessness, affordable housing",37,17,True,True,3,2,"[ORGANIZATION], [PERSON] AND ORG2 ANNOUNCE DEDICATION OF BELLAMY COMMONS - PART OF BETTER BUFFALO FUND INITIATIVE","This is a transformative development and I congratulate all who made FAC0 a reality, advancing yet another impressive investment in [LOCATION] historic east side. Mayor [PERSON] said The opening of [PERSON]s FAC0 continues the transformation taking [STREET] in [ORGANIZATION] by bringing new affordable housing and FAC2 dedicated to telling local African-American success stories to the neighborhood, said Mayor [PERSON]. Im proud that the City contributed 800,000 from a variety of funding sources to this project. 1490 [PERSON] was once an important center of activity in the community and to see it brought back to life will make an enormous difference. I thank all of our partners, including Governor [PERSON], Congressman [PERSON], [ORGANIZATION] Member PERSON3 and [ORGANIZATION] Senator [PERSON], for their commitment to this important project that complements the successes on [PERSON] and surrounding [PERSON] neighborhoods. Senator [PERSON] said As we continue to invest in affordable housing along our transportation corridors, so too are we investing in the connectivity and opportunities available in our great city. Together, were breathing new life into these communities and restoring them into the vibrant neighborhoods our residents deserve. Thank you to Governor [PERSON], [PERSON] and [ORGANIZATION] for their continued commitment to affordable housing and transformative, long-term growth across [ORGANIZATION]. [ORGANIZATION] said FAC0 is an adaptive reuse win-win for its tenants and the surrounding community as it includes 30 units of affordable rental housing, a museum, and the local offices of the [ORGANIZATION]. These energy-efficient apartments are another example of the states commitment to affordable housing in [ORGANIZATION] and along [PERSON]. I applaud Governor [PERSON], [PERSON] and my colleagues in government in making [ORGANIZATION] a reality. About [ORGANIZATION] ORG6 includes ORG7, [ORGANIZATION], ORG9, [PERSON]0, [PERSON]1 and others. DATE1 marks DATE2 of Governor [PERSON]s 1 billion statewide [PERSON]2 program, whose goal is to create or preserve 14,300 affordable units by [ORGANIZATION]. In [DATE], [PERSON]3 set a record for financing the creation or preservation of more than 11,000 affordable homes and apartments and was the 1 bond issuer in the nation with 2.5 billion issued. The agency stands ready to make good on the [PERSON] new 10 billion 100,000 unit [PERSON]2 2020 commitment. For more information on [PERSON]3 programs and initiatives, please visit [PERSON]4 Founded in DATE5, [PERSON]5 is the largest advocate for affordable housing and is dedicated to expanding affordable housing opportunities in [PERSON]. [URL]"
buffalo,2024-11-26T00:00:00Z,Contify Energy News,WNY,homelessness,1,1,False,True,1,0,[ORGANIZATION] [PERSON],"[ORGANIZATION] employees volunteer at nonprofit organizations and participate in holiday collection drives benefiting veterans, families in need, and individuals experiencing homelessness."
buffalo,2024-11-26T00:00:00Z,Contify Energy News,WNY,homelessness,12,6,True,True,1,0,[ORGANIZATION] [PERSON],"[ORGANIZATION] [DATE] provides funding to the following food banks ORG1 Harvest ORG2 of [ORGANIZATION]Central [LOCATION] ORG2Mercer County ORG2The [ORGANIZATION] regularly supports disaster and emergency service nonprofits, including ORG6 chapters across [ORGANIZATION] and [ORGANIZATION]. In addition, [ORGANIZATION] continues its longtime support for ORG7, the critical [PERSON] and GPE2, GPE3, emergency cold-weather safety plan that provides transportation, shelter and warm meals to individuals experiencing homelessness from [ORGANIZATION] through March 15.[ORGANIZATION] and [ORGANIZATION] are prone to severe [PERSON] weather, weather-related disasters and other emergencies. Partnerships with our ORG6 chapters and ORG7 are essential as they help numerous people experiencing crisis or hardship access much needed support services, [ORGANIZATION] said. Additionally, [ORGANIZATION] employees regularly volunteer at many of these nonprofit organizations as well as for other agencies across the [ORGANIZATION] footprint. In addition, employees participate in DATE2 collection drives that benefit veterans, families in need of assistance and individuals experiencing homelessness. To learn more about the [ORGANIZATION] and its giving process, visit [URL]"
buffalo,2020-07-09T00:00:00Z,Business Wire,WNY,"homeless, soup kitchen",2,2,False,True,1,0,[ORGANIZATION] Donates $1.3 Million to Nonprofits in [ORGANIZATION] is part of [ORGANIZATION]'s $12.3 million in ORG1 grants focused on expanding access to care and addressing the social determinants of health for people in underserved communities,"[ORGANIZATION] , [ORGANIZATION] - 400,000 to contribute to the organizations role as part of a multi-agency initiative to build a comprehensive system of care for [ORGANIZATION]s homeless and indigent populations. The funds will support the hiring of licensed clinicians and peer specialists to be placed on-site at emergency shelters, soup kitchens and other locations that provide social services to the community."
buffalo,2019-03-20T00:00:00Z,"Congressional Documents and Publications (Federal Information & News Dispatch, Inc.)",WNY,homelessness,1,1,False,True,1,0,[ORGANIZATION] and [PERSON] NEARLY $13.75 MILLION IN FEDERAL GRANTS TO FIGHT HOMELESSNESS IN WESTERN GPE0 Rep. [PERSON] (D- GPE1 ) News Release,Congressman [ORGANIZATION] NY-26 announced that [ORGANIZATION] [PERSON] of [ORGANIZATION] has awarded almost 13.75 million in federal funding to [ORGANIZATION] organizations to assist in their mission to end homelessness in the region.
buffalo,2019-03-20T00:00:00Z,"Congressional Documents and Publications (Federal Information & News Dispatch, Inc.)",WNY,"homeless, homelessness",2,2,False,True,1,0,[ORGANIZATION] and [PERSON] NEARLY $13.75 MILLION IN FEDERAL GRANTS TO FIGHT HOMELESSNESS IN WESTERN GPE0 Rep. [PERSON] (D- GPE1 ) News Release,"Congressman [PERSON] said These federal grants that our local agencies have won through [ORGANIZATION] will be instrumental in expanding critical services and continuing to fight homelessness in [ORGANIZATION]. We are fortunate to have, in [ORGANIZATION], a coordinated effort led by able local agencies and government partners committed to not only home placement but a real focus on addressing the challenges that leave people without a home."
buffalo,2019-03-20T00:00:00Z,"Congressional Documents and Publications (Federal Information & News Dispatch, Inc.)",WNY,homelessness,3,3,False,True,1,0,[ORGANIZATION] and [PERSON] NEARLY $13.75 MILLION IN FEDERAL GRANTS TO FIGHT HOMELESSNESS IN WESTERN GPE0 Rep. [PERSON] (D- GPE1 ) News Release,"[ORGANIZATION] Executive PERSON0 added, [PERSON] grant funding provides a lifeline to individuals struggling with homelessness, mental illness and substance abuse by helping these people get the supports they need to reconnect to the community, get rehoused and work towards overcoming the obstacles in their lives. The [ORGANIZATION] Department of Mental Health has applied for and received this funding DATE0 for [LOCATION], and with partner agencies continues to address the issue with compassion and commitment. I thank Commissioner [PERSON] and his team, along with Congressman [PERSON], for working to better the lives of our residents."
buffalo,2019-03-20T00:00:00Z,"Congressional Documents and Publications (Federal Information & News Dispatch, Inc.)",WNY,"homeless, homelessness",4,4,False,True,1,0,[ORGANIZATION] and [PERSON] NEARLY $13.75 MILLION IN FEDERAL GRANTS TO FIGHT HOMELESSNESS IN WESTERN GPE0 Rep. [PERSON] (D- GPE1 ) News Release,"Created in [ORGANIZATION] as [ORGANIZATION], ORG1 manages grant programs for many [ORGANIZATION] organizations that provide homelessness assistance. ORG2 separated from the government and adopted its current name in [LOCATION]. Its since merged with other nearby [ORGANIZATION] programs and is presently the [ORGANIZATION] lead for [ORGANIZATION], [PERSON], [ORGANIZATION], [PERSON], [PERSON], [PERSON] and GPE6 Counties. DATE2 funding exceeds the [ORGANIZATION] [ORGANIZATION] program funding for those counties by over 80,000."
buffalo,2019-03-20T00:00:00Z,"Congressional Documents and Publications (Federal Information & News Dispatch, Inc.)",WNY,"homeless, homelessness",5,5,False,True,1,0,[ORGANIZATION] and [PERSON] NEARLY $13.75 MILLION IN FEDERAL GRANTS TO FIGHT HOMELESSNESS IN WESTERN GPE0 Rep. [PERSON] (D- GPE1 ) News Release,"Executive Director of [ORGANIZATION] said I would like to thank Congressman [PERSON] for his continued commitment to helping provide the 12.2 million of [ORGANIZATION] funds for [ORGANIZATION], [PERSON], [ORGANIZATION], [PERSON] and GPE4 Counties. These funds are the single largest funding source for the provision of homeless services in our area. I would also like to thank [ORGANIZATION] for the countys continued commitment in providing front line services to those experiencing homelessness. The [ORGANIZATION] County Dept. of [ORGANIZATION] receives almost half of these funds to assist those with the most severe needs. Additionally, [PERSON] is a key partner and often times, first stop for those without a home."
buffalo,2019-03-20T00:00:00Z,"Congressional Documents and Publications (Federal Information & News Dispatch, Inc.)",WNY,homelessness,3,3,False,True,1,0,[ORGANIZATION] and [PERSON] NEARLY $13.75 MILLION IN FEDERAL GRANTS TO FIGHT HOMELESSNESS IN WESTERN GPE0 Rep. [PERSON] (D- GPE1 ) News Release,"[PERSON] is honored to accept this award of 5.4 million, said ORG1 Commissioner [PERSON]. Through the good work of the county, we have consistently been awarded these ORG2 dollars for [ORGANIZATION]. We continue to work diligently with our community partners to reduce chronic homelessness for individuals in our community with disabling conditions, said Commissioner of [ORGANIZATION], [PERSON]."
buffalo,2019-03-20T00:00:00Z,"Congressional Documents and Publications (Federal Information & News Dispatch, Inc.)",WNY,"homeless, homelessness",2,2,False,True,1,0,[ORGANIZATION] and [PERSON] NEARLY $13.75 MILLION IN FEDERAL GRANTS TO FIGHT HOMELESSNESS IN WESTERN GPE0 Rep. [PERSON] (D- GPE1 ) News Release,"In addition to the [ORGANIZATION] grant funding awarded by [ORGANIZATION], the [ORGANIZATION] has also made several Emergency Solutions Grants Program [ORGANIZATION] awards to [ORGANIZATION] municipalities. [ORGANIZATION] program funds go to providing emergency shelters for homeless individuals and families and the operation of those shelters, as well as essential services for shelter residents and homelessness prevention programs."
buffalo,2019-03-20T00:00:00Z,"Congressional Documents and Publications (Federal Information & News Dispatch, Inc.)",WNY,homeless,1,1,False,True,1,0,[ORGANIZATION] and [PERSON] NEARLY $13.75 MILLION IN FEDERAL GRANTS TO FIGHT HOMELESSNESS IN WESTERN GPE0 Rep. [PERSON] (D- GPE1 ) News Release,"Spectrum Chronic Homeless 550,136"
buffalo,2019-03-20T00:00:00Z,"Congressional Documents and Publications (Federal Information & News Dispatch, Inc.)",WNY,homeless,1,1,False,True,1,0,[ORGANIZATION] and [PERSON] NEARLY $13.75 MILLION IN FEDERAL GRANTS TO FIGHT HOMELESSNESS IN WESTERN GPE0 Rep. [PERSON] (D- GPE1 ) News Release,"[ORGANIZATION] 210,255"
buffalo,2019-03-20T00:00:00Z,"Congressional Documents and Publications (Federal Information & News Dispatch, Inc.)",WNY,homeless,1,1,False,True,1,0,[ORGANIZATION] and [PERSON] NEARLY $13.75 MILLION IN FEDERAL GRANTS TO FIGHT HOMELESSNESS IN WESTERN GPE0 Rep. [PERSON] (D- GPE1 ) News Release,"[ORGANIZATION] 499,873"
buffalo,2019-03-20T00:00:00Z,"Congressional Documents and Publications (Federal Information & News Dispatch, Inc.)",WNY,"homeless, homelessness",2,2,False,True,1,0,[ORGANIZATION] and [PERSON] NEARLY $13.75 MILLION IN FEDERAL GRANTS TO FIGHT HOMELESSNESS IN WESTERN GPE0 Rep. [PERSON] (D- GPE1 ) News Release,"According to [ORGANIZATION] of [ORGANIZATION] in [ORGANIZATION] report, 957 people in the five [ORGANIZATION] counties faced homelessness in [ORGANIZATION]. ORG0 [ORGANIZATION] Homeless Assessment Report to ORG1 found an estimated 553,000 people in [PERSON], including 164,023 individuals in families with children and 36,361 unaccompanied youth, experienced homelessness on any given night in GPE2."
buffalo,2019-03-20T00:00:00Z,"Congressional Documents and Publications (Federal Information & News Dispatch, Inc.)",WNY,homeless,2,2,False,True,1,0,[ORGANIZATION] and [PERSON] NEARLY $13.75 MILLION IN FEDERAL GRANTS TO FIGHT HOMELESSNESS IN WESTERN GPE0 Rep. [PERSON] (D- GPE1 ) News Release,"The Presidents [ORGANIZATION] budget proposes cutting the [ORGANIZATION] homeless programs, which includes [ORGANIZATION], from 2.636 billion DATE1 to 2.598 billion. [ORGANIZATION] is among a bipartisan group of Members of ORG2 pushing for 3 billion for ORG3 in [ORGANIZATION]."
