city,article_title,article_date,article_source,city_source,paragraph_text,keywords_matched
buffalo,"BlueCross BlueShield Employees 'Pay it Forward' by Donating $67,500 to 15 Local Charities",2015-04-15T00:00:00Z,Targeted News Service,WNY,"Buffalo City Mission Offers long-term recovery programs, counseling, work and life-skills training, education assistance and health-care services for homeless men, women and families committed to turning their lives around.",homeless
buffalo,"BlueCross BlueShield Employees 'Pay it Forward' by Donating $67,500 to 15 Local Charities",2015-04-15T00:00:00Z,Targeted News Service,WNY,"Hearts for the Homeless A mobile soup kitchen that feeds the poor and chronic homeless on the street. The program offers nourishing food, as well as clothing, pertinent information regarding area services, companionship and hope for the future.","homeless, soup kitchen"
buffalo,"Chris Casacci, Co-Founder of SunBeam Laboratories, Donates Masks, Hand Sanitizer and PPE Gear to Local First Responders",2020-07-24T00:00:00Z,ACCESSWIRE,WNY,"We focus primarily on emergency services including police, EMTs, homeless shelters, and certain government agencies as a priority.",homeless
buffalo,Rep. Higgins Warns President's Proposed Elimination of Community Development Block Grants Would Cost WNY Over $22.73 Million,2019-03-21T00:00:00Z,Targeted News Service,WNY,"Congressman Higgins, a member of the House of Representatives Budget Committee, said, The Community Development Block Grant program has sustained bipartisan support in Congress since its inception, and if you look at Western New York you can see just how successful and transformative this program is. In fact, HUD has previously reported that every dollar of funding leveraged an additional 3.55 in additional resources. Not only should we not be eliminating Community Development Block Grants, we should increase funding for programs like these that support neighborhood reinvestment, affordable housing, and economic development.",affordable housing
buffalo,GOVERNOR HOCHUL ANNOUNCES INDOOR FOOD PRODUCTION SYSTEM TO ADVANCE URBAN FARMING IN HARLEM,2022-11-16T00:00:00Z,States News Service,WNY,"State Senator Cordell Cleare said, I am proud to support the enterprising work of Governor Hochul and Harlem Grown who have an innovative, educational, environmentally-conscious and replicable model that can teach our youth invaluable skills and lessonsas well as supply families with locally grown produce. It is my sincere hope that these type of local projectsflourish in conjunction with other necessary investments in our community such as truly affordable housing.",affordable housing
buffalo,Governor Hochul Announces Indoor Food Production System to Advance Urban Farming in Harlem,2022-11-16T00:00:00Z,Targeted News Service,WNY,"State Senator Cordell Cleare said, I am proud to support the enterprising work of Governor Hochul and Harlem Grown who have an innovative, educational, environmentally-conscious and replicable model that can teach our youth invaluable skills and lessons--as well as supply families with locally grown produce. It is my sincere hope that these type of local projectsflourish in conjunction with other necessary investments in our community such as truly affordable housing.",affordable housing
buffalo,SUNY - Buffalo : UB Donates Hundreds of Reusable Face Masks and Face Shields Made by Faculty and Students to the Buffalo City Mission,2020-12-04T00:00:00Z,Targeted News Service,WNY,"We sincerely thank the University at Buffalo community for this thoughtful and inspiring gift, said Aubrey Calhoun, associate executive director of the Buffalo City Mission. Throughout the pandemic, our staff continues to closely follow health and safety standards as we serve our regions homeless. These masks and face shields will help our team to continue this important work, and exemplify the very best of how creativity and humanity can come together to help our neighbors in need.",homeless
buffalo,SUNY - Buffalo : UB Donates Hundreds of Reusable Face Masks and Face Shields Made by Faculty and Students to the Buffalo City Mission,2020-12-04T00:00:00Z,Targeted News Service,WNY,"Michael OHara, manager of major gifts for the Buffalo City Mission added You can imagine how lonely it can feel if you work in a field addressing needs that never seem to diminish. The work of restoring the lives of our homeless neighbors feels very much like that at times, until a group of professionals, leaders, educators, and experts across different fields, connected by a stellar organization such as University at Buffalo, and pulled together by a desire to address a critical need, reaches out to us to be a very tangible help in our day to day activities. This act of kindness has not only equipped us, but also encouraged us.",homeless
buffalo,Higgins Co-Leads Bipartisan SSI Savings Penalty Elimination Act,2023-09-25T00:00:00Z,Impact News Service,WNY,"SSI provides a vital lifeline to nearly 8 million low-income Americans with disabilities and older adults. But its outdated asset limits trap people in poverty, punish them for getting married, create barriers to work, and constrain their financial independence. Beneficiaries cannot save for necessary expenses like a security deposit or car repairs without the risk of losing their benefitsleaving many just one emergency away from homelessness and hunger. We strongly endorse the bipartisan SSI Savings Penalty Elimination Act because it will give Americans with disabilities more freedom to build the futures they want and deserve, said Darcy Milburn, Director of Social Security and Healthcare Policy at The Arc of the United States.",homelessness
buffalo,Higgins Co-Leads Bipartisan SSI Savings Penalty Elimination Act,2023-09-21T00:00:00Z,Targeted News Service,WNY,"SSI provides a vital lifeline to nearly 8 million low-income Americans with disabilities and older adults. But its outdated asset limits trap people in poverty, punish them for getting married, create barriers to work, and constrain their financial independence. Beneficiaries cannot save for necessary expenses like a security deposit or car repairs without the risk of losing their benefits--leaving many just one emergency away from homelessness and hunger. We strongly endorse the bipartisan SSI Savings Penalty Elimination Act because it will give Americans with disabilities more freedom to build the futures they want and deserve, said Darcy Milburn, Director of Social Security and Healthcare Policy at The Arc of the United States.",homelessness
buffalo,Charter Awards $1 Million in 2021 Spectrum Digital Education Grants to 49 Nonprofits Supporting Broadband Literacy,2021-09-02T00:00:00Z,Contify Telecom News,WNY,Homeless Hands of Zanesville,homeless
buffalo,Charter Awards $1 Million 2021 Spectrum Digital Education Grants To 49 Nonprofits Supporting Broadband Literacy Funds Support Broadband Technology Programs and Training in Communities throughout Charter's Service Area,2021-09-02T00:00:00Z,PR Newswire,WNY,"Ashbury Community Services, Inc., Cleveland Central Community House of Columbus, Inc., Columbus Collinwood and Nottingham Village Development Corporation, Cleveland Homeless Hands of Zanesville Goodwill Industries of Central Ohio, Inc., Columbus Urban League of Greater Southwestern Ohio, Cincinnati",homeless
buffalo,"Green Party: As Extreme Weather Rages Globally, Climate Groups Demand Biden and Congressional Democrats Fund a Robust, Ecosocialist Green New Deal",2021-07-22T00:00:00Z,Targeted News Service,WNY,"Since our Camp firestorms killed at least 86 mostly elders in 2018, where we lost 14,000 homes and BearNorth Complex fires of 2020, where we lost 900 more homes, we feel ignored as our streets are filled with homeless fire survivors who still have not received one dime from PGampE even though PGampE pled guilty to 84 counts of manslaughter, said Mark Kay Benson, 350 Butte.",homeless
buffalo,"Green Party: As Extreme Weather Rages Globally, Climate Groups Demand Biden and Congressional Democrats Fund a Robust, Ecosocialist Green New Deal",2021-07-22T00:00:00Z,Targeted News Service,WNY,"The original Civilian Conservation Corps was instrumental in aiding in the recovery of forest ecosystems, in preventing erosion, in restoring and establishing native plant populations and in bolstering and reintroducing native fauna as well. As we train workers to be skilled at habitat restoration, we can work with an eye towards helping the land adjust to climate changes, towards making sure we have maximum carbon storage in our rural areas, and towards using smart growth principles to construct affordable housing in compact urban areas, avoiding smothering rural and farm lands with new housing developments as our dense coastal populations relocate inland, said Grace Nichols of Save the Pine Bush.",affordable housing
buffalo,NYSERDA ANNOUNCES $21 MILLION IN AWARDS TO NEARLY 20 REGIONALLY SIGNIFICANT CARBON NEUTRAL COMMUNITY ECONOMIC DEVELOPMENT PROJECTS,2021-12-21T00:00:00Z,States News Service,WNY,"Spring Creek Landing - The first phase of Spring Creek Landing will be comprised of two buildings located in Brooklyn, New York. The first building includes affordable and supportive housing units pursuing Passive House certification, a healthcare facility, and neighborhood serving retail. The second building includes affordable housing units pursuing Passive House certification. This phase will set the precedent for the community development and sustainability goals for all the phases of the project to follow.",affordable housing
buffalo,Higgins Breaks Down President's Proposed 2017 Federal Budget Congressman Highlights Plan to Reduce Border Wait Times in Speech on the House Floor Rep. Brian Higgins (D- NY ) News Release,2016-02-10T00:00:00Z,"Congressional Documents and Publications (Federal Information & News Dispatch, Inc.)",WNY,"2.66 billion for Homeless Assistance Grants, increase of 414 million",homeless
buffalo,Higgins Breaks Down President's Proposed 2017 Federal Budget Congressman Highlights Plan to Reduce Border Wait Times in Speech on the House Floor Rep. Brian Higgins (D- NY ) News Release,2016-02-10T00:00:00Z,"Congressional Documents and Publications (Federal Information & News Dispatch, Inc.)",WNY,11 billion to reduce family homelessness,homelessness
buffalo,"AHEAD OF THANKSGIVING HOLIDAY, GOVERNOR HOCHUL ANNOUNCES $27.5 MILLION TO FEED NEW YORKERS IN NEED",2024-11-27T00:00:00Z,States News Service,WNY,"Governor Kathy Hochul today announced 27.5 million in additional funding toward the New York State Hunger Prevention and Nutrition Assistance Program HPNAP and Nourish New York Nourish NY programs. This funding will be awarded to eleven food security organizations which support a network of more than 2,600 New York State food pantries, soup kitchens and shelter sites that are particularly busy during the holiday season. Together, they will provide nearly 400 million emergency meals to assist those in need annually, while providing a boost to New York farmers.As families gather to celebrate Thanksgiving, we know some may need a little extra help to put food on the table thats why these investments are so critical, Governor Hochul said. New Yorkers always help our neighbors when theyre in a tough spot, and our efforts to provide food for those in need will deliver more than 400 million meals in the coming months.Funding has been made available to the following organizations as part of an initiative partnering with the State Department of Health and the State Department of Agriculture and Markets to assist New York State residents and farmersFood Bank for New York CityRegional Food Bank of Northeastern New York, Inc.FeedMore WNY, Inc.Catholic Charities Food Bank of the Southern TierFood Bank of Central New YorkFeeding Westchester, Inc.Long Island Cares, IncIsland Harvest, LTDCity HarvestUnited Way of New York CityFoodlink, INC.These organizations will distribute funding to more than 2,600 sites as sub-awards for food assistance services, or as direct allocations of additional food. This includes purchasing additional food, produced by New York State farmers, for their emergency food assistance member agencies.Food banks will be able to use these to host food assistance activities, including popular distribution programs run during the holiday season.New York State Health Commissioner Dr. James McDonald said, No one deserves to go hungry. Hunger can cause stress to the body and mind and can result in malnutrition, inability to concentrate, anxiety, and depression. This investment will give more New Yorkers consistent access to safe and nutritious food that can lead to better health outcomes. The Department remains committed to fighting hunger and promoting nutrition security across this State.New York State Agriculture Commissioner Richard A. Ball said, Thanks to Governor Hochuls continued support of our mission to strengthen the food system, increase the demand for New York agricultural products, and ensure food access for all New Yorkers, we have made incredible progress in connecting our farmers and our underserved communities, especially since the pandemic. The additional funding being provided to our partners at food banks across New York State today will allow them to purchase more, healthy local food to provide to our families in need and will provide a continued market for our farmers.Governor Hochul has made combatting food insecurity and supporting New York agriculture a priority for her administration. Under Governor Kathy Hochuls leadership, the New York State Department of Health and the New York State Department of Agriculture and Markets administers several programs that support increasing food and nutrition security across the StateThe Hunger Prevention and Nutrition Assistance Program supports a network of more than 2,600 emergency food providers who distribute healthy food and fresh produce to individuals who request assistance.The Nourish New York Initiative, administered by the Department in conjunction with the Department of Agriculture and Markets, provides funding to support the purchase and distribution of New York State grown or produced items, including dairy products and produce. Since its launch, Nourish New York has supported the purchase of over 118 million pounds of New York food products, providing a boost to New York farmers and more than 99 million meals to those in need.The Special Supplemental Nutrition Program for Women, Infants and Children WIC serves more than 425,000 individuals through breastfeeding support, nutrition education, supplemental nutritious food benefits, and health care referrals.The Commodity Supplemental Food Program offers free, nutritious foods to adults aged 60 and older. Approximately 36,000 older adults participate in the program monthly. During the summer, participants receive additional benefits for fresh fruits and vegetables at farmers markets through the Senior Farmers Market Nutrition Program, available in New York City and Long Island. The goal is to improve the health of low-income individuals at least 60 by supplementing their diets with nutritious United States Department of Agriculture foods.The Child and Adult Care Food Program is a nutrition education and meal reimbursement program that helps providers serve nutritious and safely prepared meals and snacks to children and adults in daycare settings. The program is funded through the United States Department of Agriculture and continues New Yorks commitment to promote the health and well-being of its residents. All children and adults who attend childcare centers, community-based adult centers, afterschool programs, homeless shelters, and family daycare programs receive meals.Food Access Expansion Grant Program provides 10 million to help increase food access for New Yorkers living in areas without grocery stores and without options for healthy, affordable food. It provides infrastructure funding to support the development and expansion of supermarkets, food cooperatives, permanent farm stands, and other retail food stores in underserved regions of the state while also increasing markets for New York farmers.Regional School Food Infrastructure Grant Program, which provides 50 million over five years to support regional cooking facilities that will facilitate the use of fresh New York State farm products in meal preparation for K-12 school children.FreshConnect Program and the FreshConnect Fresh2You program, which now doubles the buying power for Supplemental Nutrition Assistance Program SNAP recipients at farmers markets across New York State. The initiative provides eligible New Yorkers with a dollar-for-dollar match of up to 50 per day at participating farmers markets, which allows families in need to purchase more healthy food, including produce, dairy, eggs and meats.Farmers Market Nutrition Program FMNP promotes local producers by expanding their sales at farmers markets and farm stands and fosters healthy communities through the consumption of locally grown foods. Eligible consumers are provided with coupons to use for fresh fruits and vegetables at the more than 700 market locations, including farmers markets, farm stands, and mobile market stops participating in the FMNP, supplying healthy homegrown foods to communities across New York.SNAP-Ed Funding Program, which is administered in coordination with the Office of Temporary and Disability Assistance, aims to make local produce more available and accessible to Supplemental Nutrition Assistance Program SNAP eligible communities while sourcing local produce and providing nutrition education through Community Garden and Food Box programs.Farm-to-School program connects schools with local farms and food producers to strengthen local agriculture and improve student health. The program provides financial, technical, and promotional assistance to schools, farms, distributors, and other supporting organizations to bring more local, nutritious, seasonally varied meals to New York students.The 30 Percent New York State Initiative builds on the Farm-to-School program by increasing the reimbursement schools receive for lunches from 5.9 cents per meal to 25 cents per meal for any district that ensures their school lunches are made up of at least 30 percent eligible New York produced and processed products, providing healthier meal options for students and additional markets for farmers.State Senator Roxanne J. Persaud, Chair of the Committee on Social Services said, By securing an additional 27.5 million in funding for critical food security programs, we are helping to ease the burden on families who struggle to provide for their most basic needs. I thank Governor Hochul for prioritizing our most vulnerable populations and for continuing the efforts of this legislature to combat food insecurity in our communities.Assemblyman Andrew Hevesi, Chair of the Committee on Children and Families said, Food insecurity impacts people across every corner of our state, this funding will go a long way to lessen that reality and ensure no one has to wonder where, when, or how they will have their next meal. I am grateful to the Governor for her leadership on this issue and look forward to continuing to invest in the needs of everyday New Yorkers.In addition, the New York State Department of Agriculture and Markets administers the federally funded New York Food for New York Families program, providing nearly 50 million to partner food banks and food service organizations to implement projects that purchase New York-grown food products and distribute them to underserved communities. It also provides technical assistance to help growers sell into the New York Food for New York Families program.On the Department of Health website, you can find more information on the Hunger Prevention and Nutrition Assistance Program, Special Supplemental Nutrition Program for Women, Infants and Children, Commodity Supplemental Food Program, and the Child and Adult Care Food Program.","homeless, soup kitchen"
buffalo,"Ingram Micro Annual Golf Tournaments Raise $680,000 for Local Charities Associates and Vendor and Customer Partners Tee Off for Eight Charities at East and West Coast Tournaments",2015-12-15T00:00:00Z,Marketwired,WNY,"The funds from each tournament were donated to four local charity organizations, selected by Ingram Micros Philanthropic Committee. In Buffalo, Amanda Hansen Foundation, Lothlorien Therapeutic Riding Center, WNY Kids are Heroes Too and Hearts for the Homeless were chosen as beneficiaries. In Irvine, The Alzheimers Association of Orange County, The ALS Association Orange County Chapters, Collettes Childrens Home and Together We Rise were selected as the recipients.",homeless
buffalo,"BlueCross BlueShield Employees ""Pay it Forward,"" Donating $72,000 to 20 Local Charities",2016-04-13T00:00:00Z,Targeted News Service,WNY,"Buddys Second Chance Animal Rescue Rescues homeless, abused and neglected shelter dogs and help them find their forever homes",homeless
buffalo,"BlueCross BlueShield Employees ""Pay it Forward,"" Donating $72,000 to 20 Local Charities",2016-04-13T00:00:00Z,Targeted News Service,WNY,"Buffalo City Mission Offers long-term recovery programs, counseling, work and life-skills training, education assistance and health-care services for homeless men, women and families committed to turning their lives around",homeless
buffalo,GOV. CUOMO ANNOUNCES 1366 TECHNOLOGIES TO CONSTRUCT ADVANCED MANUFACTURING FACILITY IN GENESEE COUNTY,2015-10-07T00:00:00Z,US States News,WNY,"James S. Rubin, CommissionerCEO of New York State Homes and Community Renewal said HCR is proud to not only create and preserve affordable housing throughout the state, but to play a role in revitalizing the states economy. Genesee County can now apply for up to 1 million in Community Development Block Grant funds through HCR to assist 1366 Technologies in creating jobs, including those benefitting low and moderate-income employees. Under Governor Cuomos leadership, we are able to provide 1366 Technologies with this additional avenue of funding to support job creation and improve opportunities for renewable energy sources and technology.",affordable housing
buffalo,"Ingram Micro Celebrates 20th Year of Buffalo Philanthropic Support Golf Tournament Will Raise More Than $300,000 From Company Associates and Partners for Local Organizations",2015-07-31T00:00:00Z,Marketwired,WNY,"-- The Amanda Hansen Foundation was started after the death of teenager Amanda Hansen due to carbon monoxide poisoning, and has as its mission to never lose another child to this silent killer. Donations will be used to subsidize the cost of new furnaces and CO2 detectors. -- The Lothlorien Therapeutic Riding Center offers instruction to individuals with a variety of special needs, but after a particularly damaging winter, the center has suffered with overwhelming maintenance challenges, some of which will be resolved with these funds. -- The WNY Kids are Heroes Too organization will use this donation to fund activities and send the children of current military personnel and veterans to summer camp in Angola on the Lake, N.Y. -- Hearts for the Homeless will now be able to afford a new RV from which to serve food to the underprivileged in Western New York.",homeless
