city,article_date,article_source,city_source,keywords_matched,original_count,processed_count,was_shortened,used_sentence_method,segment_count,segment_index,Deidentified_article_title,Deidentified_paragraph_text
buffalo,2023-03-30T00:00:00Z,ACCESSWIRE,The Buffalo News,affordable housing,1,1,False,True,1,0,[ORGANIZATION] Invests $1 Million to Expand ORG1 at ORG2,"Since [ORGANIZATION], [ORGANIZATION] has made more than 1 billion in investments in [ORGANIZATION] and [ORGANIZATION], supporting affordable housing and community development projects small business and home lending to low-to-moderate income individuals and communities, and transformative philanthropy."
buffalo,2022-11-08T00:00:00Z,News Bites - People in Business,The Buffalo News,affordable housing,2,2,False,True,1,0,[ORGANIZATION] CEO of [ORGANIZATION] in top 10% of price performers of ORG1 stocks in [DATE] DATE0,"News DateHeadlinePublisherNov 04, [ORGANIZATION] and [ORGANIZATION] 750K for Affordable HousingThe Buffalo NewsOct 27, ORG2 [ORGANIZATION] 6,495 Shares of [ORGANIZATION], 2022Earnings Outlook For ORG5 on DATE0 for ORG6 ORG7 institutional owners who own 74 as DATE1 returns inch [ORGANIZATION]"
buffalo,2022-05-17T00:00:00Z,USA Today,The Buffalo News,soup kitchen,2,2,False,True,1,0,"'Made the whole room smile and laugh' Victims remembered as caring, 'vibrant' and a selfless hero","[ORGANIZATION], [ORGANIZATION], was a deacon at a [ORGANIZATION] church and had gone to a soup kitchen before going to the [ORGANIZATION] store, where he often offered to [STREET] people home with their bags. Pastor [PERSON] [ORGANIZATION] said [ORGANIZATION] cleaned the church and would do whatever was needed."
buffalo,2023-11-23T00:00:00Z,Niagara Falls Review,The Buffalo News,homeless,35,3,True,True,1,0,Terrorism ruled out in deadly border explosion Two people killed at FAC0 and customs officer injured,"[ORGANIZATION] and [PERSON] were en route to [ORGANIZATION], [PERSON], on [ORGANIZATION] when they had already made their [STREET] onto FAC0. The [ORGANIZATION] residents had plans to help feed 250 homeless people at a [LOCATION] dinner on DATE2. We were right at the border crossing when all the lights went red, they closed the whole border, all of the Canadian border patrol officers left their booths and were walking away from the bridge, [ORGANIZATION] said."
buffalo,2023-11-22T00:00:00Z,St. Catharine's Standard,The Buffalo News,homeless,34,3,True,True,1,0,Terrorism ruled out in deadly explosion at FAC0,"[ORGANIZATION] and [PERSON] were en route to [ORGANIZATION], [PERSON], on [ORGANIZATION] when they had already made their [STREET] onto FAC0. The [ORGANIZATION] residents had plans to help feed 250 homeless people at a [LOCATION] dinner on DATE2. We were right at the border crossing when all the lights went red, they closed the whole border, all of the Canadian border patrol officers left their booths and were walking away from the bridge, [ORGANIZATION] said."
buffalo,2022-05-20T00:00:00Z,Atlantic Online,The Buffalo News,soup kitchen,84,3,True,True,1,0,[ORGANIZATION] Being Black in [ORGANIZATION],The victims of this white supremacist had been striving to address the effects of racist policy and make up for the lack of goods and services in this Black community. [ORGANIZATION] often drove people to this sole grocery store and had gone to the soup kitchen before going to [ORGANIZATION]. The white supremacist killed [PERSON] as he helped someone put packages in their car.
buffalo,2022-05-15T00:00:00Z,CNN Wire,The Buffalo News,beggar,1,1,False,True,1,0,What we know about [ORGANIZATION] supermarket shooting suspect [ORGANIZATION],"Her brother, the Rev. [PERSON], backed up the account, noting the suspect was in there posing as a beggar and was looking for change, he told [ORGANIZATION]."
buffalo,2020-07-16T00:00:00Z,Florida Politics,The Buffalo News,"homeless, homelessness",502,8,True,True,1,0,Sunburn   [TIME] read of what's hot in [ORGANIZATION] politics   7.16.20,"Distance learning is also expected to continue in [ORGANIZATION]. CARES Act funding is used to get homeless off the [STREET] but time running out for some31 via [ORGANIZATION] of [ORGANIZATION] Homeless people are seen as particularly vulnerable to the virus and so [PERSON] sought to relocate some of them to a hotel using vouchers as payment. The city recalled the eviction notice [TIME] after activists scheduled a news conference [ORGANIZATION] to protest, but the vouchers will run out [LOCATION], promised assistance has not materialized. Both the city and [ORGANIZATION] County are struggling to find permanent refuge for their homeless population. In [PERSON], [PERSON], chairman of the board at [ORGANIZATION], began a similar program, placing homeless people in hotels to protect them from the coronavirus and storms. Our goal is to end homelessness, he said. Advocate [PERSON] seeks to end homelessness. They dont know what theyre doing."
buffalo,2018-06-15T00:00:00Z,DownWithTyranny,The Buffalo News,homeless,114,3,True,True,1,0,[ORGANIZATION] Over ORG0 Leadership,"Our leadership is out of touch with what is going on not only in [ORGANIZATION], [PERSON] and GPE2 but in [LOCATION], [PERSON], [PERSON], GPE6 and GPE7, he said. Democratic voters at least and voters writ large feel politically homeless, and its because we are not offering something affirmative to give people hope and something to invest in, in the [STREET] that we want to do things. [ORGANIZATION] and [ORGANIZATION] Minority Leader [PERSON], a GPE8 Democrat, teamed up [ORGANIZATION] to promote a Democratic agenda called A Better Deal."
buffalo,2022-05-28T00:00:00Z,Gates of Vienna,The Buffalo News,homeless,289,3,True,True,1,0,Gates of [ORGANIZATION],"The lawsuit against [ORGANIZATION] was filed in federal [STREET] in [ORGANIZATION] of [ORGANIZATION], with over 100 plaintiffs pursuing litigation. Fundamentally, this case is about whether Americans should be required to choose between their livelihoods and being coerced into taking an experimental, dangerous medical treatment, reads the lawsuit 68 [ORGANIZATION]-Allied Democrat Backtracks on Saying the Homeless Should Break Into and Occupy Homes After Backlash69 GPE2 state congressional candidate PERSON0, who was endorsed by ORG2 and is allied with [ORGANIZATION], previously said in a campaign ad that when she wins the election, a million people living in the [PERSON] should break into empty houses and live in them so that [ORGANIZATION] will pass housing legislation. After significant blowback, [PERSON] is now changing her tune."
buffalo,2021-06-23T00:00:00Z,Newstex Blogs,The Buffalo News,affordable housing,32,3,True,True,1,0,"Meet PERSON0, the socialist who upset [ORGANIZATION] 's longterm mayor in a stunning primary victory","[ORGANIZATION] has also advocated for8 7.5 million in cuts to [ORGANIZATION], by diverting funding away from the police for mental health calls and minor traffic enforcement responsibilities. Read more Governors of all 50 states are vaccinated against COVID-199 She hopes to direct the reallocated money to youth employment living-wage jobs, affordable housing, and public education improvements. We expect the police to respond to all of our societal ills that really are the result of these austerity budgets, where we cut social safety net services and mental health services, she tweeted [ORGANIZATION]."
buffalo,2023-02-28T00:00:00Z,"Congressional Documents and Publications (Federal Information & News Dispatch, Inc.)",The Buffalo News,homelessness,5,5,False,True,1,0,"[ORGANIZATION] ""Every State is a Border State: Examining Secretary [PERSON]' [ORGANIZATION]."" Testimony by [PERSON], Associate Director, [ORGANIZATION], [ORGANIZATION]","The inability to board lawful transportation options to the [ORGANIZATION] border creates treacherous conditions for travelers. The combination of homelessness and governmental indifference toward crimes against migrants in [ORGANIZATION] has created the ideal environment for all manner of predation. Abductions of migrants number in the tens of thousands DATE0, according to [ORGANIZATION]s [ORGANIZATION]. n80 [PERSON] of migrant women in [ORGANIZATION] are common, underreported, and rarely investigated. n81 All these factors mean that many migrants cross in need of urgent medical attention, and ORG1 policies force them to cross in areas with the fewest resources."
buffalo,2022-02-21T00:00:00Z,Newstex Blogs,The Buffalo News,affordable housing,34,3,True,True,1,0,Subscribe to our newsletter for free,"Speaking of waste, a new report documents thefailures of the states 421-a tax break program19for real estate developers and landlords. In theory, the program promotes the development of affordable housing. In reality, it largely benefits the real estate industry."
buffalo,2022-04-30T00:00:00Z,FD (Fair Disclosure) Wire,The Buffalo News,affordable housing,3,3,False,True,1,0,[ORGANIZATION],"UNIDENTIFIED PARTICIPANT Manufactured housing is still stuck at [TIME] 10 of all new single-family housing starts. And the reason is because of that discriminatory action on the financing, [PERSON] and thats why [ORGANIZATION] created, because now, were having great success now with [PERSON]. Because when they see this, they go, Yes, we need affordable housing, and were fine."
buffalo,2022-04-30T00:00:00Z,FD (Fair Disclosure) Wire,The Buffalo News,homeless,7,3,True,True,1,0,[ORGANIZATION],"Wealth disparity has never been greater. And right outside my hotel window here in [ORGANIZATION] is a homeless encampment, an all-too-familiar sight in American cities. We dont have a free economy."
buffalo,2019-11-08T00:00:00Z,Financial Market Regulatory Wire,The Buffalo News,homelessness,6,3,True,True,1,0,[ORGANIZATION] Secretary [PERSON] at [ORGANIZATION] Lunch,"Because if we just focused on the last tragic act in a veterans life this would be another report that serves as a doorstop for those doors over there. So, I have asked us to take a deep dive into mental health, into addiction and into homelessness. That tragic continuum that leads to so many tragedies."
buffalo,2018-07-05T00:00:00Z,Newstex Blogs,The Buffalo News,homeless,159,3,True,True,1,0,[ORGANIZATION] not enforcing its fair housing law,"In response to a Freedom of Information request, the city provided records for just four complaints, none of them complete. Several cases were abandoned after the person who filed the complaint lost touch with [ORGANIZATION], or, in one instance, became homeless. Findings of discrimination, when they do come, take almost three times longer, on average, than [ORGANIZATION] the law allows."
buffalo,2021-04-24T00:00:00Z,Dissident Voice,WBFO,"homeless, homelessness",136,5,True,True,2,0,Economic Collapse Continues Uninterrupted,"ftn10 [ORGANIZATION] goes further in [ORGANIZATION] and says11 that the post-pandemic economy will include higher prices, worse service, longer [PERSON] in the [ORGANIZATION] is also increasing COVID-driven loss of jobs and employment income will cause the number of homeless workers to increase [LOCATION] through DATE2. Without large-scale, government employment programs the Pandemic Recession is [PERSON] to cause twice as much homelessness as the DATE3 Great Recession. Over [PERSON] the current Pandemic Recession is projected to cause chronic homelessness to increase 49 percent in [ORGANIZATION], 68 percent in [ORGANIZATION] and 86 percent in [LOCATION]. The homeless include the homeless on the streets, shelter residents and couch surfers. emphasis added, DATE5 Perhaps ironically, just Two blocks from FAC0, a growing encampment of the homeless13 grips the economys most powerful person ORG1 Chairman [PERSON]."
buffalo,2021-04-24T00:00:00Z,Dissident Voice,WBFO,"homeless, homelessness",136,3,True,True,2,1,Economic Collapse Continues Uninterrupted,"Relentless disinformation about the economy wont solve any problems or convince people that they are not experiencing what they are experiencing. Growing poverty, hunger, homelessness, unemployment, under-employment, debt, inequality, anxiety, and insecurity are real and painful. They require real solutions put forward by working people, not major owners of capital concerned only with maximizing private profit as fast as possible."
buffalo,2021-04-14T00:00:00Z,Wonkette,WBFO,homeless,49,3,True,True,1,0,Judge [PERSON] PD Shouldn't Have Fired Actual Good Cop PERSON0,"My vindication comes at a [ORGANIZATION] cost, but what has been gained could not be measured, she saidAfter she was fired, [ORGANIZATION] worked odd jobs, mostly recently as a truck driver. Shes even lived out of her car, which means she was homeless. The moral arc might bend toward justice but too many lives are broken along the [STREET]."
buffalo,2020-12-10T00:00:00Z,VentureBeat,WGRZ,homeless,27,3,True,True,1,0,[ORGANIZATION] votes to prohibit businesses from using facial recognition without public notice,"Businesses found selling data will face fines of 5,000. In this aspect, the bill falls short of [ORGANIZATION], [ORGANIZATION] recently-passed ordinance regarding biometric data collection, which bans all private use of biometric data in places of public accommodation, including stores, banks, restaurants, public transit stations, homeless shelters, doctors offices, rental properties, retirement homes, and a variety of other types of businesses excepting workplaces_. Its scheduled to take effect starting [ORGANIZATION]."
buffalo,2015-10-20T00:00:00Z,Business Wire,WGRZ,homeless,1,1,False,True,1,0,[ORGANIZATION] in Make A Difference Day to [ORGANIZATION],"[ORGANIZATION] in [ORGANIZATION], [PERSON] will help [ORGANIZATION] Recreation Development Inc. by making meals and assembling items, such as blankets and hats, for the local homeless community"
buffalo,2015-11-20T00:00:00Z,Dayton Daily News (Ohio),WGRZ,homeless,1,1,False,True,1,0,STATE-BY-STATE,"DISTRICT OF [ORGANIZATION] Deputy Mayor [PERSON] said the city will soon clear a grassy stretch near FAC0 where homeless people have erected dozens of tents since [ORGANIZATION], [ORGANIZATION] reported."
buffalo,2015-11-20T00:00:00Z,USA Today,WGRZ,homeless,1,1,False,True,1,0,STATE-BY-STATE News from across the [ORGANIZATION],"[ORGANIZATION] Deputy Mayor [PERSON] said the city will soon clear a grassy stretch near FAC0 where homeless people have erected dozens of tents since [ORGANIZATION], [ORGANIZATION] reported."
buffalo,2022-01-26T00:00:00Z,Newstex Blogs,WGRZ,affordable housing,58,13,True,True,3,0,How a stadium can benefit the community,"CBAs across the country The first CBAs were driven by labor unions, according to [ORGANIZATION], who became involved with the movement as a labor organizer in [ORGANIZATION]. In [ORGANIZATION], he said, CBAs have expanded to address broader community needs, such as affordable housing, education and health equity. This is not just, you know, labor unions thinking about how theyre going to get more jobs, he said. Its also engaging the community in a very real [STREET] to address important community needs. The [ORGANIZATION] CBA included benchmarks for local hiring and contracting, engaging minority- and women-owned businesses, and paying a living wage to workers during and after construction  the baseline considerations typical of most CBAs. Follow us on Facebook15, Twitter16 and YouTube17 On top of that, the [ORGANIZATION] - who began play as [ORGANIZATION] between [LOCATION] - committed 100 million to address some of [ORGANIZATION] most pressing needs, including 75 million to start a revolving loan fund to support affordable housing projects. 12.25 million for college scholarships, tutoring, counseling and other educational programs. 6 million to improve the citys [INSTITUTION] and build a new [INSTITUTION]. 3 million in rental and legal assistance for people struggling to avoid eviction. 2.5 million to aid first-time homebuyers. Three-quarters of that money will seed a revolving loan fund for affordable housing projects. The rest will pay for educational programs and college scholarships, build a new library and [INSTITUTION], and provide assistance for renters facing eviction and aid to first-time homebuyers, among other initiatives."
buffalo,2022-01-26T00:00:00Z,Newstex Blogs,WGRZ,affordable housing,58,3,True,True,3,1,How a stadium can benefit the community,"They committed to a first source hiring program, ensuring job opportunities would be offered to local, low-income communities, including those displaced by the project. The agreement also included an affordable housing component, as well as commitments to using local contractors and leasing commercial space to local businesses. Further, the developers agreed to fund a study of the surrounding communitys parks and recreation facilities and commit 1 million to improving them."
buffalo,2022-01-26T00:00:00Z,Newstex Blogs,WGRZ,affordable housing,58,3,True,True,3,2,How a stadium can benefit the community,"The teams owner avoided a legally binding [ORGANIZATION] but agreed to invest more than 40 million in parks, a job center, housing and social programs. In [ORGANIZATION], [ORGANIZATION] officials agreed to pay for a 275 million stadium for the citys new [ORGANIZATION] team with a [ORGANIZATION] that provides for affordable housing and a childcare facility on the development site, as well as retail spaces for local artisans and small businesses at a reduced rental rate. All those projects involved public subsidies."
buffalo,2021-01-19T00:00:00Z,Gates of Vienna,WGRZ,homeless,290,5,True,True,1,0,Gates of [ORGANIZATION],"[ORGANIZATION] comments to employees were leaked to the right-wing activist group [ORGANIZATION], and a ORG1 spokesperson confirmed the video is authentic. [PERSON], we are going to conspiracy theories we are going to be permanently suspending those accounts, [PERSON] says in the clip.155 ORG2 Goes on Lockdown After Fire Breaks Out in [ORGANIZATION] Camp156 FAC0 went on lockdown [ORGANIZATION] [TIME] as a fire broke out in a nearby homeless camp. ORG3 spokeswoman [PERSON] told ORG4 [ORGANIZATION] that the capitol went on lockdown as a result of a fire in a homeless camp. The fire has been put out and there are no injuries, [ORGANIZATION] DATE1 Inauguration Riots158 GPE0, [PERSON] film crew releases dramatic, never before seen footage of the DATE1 Inauguration riots."
buffalo,2018-08-01T00:00:00Z,Newstex Blogs,WGRZ,affordable housing,17,2,True,True,1,0,[ORGANIZATION] considers action on fair housing law,"If we find out something is not being enforced or something is not staffed, it still becomes our responsibility to go back and fix the problem, said [ORGANIZATION] President [PERSON], adding that the law is increasingly important as rising rents squeeze the citys supply of affordable housing. By the time this [ORGANIZATION] reconvenes in [ORGANIZATION], we will have looked into it thoroughly, [PERSON] said."
buffalo,2019-05-01T00:00:00Z,Newstex Blogs,WGRZ,affordable housing,56,3,True,True,1,0,[ORGANIZATION] lags on addressing lead poisoning,"The [ORGANIZATION] has initiated nothing on its own. Everybody needs to be tested, every house needs to be tested, and remediated, and that has to happen, as soon as humanly possible, said [ORGANIZATION], co-director of organizing at [ORGANIZATION], which is active on [ORGANIZATION] promoting affordable housing and social justice. Why the delay on the citys part?"
buffalo,2022-09-12T00:00:00Z,Real Estate Monitor Worldwide,WIVB,affordable housing,1,1,False,True,1,0,[ORGANIZATION] beginning to spend $331 million from [ORGANIZATION],"Some of the programs are meant to expand job readiness programs, forgive overdue water bills, launch a public health initiative and provide affordable housing."
buffalo,2022-09-12T00:00:00Z,Real Estate Monitor Worldwide,WIVB,affordable housing,2,2,False,True,1,0,[ORGANIZATION] beginning to spend $331 million from [ORGANIZATION],[ORGANIZATION]. An agreement between the city and [ORGANIZATION] is in negotiations and is planned to be submitted at [ORGANIZATION] meeting.
buffalo,2022-09-12T00:00:00Z,Real Estate Monitor Worldwide,WIVB,affordable housing,2,2,False,True,1,0,[ORGANIZATION] beginning to spend $331 million from [ORGANIZATION],"The agency will administer 16.3 million in [ORGANIZATION] funds to seed an affordable housing trust that would leverage the citys 12 million HOME funds and other private sources for the construction of new, affordable permanent housing for low and moderate income families and persons with disabilities, and improvements to existing housing as well as transitional housing units for displaced residents and their families. Up to 2 million will be available to help renters, including residents of ORG1 facilities who have been affected by the pandemic and struggle with rent payments."
buffalo,2022-12-27T00:00:00Z,The Deseret News,WIVB,homeless,2,2,False,True,1,0,[ORGANIZATION] snow storm: How many people died in [LOCATION] [DATE] weather?,"Per [ORGANIZATION], [ORGANIZATION]-related deaths were reported practically nationwide, including at least eight killed in crashes in [ORGANIZATION], [PERSON] and [ORGANIZATION]. A woman fell through [LOCATION], and there was a fatal fire at a [PERSON] homeless persons camp."
buffalo,2018-06-14T00:00:00Z,Gates of Vienna,WIVB,"homeless, homelessness",186,4,True,True,1,0,Gates of [ORGANIZATION],"Turns out, this disastrous The about-face shows how severely the tax debate polarized [ORGANIZATION], pitting some politicians and city residents against big employers like [ORGANIZATION], [PERSON] ORG2 It also reflects the depth of divisions about how best to deal with growing homelessness in [ORGANIZATION] cities where wealth, spurred by technology companies and other fast-growing businesses, has raised the cost of living, pushing more people into poverty and homelessness. Think about the logic of this You want to help the homeless, so you put a tax on the thing that would help homeless people the most  a job. And in the course of doing so, you also add to the cost of creating jobs for everyone else too.66 8 Bulgarians Raped a DATE0 Girl in [PERSON]"
buffalo,2016-09-18T00:00:00Z,Newstex Blogs,WIVB,"homeless, affordable housing",348,3,True,True,2,0,Jihad Report - DATE0,"DATE0 the folks in [ORGANIZATION] able to hold off a program there. [PERSON] couldnt quite manage it and now has homeless refugees90 in GPE2. [PERSON], [PERSON] citizens are working hard to turn back the plan to bring Syrians to their city."
buffalo,2016-09-18T00:00:00Z,Newstex Blogs,WIVB,"homeless, affordable housing",348,3,True,True,2,1,Jihad Report - DATE0,"If your town is gleefully building low income housing, be ready for refugees! [PERSON] has been a long-established refugee site but gee, not enough affordable housing so now some are suggesting bringing in prefabricated housing can you say refugee camp127? From ORG0 [PERSON]128 [PERSON], [PERSON]"
buffalo,2024-05-26T00:00:00Z,News Bites - People in Business,WKBW,affordable housing,2,2,False,True,1,0,[ORGANIZATION] [ORGANIZATION] ORG1 Leader [PERSON] Emerging Legend DATE0,"[ORGANIZATION] has opened [ORGANIZATION], a 451-unit transit-oriented affordable housing community in [LOCATION], [LOCATION] The developer secured a 56.3 million low-rate construction loan originated by ORG2."
buffalo,2024-05-26T00:00:00Z,News Bites - People in Business,WKBW,affordable housing,3,3,False,True,1,0,[ORGANIZATION] [ORGANIZATION] ORG1 Leader [PERSON] Emerging Legend DATE0,"Back in [ORGANIZATION], [ORGANIZATION] pledged to invest more than 2 billion through its ORG1 in creating affordable housing. The firm poured 124.4 million in transit-oriented housing to build 1,060 units in the states of [ORGANIZATION] and [ORGANIZATION]. [ORGANIZATION] also provided 16 million in construction financing for ORG2 - a 293-unit transit-oriented affordable-housing community in GPE2, GPE3"
buffalo,2024-05-08T00:00:00Z,News Bites - People in Business,WKBW,affordable housing,1,1,False,True,1,0,[ORGANIZATION] [ORGANIZATION] Celebrates Groundbreaking on Adventure Africa Phase III: Rhino Habitat at ORG1 DATE0,"[ORGANIZATION] ORG0 mixed-use affordable housing community, FAC0, receives [ORGANIZATION]"
buffalo,2024-05-08T00:00:00Z,News Bites - People in Business,WKBW,affordable housing,1,1,False,True,1,0,[ORGANIZATION] [ORGANIZATION] Celebrates Groundbreaking on Adventure Africa Phase III: Rhino Habitat at ORG1 DATE0,DATE0 GPE0 Designing Affordable Housing in an [ORGANIZATION]
buffalo,2024-05-08T00:00:00Z,News Bites - People in Business,WKBW,affordable housing,2,2,False,True,1,0,[ORGANIZATION] [ORGANIZATION] Celebrates Groundbreaking on Adventure Africa Phase III: Rhino Habitat at ORG1 DATE0,"The affordable housing sector provides much-needed services to its residents, but it has not been known for its cutting-edge design. While a growing number of new construction and redevelopment projects have featured creativity and higher-quality finishes, many affordable developers still equate design with extras that will blow the budget."
buffalo,2019-02-07T00:00:00Z,PR Newswire,WKBW,soup kitchen,17,3,True,True,1,0,[ORGANIZATION] announces Give Light Awards winners,"This award goes to an individual or team who best demonstrated how they meaningfully serve a community on behalf of the company. [ORGANIZATION] raised more than 15,000 for a local soup kitchen and shelter through sales of her [PERSON] to the [ORGANIZATION] cookbook. Honorable mention [PERSON], anchor at [ORGANIZATION] in [ORGANIZATION], [PERSON], for the non-profit program she founded, [PERSON]."
buffalo,2024-08-13T00:00:00Z,Targeted News Service,WNY,affordable housing,1,1,False,True,1,0,Governor [PERSON] Announces [PERSON] for PERSON1 in [ORGANIZATION],Project at 950 Broadway Features 28 [ORGANIZATION] and [ORGANIZATION]
