city,article_date,article_source,city_source,keywords_matched,original_count,processed_count,was_shortened,used_sentence_method,segment_count,segment_index,Deidentified_article_title,Deidentified_paragraph_text
buffalo,2024-08-13T00:00:00Z,Targeted News Service,WNY,affordable housing,5,5,False,True,1,0,Governor [PERSON] Announces [PERSON] for PERSON1 in [ORGANIZATION],"Governor [ORGANIZATION] announced the ribbon cutting for the ORG0 building in [ORGANIZATION]. The 13.5 million project, by [ORGANIZATION], renovated and converted a 50,000-square-foot, vacant and underutilized building at 950 Broadway into a mixed-use development, featuring 28 affordable housing units and a free ORG2 child education program. The building has been unused for [LOCATION], with portions of the building being vacant for DATE2. The renovated structure brings new life to the former retail store-turned-office building near one of the most visible intersections in [ORGANIZATION]. Governor [PERSON] previously announced [PERSON] was chosen with 10 other transformational projects in FAC0 neighborhood as part of a 10 million Downtown Revitalization Initiative award."
buffalo,2024-08-13T00:00:00Z,Targeted News Service,WNY,affordable housing,3,3,False,True,1,0,Governor [PERSON] Announces [PERSON] for PERSON1 in [ORGANIZATION],"FAC0 neighborhood, with a relatively dense stock of largely historic commercial buildings, was a [ORGANIZATION] winner in [DATE]. Located in [ORGANIZATION] and one of the citys oldest neighborhoods, the neighborhood is the focus of [ORGANIZATION]s plan for a downtown investment, with a vision of creating special urban places, key park spaces, retail-oriented streets, improved neighborhood connections, bike and pedestrian connections, streetscape improvements, and public realm improvements. Building on this momentum, [ORGANIZATION] aims to encourage more redevelopment of vacant structures, provide better connections between anchors and amenities through greenspace, increase affordable housing opportunities, and enhance the streetscape."
buffalo,2024-08-13T00:00:00Z,Targeted News Service,WNY,affordable housing,6,3,True,True,1,0,Governor [PERSON] Announces [PERSON] for PERSON1 in [ORGANIZATION],"Additionally, the project was awarded a 427,150 grant for the buildout of the daycare facilities through [ORGANIZATION] for the FAC0 neighborhood. [PERSON] provided 2.1 million in construction and permanent financing toward the affordable housing portion of the project through its [ORGANIZATION]. ORG2 provided a 7.8 million construction loan, as well as a 3.2 million ORG3 ORG4-insured permanent loan financed through its partnership with [ORGANIZATION]."
buffalo,2024-08-13T00:00:00Z,Targeted News Service,WNY,housing crisis,4,4,False,True,1,0,Governor [PERSON] Announces [PERSON] for PERSON1 in [ORGANIZATION],"Governor [PERSON] is committed to addressing [ORGANIZATION] housing crisis and making the state more affordable and more livable for all New Yorkers. As part of [ORGANIZATION], the Governor secured a landmark agreement to increase [ORGANIZATION] housing supply through new tax incentives for [ORGANIZATION] communities, new incentives and relief from certain [ORGANIZATION]-imposed restrictions to create more housing in [ORGANIZATION], a 500 million capital fund to build up to 15,000 new homes on [ORGANIZATION]-owned property, an additional 600 million in funding to support a variety of housing developments statewide, and new protections for renters and homeowners. In addition, as part of the DATE1, the Governor announced a DATE2, 25 billion Housing Plan, to create or preserve 100,000 affordable homes statewide. More than 40,000 homes have been created or preserved to date."
buffalo,2024-08-13T00:00:00Z,Targeted News Service,WNY,affordable housing,2,2,False,True,1,0,Governor [PERSON] Announces [PERSON] for PERSON1 in [ORGANIZATION],"[ORGANIZATION] Secretary of [ORGANIZATION] said, [ORGANIZATION] is all about building on existing community assets to create a walkable, amenity-rich experience for residents to live, work and recreate. FAC0 is a great example of this program at work - what was once a vacant and dilapidated property will now provide much-needed affordable housing, childcare and other quality-of-life amenities."
buffalo,2024-08-13T00:00:00Z,Targeted News Service,WNY,affordable housing,3,3,False,True,1,0,Governor [PERSON] Announces [PERSON] for PERSON1 in [ORGANIZATION],"[ORGANIZATION] Executive [ORGANIZATION] said, The [ORGANIZATION] building in [LOCATION] historic LOC2 neighborhood is experiencing new life after [ORGANIZATION] of disuse, returning to its role as a centerpiece for the area in its new role as a home to [ADDRESS] to help families and individuals access affordable housing that is near to other amenities and close to downtown. I thank [PERSON] for investing in the LOC2 neighborhood, Governor [PERSON] for her focus on expanding affordable housing in our community, as well as my fellow board members at the [ORGANIZATION] Industrial Development Agency for approving a significant adaptive reuse tax incentive package to spur this important development forward."
buffalo,2024-08-13T00:00:00Z,Targeted News Service,WNY,affordable housing,3,3,False,True,1,0,Governor [PERSON] Announces [PERSON] for PERSON1 in [ORGANIZATION],"[ORGANIZATION] President and CEO [ORGANIZATION] said, The [ORGANIZATION] is pleased to partner with [PERSON] on FAC0, a transformational project that is a great example of our successful [ORGANIZATION] program. The adaptive reuse of vacant, underutilized buildings is vital to the redevelopment of areas of our community that have experienced generational disinvestment. On behalf of our ORG2, I congratulate ORG3 on the beautiful revitalization of this historic building, bringing affordable housing and fee day care services to the community."
buffalo,2024-08-13T00:00:00Z,Targeted News Service,WNY,affordable housing,6,6,True,True,1,0,Governor [PERSON] Announces [PERSON] for PERSON1 in [ORGANIZATION],"City of [ORGANIZATION] Mayor [ORGANIZATION] said, I am pleased to see all the new developments coming to the FAC0 area of East [ORGANIZATION] between FAC1 and FAC0. The FAC2 affordable housing complex will add an additional 28 affordable units to this area. My administration is proud to have contributed over 400,000 to this project. DATE0 we opened [PERSON] in this area featuring 42 affordable housing units. The FAC2 affordable housing complex will add to that. I thank Governor [PERSON] for working closely with [ORGANIZATION] to significantly improve this area."
buffalo,2024-08-13T00:00:00Z,Targeted News Service,WNY,affordable housing,3,3,False,True,1,0,Governor [PERSON] Announces [PERSON] for PERSON1 in [ORGANIZATION],"[ORGANIZATION] and [ORGANIZATION] Director [PERSON] said, As a mission driven lender and investor, [ORGANIZATION] is proud to see ORG2 breathe new life into a long-vacant structure in [ORGANIZATION]. The new FAC0 project will help meet the neighborhoods vital need for affordable housing and community-based services and be a catalyst for continued revitalization. My thanks to Governor [PERSON] and her teams at [ORGANIZATION] and [PERSON], to ORG2, and to [ORGANIZATION] and our partners at the [ORGANIZATION] for their dedication and commitment to our shared mission of meeting the unique housing needs of the [ORGANIZATION] community."
buffalo,2024-08-13T00:00:00Z,Targeted News Service,WNY,affordable housing,4,4,False,True,1,0,Governor [PERSON] Announces [PERSON] for PERSON1 in [ORGANIZATION],"[ORGANIZATION] Member [PERSON] said, The transformation and adaptive reuse of the FAC0 building at 950 Broadway is a testament to the power of thoughtful renovation and the value of mixed-use structures in revitalizing our communities. By breathing new life into this historic space, we are not only preserving [LOCATION] rich architectural heritage but also creating vital opportunities for affordable housing and early childhood education. We are deeply grateful to Governor [PERSON] and [ORGANIZATION] for their unwavering support and investment, which made this transformative project possible. This collaboration exemplifies how strategic investments in renovation and mixed-use development can [STREET] lasting, positive change in our neighborhoods."
buffalo,2024-11-20T00:00:00Z,ACCESSWIRE,WNY,homeless,2,2,False,True,1,0,"[ORGANIZATION] Receives $300,000 Grant From ORG1 - the Largest Gift in the Organization's History","Grant will fund capacity building for a second emergency family shelter site in [ORGANIZATION]. Projected to open in [ORGANIZATION], the new shelter site will more than double [ORGANIZATION] ability to serve the [PERSON] family homeless population."
buffalo,2024-11-20T00:00:00Z,ACCESSWIRE,WNY,homeless,4,4,False,True,1,0,"[ORGANIZATION] Receives $300,000 Grant From ORG1 - the Largest Gift in the Organization's History","[ORGANIZATION], [PERSON] of [ORGANIZATION], an emergency family [INSTITUTION], has received a ORG1 Grant for 300,000 over [LOCATION]. The grant, the largest gift in the organizations history, is targeted for capacity building as ORG0 of [ORGANIZATION] is in the initial stages of building a second emergency family shelter site in GPE2. Projected to open in [DATE], the new shelter site will more than double their ability to serve the [PERSON] family homeless population. The grant will support the addition of two key positions at the organization - a Housing Specialist who will provide more targeted intervention to assist homeless families securing permanent housing and a Development Director to help grow the organizations fiscal position."
buffalo,2024-11-20T00:00:00Z,ACCESSWIRE,WNY,homelessness,6,2,True,True,1,0,"[ORGANIZATION] Receives $300,000 Grant From ORG1 - the Largest Gift in the Organization's History","Family homelessness is at crisis levels in our community right now. On [TIME], there are over 100 families who need a space in shelter - but there are simply no spaces for them."
buffalo,2024-11-20T00:00:00Z,ACCESSWIRE,WNY,homelessness,3,3,False,True,1,0,"[ORGANIZATION] Receives $300,000 Grant From ORG1 - the Largest Gift in the Organization's History","[ORGANIZATION] serves a vital role in our community, keeping families experiencing homelessness together by offering emergency housing and compassionate support as they work to find their [STREET] back home, said ORG1 President [PERSON]. Their mission and work gives children and their families hope. We believe in their work and are excited to help them grow and serve more people."
buffalo,2024-11-20T00:00:00Z,ACCESSWIRE,WNY,homelessness,2,2,False,True,1,0,"[ORGANIZATION] Receives $300,000 Grant From ORG1 - the Largest Gift in the Organization's History","This grant to [ORGANIZATION] is symbolic of the partnerships ORG1 works to forge in the communities we serve, said [ORGANIZATION] Officer PERSON0. Securing safe and decent housing is a first step out of homelessness and gives children and their families a chance to move forward to brighter futures."
buffalo,2024-11-20T00:00:00Z,ACCESSWIRE,WNY,homelessness,2,2,False,True,1,0,"[ORGANIZATION] Receives $300,000 Grant From ORG1 - the Largest Gift in the Organization's History",[ORGANIZATION] is one of just two emergency family shelters in [ORGANIZATION] that keep families together through the crisis of homelessness. Over 70 of their guests are children.
buffalo,2023-07-14T00:00:00Z,ACCESSWIRE,WNY,affordable housing,2,2,False,True,1,0,"[ORGANIZATION] in [ORGANIZATION] , [PERSON]","FAC0 is already having transformative impact on the neighborhood surrounding the former [ORGANIZATION], rectory and convent buildings on FAC1, bringing safe and affordable housing to this area, said [ORGANIZATION], ORG1 President and [ORGANIZATION]. We are very proud to have played a role in helping FAC0 become reality and thank all of the partners in the project - ORG3, [LOCATION], [ORGANIZATION] and [PERSON] - for their vision and commitment to our community."
buffalo,2023-07-14T00:00:00Z,ACCESSWIRE,WNY,affordable housing,2,2,False,True,1,0,"[ORGANIZATION] in [ORGANIZATION] , [PERSON]","[ORGANIZATION] is the developer in partnership with ORG1. Ranked as a Top 4 affordable housing lender for [ORGANIZATION] by ORG2, [PERSON] is committed to bringing much needed housing projects to life, and homes to those in need."
buffalo,2020-12-08T00:00:00Z,Pharma & Healthcare Monitor Worldwide,WNY,affordable housing,1,1,False,True,1,0,$2.8 million+ ORG0 awards support access to affordable housing in [ORGANIZATION],Congressman [PERSON] announced more than 2.8 million in funding made available through [ORGANIZATION] toward the development of affordable housing in [ORGANIZATION].
buffalo,2020-12-08T00:00:00Z,Pharma & Healthcare Monitor Worldwide,WNY,affordable housing,2,2,False,True,1,0,$2.8 million+ ORG0 awards support access to affordable housing in [ORGANIZATION],"Thriving communities require access to quality, affordable housing, he said. These [ORGANIZATION] awards will go a long [STREET] in supporting local projects that are providing safe, affordable home options for families and seniors."
buffalo,2020-12-08T00:00:00Z,Pharma & Healthcare Monitor Worldwide,WNY,homelessness,2,2,False,True,1,0,$2.8 million+ ORG0 awards support access to affordable housing in [ORGANIZATION],"[ORGANIZATION] at the site of the former [ORGANIZATION], [ORGANIZATION] will oversee a project developing 44 residential units for low- and very-low-income seniors, individuals with disabilities, and those facing homelessness. The 15 million project will receive 401,236 through ORG2, as well as additional federal resources through [PERSON] and Low-Income Housing Tax Credits."
buffalo,2020-12-08T00:00:00Z,Pharma & Healthcare Monitor Worldwide,WNY,affordable housing,3,3,False,True,1,0,$2.8 million+ ORG0 awards support access to affordable housing in [ORGANIZATION],"As a bank for communities, we know we need to help our customers and communities see it through [ORGANIZATION], said [ORGANIZATION], regional [ORGANIZATION] officer for [ORGANIZATION]. This support has taken on many forms, including joining with the ORG1 and our housing partners to create more affordable housing opportunities in [ORGANIZATION]. Nonprofit organizations like ORG2 play an important role in providing support to the individuals and families struggling in our communities, and were delighted to help secure grant funding for an additional 10 single-family homes in [ORGANIZATION]."
buffalo,2020-12-08T00:00:00Z,Pharma & Healthcare Monitor Worldwide,WNY,affordable housing,2,2,False,True,1,0,$2.8 million+ ORG0 awards support access to affordable housing in [ORGANIZATION],"[ORGANIZATION] ORG1 will provide 1.5 million toward the renovation of 153 apartments located on FAC0 in [ORGANIZATION]. The complex, which provides affordable housing for seniors, is undergoing an 18.1 million renovation."
buffalo,2020-12-08T00:00:00Z,Pharma & Healthcare Monitor Worldwide,WNY,affordable housing,5,5,False,True,1,0,$2.8 million+ ORG0 awards support access to affordable housing in [ORGANIZATION],"[ORGANIZATION], created by [ORGANIZATION] in [ORGANIZATION], provides member community lenders with direct subsidies, which are passed on to qualified households through a sponsoring local nonprofit organization. [ORGANIZATION] financing is combined with other funding sources to create housing for moderate and low-income families. Program awardees receive this funding through [LOCATION] competitive rounds. Each competing project must be sponsored by a financial organization that is a member of ORG2 in partnership with a community-based sponsoring organization. DATE2 [ORGANIZATION]."
buffalo,2023-09-21T00:00:00Z,Executive Appointments Monitor Worldwide (English),WNY,"homelessness, affordable housing",4,4,False,True,1,0,[ORGANIZATION] of [ORGANIZATION] of CEO,"About [ORGANIZATION] is dedicated to eliminating racism, empowering women, and promoting peace, justice, freedom, and dignity for all. Our vision is a thriving community without divide. Founded in [ORGANIZATION], [ORGANIZATION] supports over 3,000 women, children, and families [LOCATION] preventing DATE2 of homelessness for our communitys most vulnerable seniors and ensuring that 244,420 production hours are pumped into the ORG1 economy. Our programs empower women to attain self-sufficiency, youth to unlock their potential and build a path to success, seniors to secure safe, affordable housing that keeps them connected to the community, and children to grow in healthy, nurturing and enriched environments."
buffalo,2023-09-27T00:00:00Z,Contify Investment News,WNY,affordable housing,6,6,True,True,1,0,[ORGANIZATION] : Governor [PERSON] Announces Start of Construction on ORG0 in [ORGANIZATION],"Governor [ORGANIZATION] has announced the start of construction on the 950 Broadway development in [ORGANIZATION]. The 13.5 million project by [ORGANIZATION] will renovate and convert a vacant building into a mixed-use development, including 28 affordable housing units, a free ORG1 child education program, and a proposed indoor urban farm. The building has been unused for [ORGANIZATION] and will bring new life to the area. The project is part of ORG2 10 million FAC0 Downtown Revitalization Initiative Award, which includes 11 projects. The development will also receive financial support from the state, including a loan and grant from [ORGANIZATION], as well as grants from [LOCATION] and [PERSON] ORG5. Overall, the project aims to create affordable housing opportunities and enhance the streetscape in the FAC0 neighborhood."
buffalo,2023-09-27T00:00:00Z,Contify Investment News,WNY,affordable housing,1,1,False,True,1,0,[ORGANIZATION] : Governor [PERSON] Announces Start of Construction on ORG0 in [ORGANIZATION],The development will feature 28 affordable housing units.
buffalo,2023-09-27T00:00:00Z,Contify Investment News,WNY,affordable housing,2,2,False,True,1,0,[ORGANIZATION] : Governor [PERSON] Announces Start of Construction on ORG0 in [ORGANIZATION],"- Project Features 28 Affordable Housing Units and Free Head Start Child Education Program- One Of 11 Projects For [ORGANIZATION] Broadway-Fillmore Downtown Revitalization Initiative Award, See Renderings Here"
buffalo,2023-09-27T00:00:00Z,Contify Investment News,WNY,affordable housing,5,5,False,True,1,0,[ORGANIZATION] : Governor [PERSON] Announces Start of Construction on ORG0 in [ORGANIZATION],"Governor [ORGANIZATION] announced the start of construction for [ORGANIZATION] in [ORGANIZATION]. The 13.5 million project, by [ORGANIZATION], will renovate and convert a 50,000 square foot, vacant and underutilized building in [ORGANIZATION] into a mixed-use development, featuring 28 affordable housing units, a free ORG2 child education program and a proposed indoor urban farm. The building has been unused for [LOCATION], with portions of the building being vacant for [ORGANIZATION] prior. Once complete, the renovated 950 Broadway will bring new life to the former retail store-turned-office building near one of the most visible intersections in [ORGANIZATION]. Governor [PERSON] previously announced [ORGANIZATION] was chosen with 10 other transformational projects in FAC0 neighborhood as part of a 10 Million Downtown Revitalization Initiative Award."
buffalo,2023-09-27T00:00:00Z,Contify Investment News,WNY,affordable housing,4,4,False,True,1,0,[ORGANIZATION] : Governor [PERSON] Announces Start of Construction on ORG0 in [ORGANIZATION],"[ORGANIZATION] was a [ORGANIZATION] winner in [DATE]. Located in [ORGANIZATION] and one of the citys oldest neighborhoods, [PERSON] is the focus of ORG1 plan for a downtown investment. LOC2, with a relatively dense stock of largely historic commercial buildings, set forth a vision of creating special urban places, key park spaces, retail-oriented streets, improved neighborhood connections, bike and pedestrian connections, streetscape improvements, and public realm improvements. Building on this momentum, [ORGANIZATION] aims to encourage more redevelopment of vacant structures, provide better connections between anchors and amenities through greenspace, increase affordable housing opportunities, and enhance the streetscape."
buffalo,2023-09-27T00:00:00Z,Contify Investment News,WNY,affordable housing,6,3,True,True,1,0,[ORGANIZATION] : Governor [PERSON] Announces Start of Construction on ORG0 in [ORGANIZATION],"Additionally, the project was awarded a 427,150 grant for the buildout of the daycare facilities through [ORGANIZATION] for [ORGANIZATION]. [ORGANIZATION] is providing 2.1 million in construction and permanent financing toward the affordable housing portion of the project through its [ORGANIZATION]. ORG2 is providing a 7.8 million construction loan, as well as a 3.2 million ORG3-insured permanent loan financed through its partnership with [LOCATION]."
buffalo,2023-09-27T00:00:00Z,Contify Investment News,WNY,affordable housing,2,2,False,True,1,0,[ORGANIZATION] : Governor [PERSON] Announces Start of Construction on ORG0 in [ORGANIZATION],"[ORGANIZATION] ORG0 Secretary of [ORGANIZATION] said, This project will transform a vacant community eyesore into a vibrant, mixed-use community asset, which will provide much-needed affordable housing, childcare and address food access and insecurity. This innovative project is just the beginning of the Downtown Revitalization Initiatives transformative impact on the FAC0 district and a glowing testament to Governor [PERSON] broader commitment to revitalizing and re-energizing [ORGANIZATION]."
buffalo,2023-09-27T00:00:00Z,Contify Investment News,WNY,affordable housing,2,2,False,True,1,0,[ORGANIZATION] : Governor [PERSON] Announces Start of Construction on ORG0 in [ORGANIZATION],"[ORGANIZATION] [PERSON] said, 950 Broadway represents not just a building but a commitment to revitalizing our community. We are dedicated to addressing the communitys needs by delivering essential neighborhood services and affordable housing projects in collaboration with our community partners and elected officials."
buffalo,2023-09-27T00:00:00Z,Contify Investment News,WNY,affordable housing,6,2,True,True,1,0,[ORGANIZATION] : Governor [PERSON] Announces Start of Construction on ORG0 in [ORGANIZATION],"I am proud of the hard work our [ORGANIZATION] has done to complete the [ORGANIZATION] application and to help the local planning committee with project planning. In addition to the 950 Broadway project, the city secured funding for other projects in the Broadway Fillmore area such as revitalizing [ORGANIZATION], and improvements to FAC2."
buffalo,2023-09-27T00:00:00Z,Contify Investment News,WNY,affordable housing,2,2,False,True,1,0,[ORGANIZATION] : Governor [PERSON] Announces Start of Construction on ORG0 in [ORGANIZATION],"[ORGANIZATION] Member [PERSON] said, This transformative project, led by [ORGANIZATION], will breathe new life into a long-vacant building and bring affordable housing, educational opportunities, and job prospects to our neighborhood. Its a testament to the positive impact we can achieve through strategic investments, and I look forward to seeing this development flourish in the heart of [ORGANIZATION]."
buffalo,2023-09-20T00:00:00Z,PR Newswire,WNY,"homelessness, affordable housing",4,4,False,True,1,0,[ORGANIZATION] of [ORGANIZATION] of CEO,"About [ORGANIZATION] is dedicated to eliminating racism, empowering women, and promoting peace, justice, freedom, and dignity for all. Our vision is a thriving community without divide. Founded in [ORGANIZATION], [ORGANIZATION] supports over 3,000 women, children, and families [PERSON]  preventing DATE2 of homelessness for our communitys most vulnerable seniors and ensuring that 244,420 production hours are pumped into the ORG1 economy. Our programs empower women to attain self-sufficiency, youth to unlock their potential and build a path to success, seniors to secure safe, affordable housing that keeps them connected to the community, and children to grow in healthy, nurturing and enriched environments."
buffalo,2023-04-12T00:00:00Z,Business Wire,WNY,affordable housing,4,4,False,True,1,0,"[ORGANIZATION] in Dual Announcement PERSON0 and [PERSON] will assume the roles of market president in the bank's [ORGANIZATION] and [PERSON] markets, respectively","A [ORGANIZATION] member of [ORGANIZATION], [ORGANIZATION] is known for her expertise in residential and consumer lending, commercial real estate management and affordable housing development work, as well as her advocacy for financial education. In her [LOCATION] as executive director of [ORGANIZATION], [ORGANIZATION] has actively led the mission to build affordable housing developments, as well as support homeowners and renters with financial and maintenance services. In her prior position, she served as the chief credit officer of ORG2, where she managed the process and production of all lending products and oversaw the development of credit approval processes. She also spent [PERSON] as the director of community development for [ORGANIZATION], a nonprofit that seeks to improve the social and economic conditions of the Native American tribes through education and investment in affordable housing, tribal business ventures, banking the unbanked and entrepreneurship."
buffalo,2023-09-27T00:00:00Z,States News Service,WNY,affordable housing,1,1,False,True,1,0,GOVERNOR [ORGANIZATION] ANNOUNCES START OF CONSTRUCTION ON FAC0 DEVELOPMENT IN [ORGANIZATION],[ORGANIZATION] Affordable Housing Units and [ORGANIZATION]
buffalo,2017-09-07T00:00:00Z,States News Service,WNY,homeless,2,2,False,True,1,0,GOVERNOR PERSON0 ANNOUNCES $11.4 MILLION FOR SUPPORTIVE HOUSING IN GPE0 AND [PERSON],Governor [ORGANIZATION] announced more than 11.4 million in state funding for three supportive housing developments in [ORGANIZATION] and [PERSON]. The projects will create or preserve 80 units of housing for homeless New Yorkers supported by funding from [ORGANIZATION].
